{"dns":"http:\/\/morfeus.site","username":"103535311","connections":1,"password":"117174378","package":"TESTE ATIVABOX COMPLETO","createdAt":"2026-01-23 08:50:53","createdAtFormatted":"23\/01\/2026 08:50:53","expiresAt":"2026-01-23 12:50:52","expiresAtFormatted":"23\/01\/2026 12:50:52","payUrl":"https:\/\/painel.ativabox.xyz\/#\/checkout\/0m1EeVM1lE\/MeWe5a38Wn","reply":"\ud83d\udccc Dados de Acesso\n\u2705 Usu\u00e1rio: 103535311\n\u2705 Senha: 117174378\n\ud83d\udcf6 Telas Permitidas: 1\n\ud83d\uddd3\ufe0f Criado em: 23\/01\/2026 08:50:53\n\ud83d\uddd3\ufe0f Vencimento: 23\/01\/2026 12:50:52\n\ud83d\udcb3 Assinar\/Renovar: https:\/\/painel.ativabox.xyz\/#\/checkout\/0m1EeVM1lE\/MeWe5a38Wn\n\u2501\u2501\u2501\u2501\u2501\u2501\u2501\u2501\u2501\u2501\u2501\u2501\u2501\u2501\u2501\u2501\u2501\u2501\u2501\u2501\u2501\u2501\u2501\u2501\u2501\u2501\n\ud83d\udce1 Servidores DNS\n\ud83d\udfe0 DNS Principal: http:\/\/morfeus.site\n\ud83d\udfe0 DNS XC: http:\/\/morfeus.site\n\ud83d\udfe2 Web TV SMARTERS: http:\/\/83km.sbs\n\u2501\u2501\u2501\u2501\u2501\u2501\u2501\u2501\u2501\u2501\u2501\u2501\u2501\u2501\u2501\u2501\u2501\u2501\u2501\u2501\u2501\u2501\u2501\u2501\u2501\u2501\n\ud83d\udcf6 App Extra: Assist+ \/ PlaySim\nComo configurar:\nClique em Playlist\nC\u00f3digo: 15863\nUsu\u00e1rio: 103535311\nSenha: 117174378\n\u2501\u2501\u2501\u2501\u2501\u2501\u2501\u2501\u2501\u2501\u2501\u2501\u2501\u2501\u2501\u2501\u2501\u2501\u2501\u2501\u2501\u2501\u2501\u2501\u2501\u2501\n\ud83d\udd3d Links T\u00e9cnicos\n\ud83d\udfe2 M3U:\nhttp:\/\/morfeus.site\/get.php?username=103535311&password=117174378&type=m3u_plus&output=mpegts\n\ud83d\udfe1 HLS:\nhttp:\/\/morfeus.site\/get.php?username=103535311&password=117174378&type=m3u_plus&output=hls\n\ud83d\udd34 SSIPTV:\naftv.news\/p\/103535311\/117174378\/ssiptv\n\ud83d\udcfa STB \/ SmartUp IP: 200.9.154.53\n\ud83d\udcbb Assistir no Computador\n\ud83d\udfe0 Link r\u00e1pido: aftv.news\/521722\n\u27a1 Digite no navegador e acesse com qualquer nome\n\u27a1 Usu\u00e1rio: 103535311\n\u27a1 Senha: 117174378\n\ud83d\udd10 Defina uma senha de 4 d\u00edgitos para:\n\u2022 Acesso ao conte\u00fado adulto\n\u2022 Controle familiar\n\u2501\u2501\u2501\u2501\u2501\u2501\u2501\u2501\u2501\u2501\u2501\u2501\u2501\u2501\u2501\u2501\u2501\u2501\u2501\u2501\u2501\u2501\u2501\u2501\u2501\u2501\n\ud83d\udcf1 Aplicativo Parceiro \u2013 XCLOUD\n\ud83d\udfe2 App: XCLOUD\n\ud83d\udce1 Provider: 83kms1\n\ud83d\udc64 Usu\u00e1rio: 103535311\n\ud83d\udd10 Senha: 117174378\n\ud83d\udcf2 Compat\u00edvel com:\n\u2022 Samsung \u2022 LG \u2022 Roku\n\u2022 iOS \u2022 Android \u2022 Android TV\n\u2501\u2501\u2501\u2501\u2501\u2501\u2501\u2501\u2501\u2501\u2501\u2501\u2501\u2501\u2501\u2501\u2501\u2501\u2501\u2501\u2501\u2501\u2501\u2501\u2501\u2501\n\ud83c\udfac Apps Recomendados para iPhone\n\u2022 Smarters Player Lite \u2013 apps.apple.com\/br\/app\/smarters-player-lite\/id1628995509\n\u2022 XCIPTV \u2013 apps.apple.com\/us\/app\/xciptv-player\/id1582085520\n\u2022 PrimePlay \u2013 apps.apple.com\/br\/app\/primeplay\/id1557474530\n\u2022 X-Flix IPTV \u2013 apps.apple.com\/br\/app\/x-flix-iptv\/id1602766826\n\u2022 IPTV Ultra \u2013 apps.apple.com\/br\/app\/iptv-ultra\/id1549657742\n\u2022 IBO Player Pro \u2013 apps.apple.com\/app\/id1669696096\n\u2022 Blink Player Pro \u2013 apps.apple.com\/br\/app\/blink-player-pro\/id1635779666\n\u2022 Mobile TV HUB \u2013 apps.apple.com\/br\/app\/mobile-tv-hub\/id1500385182\n\u2022 GSE SMART IPTV \u2013 apps.apple.com\/br\/app\/gse-smart-iptv-tv-online\n\u2501\u2501\u2501\u2501\u2501\u2501\u2501\u2501\u2501\u2501\u2501\u2501\u2501\u2501\u2501\u2501\u2501\u2501\u2501\u2501\u2501\u2501\u2501\u2501\u2501\u2501\n\n\ud83d\udce6 Aplicativos em APK\n\ud83d\udfe1 IBO \u2013 aftv.news\/909405 \u2013 Downloader: 909405\n\ud83d\udfe1 SMART \u2013 aftv.news\/632855 \u2013 Downloader: 632855\n\u2501\u2501\u2501\u2501\u2501\u2501\u2501\u2501\u2501\u2501\u2501\u2501\u2501\u2501\u2501\u2501\u2501\u2501\u2501\u2501\u2501\u2501\u2501\u2501\u2501\u2501\n\ud83d\udcfa Configura\u00e7\u00e3o no WebPlayer\n\ud83d\udfe2 webtv.iptvsmarters.com\/switchuser.php\nPassos:\nCancelar tela inicial\nClicar em ADD PLAYLIST\nInserir usu\u00e1rio e senha\n\u2501\u2501\u2501\u2501\u2501\u2501\u2501\u2501\u2501\u2501\u2501\u2501\u2501\u2501\u2501\u2501\u2501\u2501\u2501\u2501\u2501\u2501\u2501\u2501\u2501\u2501\n\ud83c\udfea Nossa Loja de Apps\n\u2022 biobr.link\/id\n\u2022 loja.ativabox.click\n\u2022 ativabox.click","data":[{"message":"\ud83d\udccc Dados de Acesso\n\u2705 Usu\u00e1rio: 103535311\n\u2705 Senha: 117174378\n\ud83d\udcf6 Telas Permitidas: 1\n\ud83d\uddd3\ufe0f Criado em: 23\/01\/2026 08:50:53\n\ud83d\uddd3\ufe0f Vencimento: 23\/01\/2026 12:50:52\n\ud83d\udcb3 Assinar\/Renovar: https:\/\/painel.ativabox.xyz\/#\/checkout\/0m1EeVM1lE\/MeWe5a38Wn\n\u2501\u2501\u2501\u2501\u2501\u2501\u2501\u2501\u2501\u2501\u2501\u2501\u2501\u2501\u2501\u2501\u2501\u2501\u2501\u2501\u2501\u2501\u2501\u2501\u2501\u2501\n\ud83d\udce1 Servidores DNS\n\ud83d\udfe0 DNS Principal: http:\/\/morfeus.site\n\ud83d\udfe0 DNS XC: http:\/\/morfeus.site\n\ud83d\udfe2 Web TV SMARTERS: http:\/\/83km.sbs\n\u2501\u2501\u2501\u2501\u2501\u2501\u2501\u2501\u2501\u2501\u2501\u2501\u2501\u2501\u2501\u2501\u2501\u2501\u2501\u2501\u2501\u2501\u2501\u2501\u2501\u2501\n\ud83d\udcf6 App Extra: Assist+ \/ PlaySim\nComo configurar:\nClique em Playlist\nC\u00f3digo: 15863\nUsu\u00e1rio: 103535311\nSenha: 117174378\n\u2501\u2501\u2501\u2501\u2501\u2501\u2501\u2501\u2501\u2501\u2501\u2501\u2501\u2501\u2501\u2501\u2501\u2501\u2501\u2501\u2501\u2501\u2501\u2501\u2501\u2501\n\ud83d\udd3d Links T\u00e9cnicos\n\ud83d\udfe2 M3U:\nhttp:\/\/morfeus.site\/get.php?username=103535311&password=117174378&type=m3u_plus&output=mpegts\n\ud83d\udfe1 HLS:\nhttp:\/\/morfeus.site\/get.php?username=103535311&password=117174378&type=m3u_plus&output=hls\n\ud83d\udd34 SSIPTV:\naftv.news\/p\/103535311\/117174378\/ssiptv\n\ud83d\udcfa STB \/ SmartUp IP: 200.9.154.53\n\ud83d\udcbb Assistir no Computador\n\ud83d\udfe0 Link r\u00e1pido: aftv.news\/521722\n\u27a1 Digite no navegador e acesse com qualquer nome\n\u27a1 Usu\u00e1rio: 103535311\n\u27a1 Senha: 117174378\n\ud83d\udd10 Defina uma senha de 4 d\u00edgitos para:\n\u2022 Acesso ao conte\u00fado adulto\n\u2022 Controle familiar\n\u2501\u2501\u2501\u2501\u2501\u2501\u2501\u2501\u2501\u2501\u2501\u2501\u2501\u2501\u2501\u2501\u2501\u2501\u2501\u2501\u2501\u2501\u2501\u2501\u2501\u2501\n\ud83d\udcf1 Aplicativo Parceiro \u2013 XCLOUD\n\ud83d\udfe2 App: XCLOUD\n\ud83d\udce1 Provider: 83kms1\n\ud83d\udc64 Usu\u00e1rio: 103535311\n\ud83d\udd10 Senha: 117174378\n\ud83d\udcf2 Compat\u00edvel com:\n\u2022 Samsung \u2022 LG \u2022 Roku\n\u2022 iOS \u2022 Android \u2022 Android TV\n\u2501\u2501\u2501\u2501\u2501\u2501\u2501\u2501\u2501\u2501\u2501\u2501\u2501\u2501\u2501\u2501\u2501\u2501\u2501\u2501\u2501\u2501\u2501\u2501\u2501\u2501\n\ud83c\udfac Apps Recomendados para iPhone\n\u2022 Smarters Player Lite \u2013 apps.apple.com\/br\/app\/smarters-player-lite\/id1628995509\n\u2022 XCIPTV \u2013 apps.apple.com\/us\/app\/xciptv-player\/id1582085520\n\u2022 PrimePlay \u2013 apps.apple.com\/br\/app\/primeplay\/id1557474530\n\u2022 X-Flix IPTV \u2013 apps.apple.com\/br\/app\/x-flix-iptv\/id1602766826\n\u2022 IPTV Ultra \u2013 apps.apple.com\/br\/app\/iptv-ultra\/id1549657742\n\u2022 IBO Player Pro \u2013 apps.apple.com\/app\/id1669696096\n\u2022 Blink Player Pro \u2013 apps.apple.com\/br\/app\/blink-player-pro\/id1635779666\n\u2022 Mobile TV HUB \u2013 apps.apple.com\/br\/app\/mobile-tv-hub\/id1500385182\n\u2022 GSE SMART IPTV \u2013 apps.apple.com\/br\/app\/gse-smart-iptv-tv-online\n\u2501\u2501\u2501\u2501\u2501\u2501\u2501\u2501\u2501\u2501\u2501\u2501\u2501\u2501\u2501\u2501\u2501\u2501\u2501\u2501\u2501\u2501\u2501\u2501\u2501\u2501\n\n\ud83d\udce6 Aplicativos em APK\n\ud83d\udfe1 IBO \u2013 aftv.news\/909405 \u2013 Downloader: 909405\n\ud83d\udfe1 SMART \u2013 aftv.news\/632855 \u2013 Downloader: 632855\n\u2501\u2501\u2501\u2501\u2501\u2501\u2501\u2501\u2501\u2501\u2501\u2501\u2501\u2501\u2501\u2501\u2501\u2501\u2501\u2501\u2501\u2501\u2501\u2501\u2501\u2501\n\ud83d\udcfa Configura\u00e7\u00e3o no WebPlayer\n\ud83d\udfe2 webtv.iptvsmarters.com\/switchuser.php\nPassos:\nCancelar tela inicial\nClicar em ADD PLAYLIST\nInserir usu\u00e1rio e senha\n\u2501\u2501\u2501\u2501\u2501\u2501\u2501\u2501\u2501\u2501\u2501\u2501\u2501\u2501\u2501\u2501\u2501\u2501\u2501\u2501\u2501\u2501\u2501\u2501\u2501\u2501\n\ud83c\udfea Nossa Loja de Apps\n\u2022 biobr.link\/id\n\u2022 loja.ativabox.click\n\u2022 ativabox.click"}]}