{
    "dns": "http://server10.fun:80",
    "username": "433031095",
    "connections": 1,
    "password": "582318169",
    "package": "Â®ï¸ TESTE IPTV COMPLETO C/ ADULTOS Â®ï¸",
    "createdAt": "2026-01-19 02:07:33",
    "createdAtFormatted": "19/01/2026 02:07:33",
    "expiresAt": "2026-01-19 08:07:33",
    "expiresAtFormatted": "19/01/2026 08:07:33",
    "payUrl": "https://painel.blackbr.site/#/checkout/241KARvDmx/OxLApm4o1Z",
    "reply": "ğŸ“º SEJA BEM-VINDO a BLACKBR Â®ï¸\n\nğŸ“Œ SEGUE INFORMAÃ‡Ã•ES DO ACESSO.\n\nâœ… UsuÃ¡rio: 433031095\nâœ… Senha: 582318169\n\nğŸ“¦ *Plano:* Â®ï¸ TESTE IPTV COMPLETO C/ ADULTOS Â®ï¸\nğŸ’µ *PreÃ§o do Plano:* R$Â 0,00\nğŸ—“ï¸ *Criado em:* 19/01/2026 02:07:33\nğŸ—“ï¸ *Vencimento:* 19/01/2026 08:07:33\nğŸ“¶ *ConexÃµes:* 2\nğŸ’³ *Assinar/Renovar Plano:* https://painel.blackbr.site/#/checkout/241KARvDmx/OxLApm4o1Z\n\n ğŸŒ *DNS UNIVERSAL:* 1: http://server10.fun:80\n\nğŸ“º *DNS STB / SmartUp 1:* 5.161.103.130\n\nğŸŒŸ Parceria App Assist+ (Samsung, LG, Roku e Android)\ncÃ³digo: 926692\nâœ… UsuÃ¡rio: 433031095\nâœ… Senha: 582318169\n\nğŸ”µ Parceria App Brasil IPTV (Samsung, LG, Roku)\ncÃ³digo: 2027\nâœ… UsuÃ¡rio: 433031095\nâœ… Senha: 582318169\n\nğŸŒŸ Parceria App Playsim (LG, Roku e Android, em breve Samsung)\n\ncÃ³digo: 926692\nâœ… UsuÃ¡rio: 433031095\nâœ… Senha: 582318169\n\nÂ®ï¸ğŸŒ Parceria App Flex play (Samsung, LG, Roku e Android)\n\nâœ… Utilizar lista com DNS  abaixo para ativar parceria:\n\nğŸ”·*Lista Parceria Flex play* *(M3U COMPLETO):* http://parceria.parclll.site/get.php?username=433031095&password=582318169&type=m3u_plus&output=mpegts\n\nAndroid - NTDOWN \nCod: 75556\n\nâœ… Site para inserir as listas:\nhttps://flexplayer.io/#/upload-playlist\n\nÂ®ï¸  PARCERIA VIZZION PLAY (Samsung, LG, Roku e Android)\n\nâœ… CÃ³digo: 760665\nâœ… UsuÃ¡rio: 433031095\nâœ… Senha: 582318169\n\nÂ®ï¸ â PARCERIA XCLOUD (Samsung, LG, Roku e Firestick)\n\nProvider: sv222\nâœ… UsuÃ¡rio: 433031095\nâœ… Senha: 582318169\n\nâ­ Parceria apps TOP PLAY e MAGIC PLAY (Tv Roku e IOS)\nCÃ³digo: 1273\nâœ… UsuÃ¡rio: 433031095\nâœ… Senha: 582318169\n\nğŸŒ Parceria Apps Multiapps (Samsung, LG, Roku e Android)\n\nIPTV Player io\nIPTV OTT player\nIPTV 4K\nIPTV Stream player,\nIPTV Player\nIPTV Play\nIPTV Plus\nIPTV Pro\nPRO Player\nIPTV Star\nTVIP PLAYER\nEGO IPTV\nSCANDIC IPTV\nFlixtra Player\n\nâœ… Utilizar lista com DNS abaixo para ativar parceria:\n\nğŸŒ*Lista Parceria* *(M3U COMPLETO):* http://server10.fun/get.php?username=433031095&password=582318169&type=m3u_plus&output=mpegts\n\nÂ®ï¸ APP PARCEIRO - ANDROID\n\nğŸ”¹ APP UNI TV\n\nğŸ”— Download direto\nğŸ“Œ CÃ³digo NTDOWN: 51744\nğŸ“¥ Downloader: 9387398\nğŸŒ Link direto: http://aftv.news/9387398\n\nğŸ”¹ APP HOME PLAYER XTREAM\n\nğŸ”— Download direto\nğŸ“Œ CÃ³digo NTDOWN: 63334\nğŸ“¥ Downloader: 6245886\nğŸŒ Link direto: http://aftv.news/6245886\n\nğŸ”¹ APP ROCKET\n\nğŸ”— Download direto\nğŸ“Œ CÃ³digo NTDOWN: 14447\nğŸ“¥ Downloader: 6220831\nğŸŒ Link direto: http://aftv.news/6220831\n\nğŸ”¹ APP ZINK\n\nğŸ”— Download direto\nğŸ“Œ CÃ³digo NTDOWN: 68618\nğŸ“¥ Downloader: 1650495\nğŸŒ Link direto: http://aftv.news/1650495\n\nğŸ”¹ APP HOME PLAYER\n\nğŸ”— Download direto\nğŸ“Œ CÃ³digo NTDOWN: 28558\nğŸ“¥ Downloader: 8845054\nğŸŒ Link direto: http://aftv.news/8845054\n\nAPP TOP TV â–¶ï¸\nğŸ“¥ Link para download:\nğŸ”‘ CÃ³digo: 4710019\nğŸ”— Downloader: aftv.news/4710019\n\nAcesso via usuÃ¡rio e senha:\n\nâœ… UsuÃ¡rio: 433031095\nâœ… Senha: 582318169\n\nÂ®ï¸ APP PRÃ“PRIO PARA ANDROID \n \nğŸ“º Para TVs Android â€“ BLACK IBO\n\nğŸ“º IBO BLACK BR \nğŸ”‘ CÃ³digo Downloader : 8297075\nğŸ”— Link Downloader: aftv.news/8297075\n\nÂ®ï¸ *OpÃ§Ã£o 1 (M3U COMPLETO):* http://server10.fun:80/get.php?username=433031095&password=582318169&type=m3u_plus&output=mpegts\n\nÂ®ï¸ *OpÃ§Ã£o 2 (M3U COMPLETO):* http://black.rota2.fun/get.php?username=433031095&password=582318169&type=m3u_plus&output=mpegts\n\nÂ®ï¸ *Link Curto (M3U):* http://e.server10.fun/p/433031095/582318169/m3u\n \nÂ®ï¸ *Link (HLS):* http://server10.fun:80/get.php?username=433031095&password=582318169&type=m3u_plus&output=hls\n \nÂ®ï¸ *Link Curto (HLS):* http://e.server10.fun/p/433031095/582318169/hls\n \nÂ®ï¸ *Link (SSIPTV):* http://e.server10.fun/p/433031095/582318169/ssiptv\n\nBlackBr Â®ï¸",
    "data": [
        {
            "message": "ğŸ“º SEJA BEM-VINDO a BLACKBR Â®ï¸\n\nğŸ“Œ SEGUE INFORMAÃ‡Ã•ES DO ACESSO.\n\nâœ… UsuÃ¡rio: 433031095\nâœ… Senha: 582318169\n\nğŸ“¦ *Plano:* Â®ï¸ TESTE IPTV COMPLETO C/ ADULTOS Â®ï¸\nğŸ’µ *PreÃ§o do Plano:* R$Â 0,00\nğŸ—“ï¸ *Criado em:* 19/01/2026 02:07:33\nğŸ—“ï¸ *Vencimento:* 19/01/2026 08:07:33\nğŸ“¶ *ConexÃµes:* 2\nğŸ’³ *Assinar/Renovar Plano:* https://painel.blackbr.site/#/checkout/241KARvDmx/OxLApm4o1Z\n\n ğŸŒ *DNS UNIVERSAL:* 1: http://server10.fun:80\n\nğŸ“º *DNS STB / SmartUp 1:* 5.161.103.130\n\nğŸŒŸ Parceria App Assist+ (Samsung, LG, Roku e Android)\ncÃ³digo: 926692\nâœ… UsuÃ¡rio: 433031095\nâœ… Senha: 582318169\n\nğŸ”µ Parceria App Brasil IPTV (Samsung, LG, Roku)\ncÃ³digo: 2027\nâœ… UsuÃ¡rio: 433031095\nâœ… Senha: 582318169\n\nğŸŒŸ Parceria App Playsim (LG, Roku e Android, em breve Samsung)\n\ncÃ³digo: 926692\nâœ… UsuÃ¡rio: 433031095\nâœ… Senha: 582318169\n\nÂ®ï¸ğŸŒ Parceria App Flex play (Samsung, LG, Roku e Android)\n\nâœ… Utilizar lista com DNS  abaixo para ativar parceria:\n\nğŸ”·*Lista Parceria Flex play* *(M3U COMPLETO):* http://parceria.parclll.site/get.php?username=433031095&password=582318169&type=m3u_plus&output=mpegts\n\nAndroid - NTDOWN \nCod: 75556\n\nâœ… Site para inserir as listas:\nhttps://flexplayer.io/#/upload-playlist\n\nÂ®ï¸  PARCERIA VIZZION PLAY (Samsung, LG, Roku e Android)\n\nâœ… CÃ³digo: 760665\nâœ… UsuÃ¡rio: 433031095\nâœ… Senha: 582318169\n\nÂ®ï¸ â PARCERIA XCLOUD (Samsung, LG, Roku e Firestick)\n\nProvider: sv222\nâœ… UsuÃ¡rio: 433031095\nâœ… Senha: 582318169\n\nâ­ Parceria apps TOP PLAY e MAGIC PLAY (Tv Roku e IOS)\nCÃ³digo: 1273\nâœ… UsuÃ¡rio: 433031095\nâœ… Senha: 582318169\n\nğŸŒ Parceria Apps Multiapps (Samsung, LG, Roku e Android)\n\nIPTV Player io\nIPTV OTT player\nIPTV 4K\nIPTV Stream player,\nIPTV Player\nIPTV Play\nIPTV Plus\nIPTV Pro\nPRO Player\nIPTV Star\nTVIP PLAYER\nEGO IPTV\nSCANDIC IPTV\nFlixtra Player\n\nâœ… Utilizar lista com DNS abaixo para ativar parceria:\n\nğŸŒ*Lista Parceria* *(M3U COMPLETO):* http://server10.fun/get.php?username=433031095&password=582318169&type=m3u_plus&output=mpegts\n\nÂ®ï¸ APP PARCEIRO - ANDROID\n\nğŸ”¹ APP UNI TV\n\nğŸ”— Download direto\nğŸ“Œ CÃ³digo NTDOWN: 51744\nğŸ“¥ Downloader: 9387398\nğŸŒ Link direto: http://aftv.news/9387398\n\nğŸ”¹ APP HOME PLAYER XTREAM\n\nğŸ”— Download direto\nğŸ“Œ CÃ³digo NTDOWN: 63334\nğŸ“¥ Downloader: 6245886\nğŸŒ Link direto: http://aftv.news/6245886\n\nğŸ”¹ APP ROCKET\n\nğŸ”— Download direto\nğŸ“Œ CÃ³digo NTDOWN: 14447\nğŸ“¥ Downloader: 6220831\nğŸŒ Link direto: http://aftv.news/6220831\n\nğŸ”¹ APP ZINK\n\nğŸ”— Download direto\nğŸ“Œ CÃ³digo NTDOWN: 68618\nğŸ“¥ Downloader: 1650495\nğŸŒ Link direto: http://aftv.news/1650495\n\nğŸ”¹ APP HOME PLAYER\n\nğŸ”— Download direto\nğŸ“Œ CÃ³digo NTDOWN: 28558\nğŸ“¥ Downloader: 8845054\nğŸŒ Link direto: http://aftv.news/8845054\n\nAPP TOP TV â–¶ï¸\nğŸ“¥ Link para download:\nğŸ”‘ CÃ³digo: 4710019\nğŸ”— Downloader: aftv.news/4710019\n\nAcesso via usuÃ¡rio e senha:\n\nâœ… UsuÃ¡rio: 433031095\nâœ… Senha: 582318169\n\nÂ®ï¸ APP PRÃ“PRIO PARA ANDROID \n \nğŸ“º Para TVs Android â€“ BLACK IBO\n\nğŸ“º IBO BLACK BR \nğŸ”‘ CÃ³digo Downloader : 8297075\nğŸ”— Link Downloader: aftv.news/8297075\n\nÂ®ï¸ *OpÃ§Ã£o 1 (M3U COMPLETO):* http://server10.fun:80/get.php?username=433031095&password=582318169&type=m3u_plus&output=mpegts\n\nÂ®ï¸ *OpÃ§Ã£o 2 (M3U COMPLETO):* http://black.rota2.fun/get.php?username=433031095&password=582318169&type=m3u_plus&output=mpegts\n\nÂ®ï¸ *Link Curto (M3U):* http://e.server10.fun/p/433031095/582318169/m3u\n \nÂ®ï¸ *Link (HLS):* http://server10.fun:80/get.php?username=433031095&password=582318169&type=m3u_plus&output=hls\n \nÂ®ï¸ *Link Curto (HLS):* http://e.server10.fun/p/433031095/582318169/hls\n \nÂ®ï¸ *Link (SSIPTV):* http://e.server10.fun/p/433031095/582318169/ssiptv\n\nBlackBr Â®ï¸"
        }
    ]
}