{"dns":"http:\/\/rynox.top","username":"908604156130","connections":1,"password":"466399937294","package":"\ud83d\udcfa4H TESTE COMPLETO C\/ADULTO","createdAt":"2026-01-29 18:32:56","createdAtFormatted":"29\/01\/2026 18:32:56","expiresAt":"2026-01-29 22:32:55","expiresAtFormatted":"29\/01\/2026 22:32:55","payUrl":"https:\/\/cyberflix.cloud\/#\/checkout\/g516M0XWjl\/K4WrkwMO1e","reply":"\ud83d\udd30 BEM-VINDO(A) \ud83d\udd30\n\ud83d\udca0 SEUS DADOS DE ACESSO\n\ud83c\udf10 Acesso Principal\n\n\ud83d\uded1 DNS: http:\/\/rynox.top\n\ud83d\udfe0 DNS SMARTERS: http:\/\/kalista.top\n\ud83d\udc64 Usu\u00e1rio: 908604156130\n\ud83d\udd11 Senha: 466399937294\n\ud83d\udd17 Lista M3U:\nhttp:\/\/rynox.top\/get.php?username=908604156130&password=466399937294&type=m3u_plus&output=mpegts\n\n\ud83d\udca5 VIZZION PLAY\n\n\ud83c\udd94 C\u00f3digo: 169052\n\ud83d\udc64 Usu\u00e1rio: 908604156130\n\ud83d\udd11 Senha: 466399937294\n\n\n\ud83d\udca5 LAZER PLAYER\n\n\ud83c\udd94 C\u00f3digo: 3080\n\ud83d\udc64 Usu\u00e1rio: 908604156130\n\ud83d\udd11 Senha: 466399937294\n\n\ud83d\udee1\ufe0f PLAY SIM\n\n\ud83c\udd94 C\u00f3digo: 938124\n\ud83d\udc64 Usu\u00e1rio: 908604156130\n\ud83d\udd11 Senha: 466399937294\n\n\ud83c\udf9b\ufe0f ASSIST+\n\n\ud83c\udd94 C\u00f3digo: 938124\n\ud83d\udc64 Usu\u00e1rio: 908604156130\n\ud83d\udd11 Senha: 466399937294\n\n\ud83d\udd39 Downloader Assist+: 8209473\n\ud83d\udd39 NTDOWN Assist+: 77646\n\n\ud83d\udcfa Compat\u00edvel com TVs: LG \u2022 Samsung \u2022 Roku \u2022 TCL\n\n\ud83d\udce6 INFORMA\u00c7\u00d5ES DO PLANO\n\n\ud83d\udce6 Plano: \ud83d\udcfa4H TESTE COMPLETO C\/ADULTO\n\ud83d\udcb3 Assinar\/Renovar: https:\/\/cyberflix.cloud\/#\/checkout\/g516M0XWjl\/K4WrkwMO1e\n\ud83d\udcb5 Valor: R$\u00a00,00\n\ud83d\udcc5 Criado em: 29\/01\/2026 18:32:56\n\ud83d\udcc5 Vencimento: 29\/01\/2026 22:32:55\n\ud83d\udcf6 Conex\u00f5es: 2\n\n\ud83d\udd17 LISTAS E LINKS \u00daTEIS\n\ud83d\udccc M3U CLODDY\n\nhttp:\/\/rynox.top\/get.php?username=908604156130&password=466399937294&type=m3u_plus&output=m3u8\n\n\ud83d\uddc2\ufe0f EPG\n\nhttp:\/\/rynox.top\/xmltv.php?username=908604156130&password=466399937294&next_days=7\n\n\ud83d\udd17 Link Curto M3U\n\nhttp:\/\/e.rynox.top\/p\/908604156130\/466399937294\/m3u\n\n\ud83d\udd17 Link HLS\n\nhttp:\/\/rynox.top\/get.php?username=908604156130&password=466399937294&type=m3u_plus&output=hls\n\n\ud83d\udd17 Link Curto HLS\n\nhttp:\/\/e.rynox.top\/p\/908604156130\/466399937294\/hls\n\n\ud83d\udd17 Link SSIPTV\n\nhttp:\/\/e.rynox.top\/p\/908604156130\/466399937294\/ssiptv\n\n\ud83d\udda5\ufe0f DNS STB \/ SMARTUP\n\n\u2733\ufe0f Principal: 45.39.210.32 (C\u00f3digo 1010)\n\u2733\ufe0f Estilo Netflix: 167.114.4.164\n\u2733\ufe0f Vers\u00e3o V3: 5.161.77.87\n\n\ud83c\udf10 WebPlayer Principal: http:\/\/app.neoplayer.com.br\n\nCodigo: 1010\n\ud83d\udc64 Usu\u00e1rio: 908604156130\n\ud83d\udd11 Senha: 466399937294\n\n\ud83d\udcf1APP PLAY STORE \n NOME DO APP:\nRP725\nC\u00d3DIGO: 22405686\nSERVIDOR: PREMIUM\n\ud83d\udd17 LINK: https:\/\/play.google.com\/store\/apps\/details?id=rp.rp725\n\ud83d\udc64 Usu\u00e1rio: 908604156130\n\ud83d\udd11 Senha: 466399937294\n\n\ud83d\udcf1 APLICATIVOS AXXIS\n\n\ud83d\udcf2 AXXIS IBO\n\n\ud83d\udd17 Download: https:\/\/dl.ntdev.in\/62811\n\n\ud83d\udd39 C\u00f3digo NTDOWN: 62811\n\ud83d\udd39 C\u00f3digo Downloader: 6546482\n\n\n\ud83d\udcf2 AXXIS UNI R\n\n\ud83d\udd17 Download: \nhttps:\/\/aftv.news\/3030015\n\n\ud83d\udd39 C\u00f3digo NTDOWN: \n84251\n\n\ud83d\udd39 C\u00f3digo Downloader: \n3030015\n\n\ud83d\udcf1 NEOFLIX+ \n\n\ud83d\udd17 DOWNLOAD:\nhttps:\/\/aftv.news\/5598288\n\n\ud83d\udd39 C\u00f3digo NTDOWN: \n\n\n\ud83d\udd39 C\u00f3digo DOWNLOADER:\n5598288","data":[{"message":"\ud83d\udd30 BEM-VINDO(A) \ud83d\udd30\n\ud83d\udca0 SEUS DADOS DE ACESSO\n\ud83c\udf10 Acesso Principal\n\n\ud83d\uded1 DNS: http:\/\/rynox.top\n\ud83d\udfe0 DNS SMARTERS: http:\/\/kalista.top\n\ud83d\udc64 Usu\u00e1rio: 908604156130\n\ud83d\udd11 Senha: 466399937294\n\ud83d\udd17 Lista M3U:\nhttp:\/\/rynox.top\/get.php?username=908604156130&password=466399937294&type=m3u_plus&output=mpegts\n\n\ud83d\udca5 VIZZION PLAY\n\n\ud83c\udd94 C\u00f3digo: 169052\n\ud83d\udc64 Usu\u00e1rio: 908604156130\n\ud83d\udd11 Senha: 466399937294\n\n\n\ud83d\udca5 LAZER PLAYER\n\n\ud83c\udd94 C\u00f3digo: 3080\n\ud83d\udc64 Usu\u00e1rio: 908604156130\n\ud83d\udd11 Senha: 466399937294\n\n\ud83d\udee1\ufe0f PLAY SIM\n\n\ud83c\udd94 C\u00f3digo: 938124\n\ud83d\udc64 Usu\u00e1rio: 908604156130\n\ud83d\udd11 Senha: 466399937294\n\n\ud83c\udf9b\ufe0f ASSIST+\n\n\ud83c\udd94 C\u00f3digo: 938124\n\ud83d\udc64 Usu\u00e1rio: 908604156130\n\ud83d\udd11 Senha: 466399937294\n\n\ud83d\udd39 Downloader Assist+: 8209473\n\ud83d\udd39 NTDOWN Assist+: 77646\n\n\ud83d\udcfa Compat\u00edvel com TVs: LG \u2022 Samsung \u2022 Roku \u2022 TCL\n\n\ud83d\udce6 INFORMA\u00c7\u00d5ES DO PLANO\n\n\ud83d\udce6 Plano: \ud83d\udcfa4H TESTE COMPLETO C\/ADULTO\n\ud83d\udcb3 Assinar\/Renovar: https:\/\/cyberflix.cloud\/#\/checkout\/g516M0XWjl\/K4WrkwMO1e\n\ud83d\udcb5 Valor: R$\u00a00,00\n\ud83d\udcc5 Criado em: 29\/01\/2026 18:32:56\n\ud83d\udcc5 Vencimento: 29\/01\/2026 22:32:55\n\ud83d\udcf6 Conex\u00f5es: 2\n\n\ud83d\udd17 LISTAS E LINKS \u00daTEIS\n\ud83d\udccc M3U CLODDY\n\nhttp:\/\/rynox.top\/get.php?username=908604156130&password=466399937294&type=m3u_plus&output=m3u8\n\n\ud83d\uddc2\ufe0f EPG\n\nhttp:\/\/rynox.top\/xmltv.php?username=908604156130&password=466399937294&next_days=7\n\n\ud83d\udd17 Link Curto M3U\n\nhttp:\/\/e.rynox.top\/p\/908604156130\/466399937294\/m3u\n\n\ud83d\udd17 Link HLS\n\nhttp:\/\/rynox.top\/get.php?username=908604156130&password=466399937294&type=m3u_plus&output=hls\n\n\ud83d\udd17 Link Curto HLS\n\nhttp:\/\/e.rynox.top\/p\/908604156130\/466399937294\/hls\n\n\ud83d\udd17 Link SSIPTV\n\nhttp:\/\/e.rynox.top\/p\/908604156130\/466399937294\/ssiptv\n\n\ud83d\udda5\ufe0f DNS STB \/ SMARTUP\n\n\u2733\ufe0f Principal: 45.39.210.32 (C\u00f3digo 1010)\n\u2733\ufe0f Estilo Netflix: 167.114.4.164\n\u2733\ufe0f Vers\u00e3o V3: 5.161.77.87\n\n\ud83c\udf10 WebPlayer Principal: http:\/\/app.neoplayer.com.br\n\nCodigo: 1010\n\ud83d\udc64 Usu\u00e1rio: 908604156130\n\ud83d\udd11 Senha: 466399937294\n\n\ud83d\udcf1APP PLAY STORE \n NOME DO APP:\nRP725\nC\u00d3DIGO: 22405686\nSERVIDOR: PREMIUM\n\ud83d\udd17 LINK: https:\/\/play.google.com\/store\/apps\/details?id=rp.rp725\n\ud83d\udc64 Usu\u00e1rio: 908604156130\n\ud83d\udd11 Senha: 466399937294\n\n\ud83d\udcf1 APLICATIVOS AXXIS\n\n\ud83d\udcf2 AXXIS IBO\n\n\ud83d\udd17 Download: https:\/\/dl.ntdev.in\/62811\n\n\ud83d\udd39 C\u00f3digo NTDOWN: 62811\n\ud83d\udd39 C\u00f3digo Downloader: 6546482\n\n\n\ud83d\udcf2 AXXIS UNI R\n\n\ud83d\udd17 Download: \nhttps:\/\/aftv.news\/3030015\n\n\ud83d\udd39 C\u00f3digo NTDOWN: \n84251\n\n\ud83d\udd39 C\u00f3digo Downloader: \n3030015\n\n\ud83d\udcf1 NEOFLIX+ \n\n\ud83d\udd17 DOWNLOAD:\nhttps:\/\/aftv.news\/5598288\n\n\ud83d\udd39 C\u00f3digo NTDOWN: \n\n\n\ud83d\udd39 C\u00f3digo DOWNLOADER:\n5598288"}]}