{"dns":"http:\/\/iptv2.glloball.shop:80","username":"793345","connections":1,"password":"886692","package":"\ud83e\udd0dTESTE 1HR || COMPLETO\ud83e\udd0d","createdAt":"2026-01-29 18:33:00","createdAtFormatted":"29\/01\/2026 18:33:00","expiresAt":"2026-01-29 19:32:59","expiresAtFormatted":"29\/01\/2026 19:32:59","payUrl":"https:\/\/global.mplll.com\/#\/checkout\/oQ1Y37GDON\/QBWQ0Xa3DG","reply":"\ud83e\udd0d \u25ac\u25ac\u25ac\u25ac\u25ac\u25ac\u25ac \u2726 \u25ac\u25ac\u25ac\u25ac\u25ac\u25ac\u25ac \ud83e\udd0d\n      \ud83c\udf1f IPTV 2 - ACESSO VIP \ud83c\udf1f\n\ud83e\udd0d \u25ac\u25ac\u25ac\u25ac\u25ac\u25ac\u25ac \u2726 \u25ac\u25ac\u25ac\u25ac\u25ac\u25ac\u25ac \ud83e\udd0d\n\n\ud83d\udcdd \u2501\u2501\u2501 DETALHES DA ASSINATURA \u2501\u2501\u2501 \ud83d\udcdd\n\u2503 \n\u2503 \u2705 PLANO: \ud83e\udd0dTESTE 1HR || COMPLETO\ud83e\udd0d\n\u2503 \ud83d\udcb5 VALOR: R$\u00a00,00\n\u2503 \ud83d\udc68\u200d\ud83d\udcbb TELAS: 1\n\u2503 \ud83d\udcc6 VENCIMENTO: 29\/01\/2026 19:32:59\n\u2503 \n\ud83d\udcb3 \u2501\u2501\u2501 RENOVA\u00c7\u00c3O \/ PAGAMENTO \u2501\u2501\u2501 \ud83d\udcb3\n\u2503 \n\u2503 \ud83d\udd17 ACESSE AQUI: https:\/\/global.mplll.com\/#\/checkout\/oQ1Y37GDON\/QBWQ0Xa3DG\n\u2503 \n\ud83d\udd11 \u2501\u2501\u2501 SEUS DADOS DE ACESSO \u2501\u2501\u2501 \ud83d\udd11\n\u2503 \n\u2503 \ud83d\udc64 USU\u00c1RIO: 793345\n\u2503 \ud83d\udd10 SENHA: 886692\n\u2503 \n\ud83c\udf10 \u2501\u2501\u2501 SERVIDORES (DNS) \u2501\u2501\u2501 \ud83c\udf10\n\u2503 \n\u2503 \ud83d\udce1 PARA SMARTERS: http:\/\/2iptv.glloball.shop:80\n\u2503 \ud83d\udce1 PARA XCIPTV: http:\/\/iptv2.glloball.shop:80\n\u2503 \n\ud83d\udcfa \u2501\u2501\u2501 APLICATIVOS PARCEIROS \u2501\u2501\u2501 \ud83d\udcfa\n(Samsung, LG, Roku, Android, TCL, iOS)\n\u2503 \n\u2503 \ud83c\udd94 C\u00d3DIGO: 251 \u2794 Assist+ | Playsim\n\u2503 \ud83c\udd94 C\u00d3DIGO: 2027 \u2794 Brasil IPTV\n\u2503 \ud83c\udd94 C\u00d3DIGO: 687524 \u2794 Vizzion Play\n\u2503 \ud83c\udd94 C\u00d3DIGO: 1273 \u2794 Top Play | Magic Play\n\u2503 \u2601\ufe0f XCloud TV (Parceria Exclusiva)\n\u2503 \ud83c\udd94 PROVEDOR: pd\n\u2503 \ud83d\udc64 USU\u00c1RIO: 793345 | \ud83d\udd10 SENHA: 886692\n\u2503 \n\u2699\ufe0f \u2501\u2501\u2501 SMART TV (SAMSUNG \/ LG) \u2501\u2501\u2501 \u2699\ufe0f\n\u2503 \n\u2503 \ud83d\udcfa APP: SMARTUP \/ STB\n\u2503 \ud83c\udf10 DNS: 5.161.103.130\n\u2503 \ud83d\udc64 USU\u00c1RIO: 793345 | \ud83d\udd10 SENHA: 886692\n\u2503 \n\ud83d\udee0\ufe0f \u2501\u2501\u2501 ATIVA\u00c7\u00c3O POR LISTA (URL) \u2501\u2501\u2501 \ud83d\udee0\ufe0f\n\u2503 \n\u2503 \ud83d\udd18 FLEX PLAY (Samsung, LG, Roku)\n\u2503 \ud83c\udf10 Site: https:\/\/flexplayer.io\/#\/upload-playlist\n\u2503 \ud83d\udce5 Android (NTDOWN): 75556\n\u2503 \ud83d\udd17 Lista: http:\/\/parceria.parclll.site\/get.php?username=793345&password=886692&type=m3u_plus&output=mpegts\n\u2503 \n\u2503 \ud83d\udd18 MULTIAPPS (IPTV Player io, OTT Player, \n\u2503 IPTV 4K, Stream Player, Pro Player, etc.)\n\u2503 \ud83d\udd17 Lista: http:\/\/server10.fun\/get.php?username=793345&password=886692&type=m3u_plus&output=mpegts\n\u2503 \n\ud83d\udce5 \u2501\u2501\u2501 BAIXAR NO ANDROID \/ TV BOX \u2501\u2501\u2501 \ud83d\udce5\n\u2503 \n\u2503 \ud83d\uded2 LOJA VIP: https:\/\/global.pds01.site\/\n\u2503 \n\u2503 \ud83d\udcfa IBO GLOBAL\n\u2503 \ud83d\udce5 Downloader: 7339409\n\u2503 \ud83d\udcfa GLOBAL XC 3D \u2794 Downloader: 5763684\n\u2503 \ud83d\udcfa GLOBAL PLAY UNI \u2794 Downloader: 9772871\n\u2503 \n\ud83d\udd17 \u2501\u2501\u2501 LISTAS DIRETAS (URL) \u2501\u2501\u2501 \ud83d\udd17\n\u2503 \n\u2503 \ud83d\ude80 RECOMENDADO (HLS):\n\u2503 \ud83d\udd17 http:\/\/iptv2.glloball.shop:80\/get.php?username=793345&password=886692&type=m3u_plus&output=hls\n\u2503 \n\u2503 \ud83c\udf9e\ufe0f OP\u00c7\u00c3O 2 (MPEG-TS):\n\u2503 \ud83d\udd17 http:\/\/iptv2.glloball.shop:80\/get.php?username=793345&password=886692&type=m3u_plus&output=mpegts\n\u2503 \n\u2503 \ud83d\udcfa SMART TV (SSIPTV):\n\u2503 \ud83d\udd17 http:\/\/e.iptv2.glloball.shop\/p\/793345\/886692\/ssiptv\n\u2503\n\u2501\u2501\u2501\u2501\u2501\u2501\u2501\u2501\u2501\u2501\u2501\u2501\u2501\u2501\u2501\u2501\u2501\u2501\u2501\u2501\u2501\u2501\u2501\u2501\n\ud83d\udce9 D\u00favidas? Estamos \u00e0 disposi\u00e7\u00e3o! \ud83e\udd1d","data":[{"message":"\ud83e\udd0d \u25ac\u25ac\u25ac\u25ac\u25ac\u25ac\u25ac \u2726 \u25ac\u25ac\u25ac\u25ac\u25ac\u25ac\u25ac \ud83e\udd0d\n      \ud83c\udf1f IPTV 2 - ACESSO VIP \ud83c\udf1f\n\ud83e\udd0d \u25ac\u25ac\u25ac\u25ac\u25ac\u25ac\u25ac \u2726 \u25ac\u25ac\u25ac\u25ac\u25ac\u25ac\u25ac \ud83e\udd0d\n\n\ud83d\udcdd \u2501\u2501\u2501 DETALHES DA ASSINATURA \u2501\u2501\u2501 \ud83d\udcdd\n\u2503 \n\u2503 \u2705 PLANO: \ud83e\udd0dTESTE 1HR || COMPLETO\ud83e\udd0d\n\u2503 \ud83d\udcb5 VALOR: R$\u00a00,00\n\u2503 \ud83d\udc68\u200d\ud83d\udcbb TELAS: 1\n\u2503 \ud83d\udcc6 VENCIMENTO: 29\/01\/2026 19:32:59\n\u2503 \n\ud83d\udcb3 \u2501\u2501\u2501 RENOVA\u00c7\u00c3O \/ PAGAMENTO \u2501\u2501\u2501 \ud83d\udcb3\n\u2503 \n\u2503 \ud83d\udd17 ACESSE AQUI: https:\/\/global.mplll.com\/#\/checkout\/oQ1Y37GDON\/QBWQ0Xa3DG\n\u2503 \n\ud83d\udd11 \u2501\u2501\u2501 SEUS DADOS DE ACESSO \u2501\u2501\u2501 \ud83d\udd11\n\u2503 \n\u2503 \ud83d\udc64 USU\u00c1RIO: 793345\n\u2503 \ud83d\udd10 SENHA: 886692\n\u2503 \n\ud83c\udf10 \u2501\u2501\u2501 SERVIDORES (DNS) \u2501\u2501\u2501 \ud83c\udf10\n\u2503 \n\u2503 \ud83d\udce1 PARA SMARTERS: http:\/\/2iptv.glloball.shop:80\n\u2503 \ud83d\udce1 PARA XCIPTV: http:\/\/iptv2.glloball.shop:80\n\u2503 \n\ud83d\udcfa \u2501\u2501\u2501 APLICATIVOS PARCEIROS \u2501\u2501\u2501 \ud83d\udcfa\n(Samsung, LG, Roku, Android, TCL, iOS)\n\u2503 \n\u2503 \ud83c\udd94 C\u00d3DIGO: 251 \u2794 Assist+ | Playsim\n\u2503 \ud83c\udd94 C\u00d3DIGO: 2027 \u2794 Brasil IPTV\n\u2503 \ud83c\udd94 C\u00d3DIGO: 687524 \u2794 Vizzion Play\n\u2503 \ud83c\udd94 C\u00d3DIGO: 1273 \u2794 Top Play | Magic Play\n\u2503 \u2601\ufe0f XCloud TV (Parceria Exclusiva)\n\u2503 \ud83c\udd94 PROVEDOR: pd\n\u2503 \ud83d\udc64 USU\u00c1RIO: 793345 | \ud83d\udd10 SENHA: 886692\n\u2503 \n\u2699\ufe0f \u2501\u2501\u2501 SMART TV (SAMSUNG \/ LG) \u2501\u2501\u2501 \u2699\ufe0f\n\u2503 \n\u2503 \ud83d\udcfa APP: SMARTUP \/ STB\n\u2503 \ud83c\udf10 DNS: 5.161.103.130\n\u2503 \ud83d\udc64 USU\u00c1RIO: 793345 | \ud83d\udd10 SENHA: 886692\n\u2503 \n\ud83d\udee0\ufe0f \u2501\u2501\u2501 ATIVA\u00c7\u00c3O POR LISTA (URL) \u2501\u2501\u2501 \ud83d\udee0\ufe0f\n\u2503 \n\u2503 \ud83d\udd18 FLEX PLAY (Samsung, LG, Roku)\n\u2503 \ud83c\udf10 Site: https:\/\/flexplayer.io\/#\/upload-playlist\n\u2503 \ud83d\udce5 Android (NTDOWN): 75556\n\u2503 \ud83d\udd17 Lista: http:\/\/parceria.parclll.site\/get.php?username=793345&password=886692&type=m3u_plus&output=mpegts\n\u2503 \n\u2503 \ud83d\udd18 MULTIAPPS (IPTV Player io, OTT Player, \n\u2503 IPTV 4K, Stream Player, Pro Player, etc.)\n\u2503 \ud83d\udd17 Lista: http:\/\/server10.fun\/get.php?username=793345&password=886692&type=m3u_plus&output=mpegts\n\u2503 \n\ud83d\udce5 \u2501\u2501\u2501 BAIXAR NO ANDROID \/ TV BOX \u2501\u2501\u2501 \ud83d\udce5\n\u2503 \n\u2503 \ud83d\uded2 LOJA VIP: https:\/\/global.pds01.site\/\n\u2503 \n\u2503 \ud83d\udcfa IBO GLOBAL\n\u2503 \ud83d\udce5 Downloader: 7339409\n\u2503 \ud83d\udcfa GLOBAL XC 3D \u2794 Downloader: 5763684\n\u2503 \ud83d\udcfa GLOBAL PLAY UNI \u2794 Downloader: 9772871\n\u2503 \n\ud83d\udd17 \u2501\u2501\u2501 LISTAS DIRETAS (URL) \u2501\u2501\u2501 \ud83d\udd17\n\u2503 \n\u2503 \ud83d\ude80 RECOMENDADO (HLS):\n\u2503 \ud83d\udd17 http:\/\/iptv2.glloball.shop:80\/get.php?username=793345&password=886692&type=m3u_plus&output=hls\n\u2503 \n\u2503 \ud83c\udf9e\ufe0f OP\u00c7\u00c3O 2 (MPEG-TS):\n\u2503 \ud83d\udd17 http:\/\/iptv2.glloball.shop:80\/get.php?username=793345&password=886692&type=m3u_plus&output=mpegts\n\u2503 \n\u2503 \ud83d\udcfa SMART TV (SSIPTV):\n\u2503 \ud83d\udd17 http:\/\/e.iptv2.glloball.shop\/p\/793345\/886692\/ssiptv\n\u2503\n\u2501\u2501\u2501\u2501\u2501\u2501\u2501\u2501\u2501\u2501\u2501\u2501\u2501\u2501\u2501\u2501\u2501\u2501\u2501\u2501\u2501\u2501\u2501\u2501\n\ud83d\udce9 D\u00favidas? Estamos \u00e0 disposi\u00e7\u00e3o! \ud83e\udd1d"}]}