{
    "dns": "http://iptv1.glloball.shop:80",
    "username": "205101",
    "connections": 1,
    "password": "443655",
    "package": "💜TESTE 3HRS || SEM ADULTOS💜",
    "createdAt": "2026-01-18 21:17:41",
    "createdAtFormatted": "18/01/2026 21:17:41",
    "expiresAt": "2026-01-19 00:17:41",
    "expiresAtFormatted": "19/01/2026 00:17:41",
    "payUrl": "https://global.mplll.com/#/checkout/oQ1Y37GDON/loL7aM5jWX",
    "reply": "💜 ▬▬▬▬▬▬▬ ✦ ▬▬▬▬▬▬▬ 💜\n      🌟 IPTV 1 - ACESSO VIP 🌟\n💜 ▬▬▬▬▬▬▬ ✦ ▬▬▬▬▬▬▬ 💜\n\n📝 ━━━ DETALHES DA ASSINATURA ━━━ 📝\n┃ \n┃ ✅ PLANO: 💜TESTE 3HRS || SEM ADULTOS💜\n┃ 💵 VALOR: R$ 0,00\n┃ 👨‍💻 TELAS: 1\n┃ 📆 VENCIMENTO: 19/01/2026 00:17:41\n┃ \n💳 ━━━ RENOVAÇÃO / PAGAMENTO ━━━ 💳\n┃ \n┃ 🔗 ACESSE AQUI: https://global.mplll.com/#/checkout/oQ1Y37GDON/loL7aM5jWX\n┃ \n🔑 ━━━ SEUS DADOS DE ACESSO ━━━ 🔑\n┃ \n┃ 👤 USUÁRIO: 205101\n┃ 🔐 SENHA: 443655\n┃ \n🌐 ━━━ SERVIDORES (DNS) ━━━ 🌐\n┃ \n┃ 📡 PARA SMARTERS: http://1iptv.glloball.shop:80\n┃ 📡 PARA XCIPTV: http://iptv1.glloball.shop:80\n┃ \n📺 ━━━ APLICATIVOS PARCEIROS ━━━ 📺\n(Samsung, LG, Roku, Android, TCL, PC)\n┃ \n┃ 🆔 CÓDIGO GERAL: 00894\n┃ \n┃ 💜 Vizzion Play\n┃ 💜 ASSIST+\n┃ 💜 SUPER PLAY\n┃ 💜 PLAYSIM\n┃ \n┃ ☁️ XCloud TV (Exclusivo)\n┃ 🆔 PROVEDOR: pd\n┃ 👤 USUÁRIO: 205101\n┃ 🔐 SENHA: 443655\n┃ \n⚙️ ━━━ SMART TV (SAMSUNG / LG) ━━━ ⚙️\n┃ \n┃ 📺 APP: SMARTUP / STB\n┃ 🌐 DNS: 178.156.169.43\n┃ 👤 USUÁRIO: 205101 | 🔐 SENHA: 443655\n┃ \n📥 ━━━ BAIXAR NO ANDROID / TV BOX ━━━ 📥\n┃ \n┃ 🛒 LOJA VIP: https://global.pds01.site/\n┃ \n┃ 📺 IBO GLOBAL\n┃ 📥 Downloader: 7339409\n┃ \n┃ 📺 GLOBAL XC 3D\n┃ 📥 Downloader: 5763684\n┃ \n┃ 📺 GLOBAL PLAY UNI\n┃ 📥 Downloader: 9772871\n┃ \n🔗 ━━━ LISTAS DIRETAS (URL) ━━━ 🔗\n┃ \n┃ 🚀 RECOMENDADO (HLS):\n┃ 🔗 http://iptv1.glloball.shop:80/get.php?username=205101&password=443655&type=m3u_plus&output=hls\n┃ \n┃ 🎞️ OPÇÃO 2 (MPEG-TS):\n┃ 🔗 http://iptv1.glloball.shop:80/get.php?username=205101&password=443655&type=m3u_plus&output=mpegts\n┃ \n┃ 📺 SMART TV (SSIPTV):\n┃ 🔗 http://e.iptv1.glloball.shop/p/205101/443655/ssiptv\n┃ \n━━━━━━━━━━━━━━━━━━━━━━━━\n📩 Dúvidas? Estamos à disposição! 🤝",
    "data": [
        {
            "message": "💜 ▬▬▬▬▬▬▬ ✦ ▬▬▬▬▬▬▬ 💜\n      🌟 IPTV 1 - ACESSO VIP 🌟\n💜 ▬▬▬▬▬▬▬ ✦ ▬▬▬▬▬▬▬ 💜\n\n📝 ━━━ DETALHES DA ASSINATURA ━━━ 📝\n┃ \n┃ ✅ PLANO: 💜TESTE 3HRS || SEM ADULTOS💜\n┃ 💵 VALOR: R$ 0,00\n┃ 👨‍💻 TELAS: 1\n┃ 📆 VENCIMENTO: 19/01/2026 00:17:41\n┃ \n💳 ━━━ RENOVAÇÃO / PAGAMENTO ━━━ 💳\n┃ \n┃ 🔗 ACESSE AQUI: https://global.mplll.com/#/checkout/oQ1Y37GDON/loL7aM5jWX\n┃ \n🔑 ━━━ SEUS DADOS DE ACESSO ━━━ 🔑\n┃ \n┃ 👤 USUÁRIO: 205101\n┃ 🔐 SENHA: 443655\n┃ \n🌐 ━━━ SERVIDORES (DNS) ━━━ 🌐\n┃ \n┃ 📡 PARA SMARTERS: http://1iptv.glloball.shop:80\n┃ 📡 PARA XCIPTV: http://iptv1.glloball.shop:80\n┃ \n📺 ━━━ APLICATIVOS PARCEIROS ━━━ 📺\n(Samsung, LG, Roku, Android, TCL, PC)\n┃ \n┃ 🆔 CÓDIGO GERAL: 00894\n┃ \n┃ 💜 Vizzion Play\n┃ 💜 ASSIST+\n┃ 💜 SUPER PLAY\n┃ 💜 PLAYSIM\n┃ \n┃ ☁️ XCloud TV (Exclusivo)\n┃ 🆔 PROVEDOR: pd\n┃ 👤 USUÁRIO: 205101\n┃ 🔐 SENHA: 443655\n┃ \n⚙️ ━━━ SMART TV (SAMSUNG / LG) ━━━ ⚙️\n┃ \n┃ 📺 APP: SMARTUP / STB\n┃ 🌐 DNS: 178.156.169.43\n┃ 👤 USUÁRIO: 205101 | 🔐 SENHA: 443655\n┃ \n📥 ━━━ BAIXAR NO ANDROID / TV BOX ━━━ 📥\n┃ \n┃ 🛒 LOJA VIP: https://global.pds01.site/\n┃ \n┃ 📺 IBO GLOBAL\n┃ 📥 Downloader: 7339409\n┃ \n┃ 📺 GLOBAL XC 3D\n┃ 📥 Downloader: 5763684\n┃ \n┃ 📺 GLOBAL PLAY UNI\n┃ 📥 Downloader: 9772871\n┃ \n🔗 ━━━ LISTAS DIRETAS (URL) ━━━ 🔗\n┃ \n┃ 🚀 RECOMENDADO (HLS):\n┃ 🔗 http://iptv1.glloball.shop:80/get.php?username=205101&password=443655&type=m3u_plus&output=hls\n┃ \n┃ 🎞️ OPÇÃO 2 (MPEG-TS):\n┃ 🔗 http://iptv1.glloball.shop:80/get.php?username=205101&password=443655&type=m3u_plus&output=mpegts\n┃ \n┃ 📺 SMART TV (SSIPTV):\n┃ 🔗 http://e.iptv1.glloball.shop/p/205101/443655/ssiptv\n┃ \n━━━━━━━━━━━━━━━━━━━━━━━━\n📩 Dúvidas? Estamos à disposição! 🤝"
        }
    ]
}