{
    "dns": "http://iptv3.glloball.shop:80",
    "username": "606919",
    "connections": 1,
    "password": "661411",
    "package": "ğŸ’šTESTE 3HRS || SEM ADULTOSğŸ’š",
    "createdAt": "2026-01-18 21:18:30",
    "createdAtFormatted": "18/01/2026 21:18:30",
    "expiresAt": "2026-01-19 00:18:29",
    "expiresAtFormatted": "19/01/2026 00:18:29",
    "payUrl": "https://global.mplll.com/#/checkout/oQ1Y37GDON/loL7aMgMWX",
    "reply": "ğŸ’š â–¬â–¬â–¬â–¬â–¬â–¬â–¬ âœ¦ â–¬â–¬â–¬â–¬â–¬â–¬â–¬ ğŸ’š\n      ğŸŒŸ IPTV 3 - ACESSO VIP ğŸŒŸ\nğŸ’š â–¬â–¬â–¬â–¬â–¬â–¬â–¬ âœ¦ â–¬â–¬â–¬â–¬â–¬â–¬â–¬ ğŸ’š\n\nğŸ“ â”â”â” DETALHES DA ASSINATURA â”â”â” ğŸ“\nâ”ƒ \nâ”ƒ âœ… PLANO: ğŸ’šTESTE 3HRS || SEM ADULTOSğŸ’š\nâ”ƒ ğŸ’µ VALOR: R$Â 0,00\nâ”ƒ ğŸ‘¨â€ğŸ’» TELAS: 1\nâ”ƒ ğŸ“† VENCIMENTO: 19/01/2026 00:18:29\nâ”ƒ \nğŸ’³ â”â”â” RENOVAÃ‡ÃƒO / PAGAMENTO â”â”â” ğŸ’³\nâ”ƒ \nâ”ƒ ğŸ”— ACESSE AQUI: https://global.mplll.com/#/checkout/oQ1Y37GDON/loL7aMgMWX\nâ”ƒ \nğŸ”‘ â”â”â” SEUS DADOS DE ACESSO â”â”â” ğŸ”‘\nâ”ƒ \nâ”ƒ ğŸ‘¤ USUÃRIO: 606919\nâ”ƒ ğŸ” SENHA: 661411\nâ”ƒ ğŸŒ DNS 1: http://iptv3.glloball.shop:80\nâ”ƒ ğŸŒ DNS 2: http://3iptv.glloball.shop:80\nâ”ƒ \nğŸ“º â”â”â” APPS PARCEIROS POR CÃ“DIGO â”â”â” ğŸ“º\n(Basta abrir o app e digitar o cÃ³digo abaixo)\nâ”ƒ \nâ”ƒ ğŸ†” CÃ“DIGO: 248752\nâ”ƒ ğŸ”¹ Assist+ | Playsim\nâ”ƒ \nâ”ƒ ğŸ†” CÃ“DIGO: 333741\nâ”ƒ ğŸ”¹ Vizzion Play\nâ”ƒ \nâ”ƒ ğŸ†” CÃ“DIGO: 1274\nâ”ƒ ğŸ”¹ Top Play | Magic Play (Roku e iOS)\nâ”ƒ \nâ”ƒ ğŸ†” CÃ“DIGO: 129051 (Power Play)\nâ”ƒ ğŸ†” CÃ“DIGO: 443300 (Epic Play)\nâ”ƒ \nâ”ƒ ğŸ‘¤ USUÃRIO: 606919\nâ”ƒ ğŸ” SENHA: 661411\nâ”ƒ \nâœ¨ â”â”â” PARCERIA XCLOUD TV â”â”â” âœ¨\nâ”ƒ \nâ”ƒ ğŸ†” PROVIDER: pd\nâ”ƒ ğŸ‘¤ USUÃRIO: 606919\nâ”ƒ ğŸ” SENHA: 661411\nâ”ƒ \nğŸ› ï¸ â”â”â” APPS QUE USAM LISTA (M3U) â”â”â” ğŸ› ï¸\nâ”ƒ \nâ”ƒ ğŸ”˜ MULTIAPPS (Samsung, LG, Roku, Android)\nâ”ƒ ğŸ“± IPTV Player io, OTT Player, IPTV 4K, \nâ”ƒ Stream Player, Pro Player, Star, TVIP, etc.\nâ”ƒ \nâ”ƒ ğŸ”— COPIE ESTA LISTA:\nâ”ƒ http://topcdn.fun/get.php?username=606919&password=661411&type=m3u_plus&output=mpegts\nâ”ƒ \nğŸ“¥ â”â”â” BAIXAR NO ANDROID / TV BOX â”â”â” ğŸ“¥\nâ”ƒ \nâ”ƒ ğŸ“º ASSIST+ â” Downloader: 8209473\nâ”ƒ ğŸ“º PLAYSIM â” Downloader: 7275096\nâ”ƒ ğŸ“º VIZZION PLAY â” Downloader: 2868880\nâ”ƒ \nâ”ƒ ğŸ“¥ Alternativo (Ntdown):\nâ”ƒ ğŸ”¹ Assist+: 77646 | ğŸ”¹ Playsim: 72853\nâ”ƒ \nğŸ“¥ â”â”â” BAIXAR NO ANDROID / TV BOX â”â”â” ğŸ“¥\nâ”ƒ \nâ”ƒ ğŸ›’ LOJA VIP: https://globalplay.pds01.site\nâ”ƒ \nâ”ƒ ğŸ“º GLOBAL PLAY SMV3 \nâ”ƒ ğŸ“¥ Downloader: 7921297\nâ”ƒ \nâ”ƒ ğŸ“º GLOBAL XC 3D\nâ”ƒ ğŸ“¥ Downloader: 5763684\nâ”ƒ \nâ”ƒ ğŸ“º GLOBAL PLAY UNI\nâ”ƒ ğŸ“¥ Downloader: 9772871\nâ”ƒ \nğŸ”— â”â”â” LISTAS DIRETAS (URL) â”â”â” ğŸ”—\nâ”ƒ \nâ”ƒ ğŸš€ RECOMENDADO (HLS):\nâ”ƒ ğŸ”— http://iptv3.glloball.shop:80/get.php?username=606919&password=661411&type=m3u_plus&output=hls\nâ”ƒ \nâ”ƒ ğŸï¸ OPÃ‡ÃƒO 2 (MPEG-TS):\nâ”ƒ ğŸ”— http://iptv3.glloball.shop:80/get.php?username=606919&password=661411&type=m3u_plus&output=mpegts\nâ”ƒ \nâ”ƒ ğŸ“º SMART TV (SSIPTV):\nâ”ƒ ğŸ”— http://e.iptv3.glloball.shop/p/606919/661411/ssiptv\nâ”ƒ \nâ”â”â”â”â”â”â”â”â”â”â”â”â”â”â”â”â”â”â”â”â”â”â”â”\nğŸ“© DÃºvidas? Estamos Ã  disposiÃ§Ã£o! ğŸ¤",
    "data": [
        {
            "message": "ğŸ’š â–¬â–¬â–¬â–¬â–¬â–¬â–¬ âœ¦ â–¬â–¬â–¬â–¬â–¬â–¬â–¬ ğŸ’š\n      ğŸŒŸ IPTV 3 - ACESSO VIP ğŸŒŸ\nğŸ’š â–¬â–¬â–¬â–¬â–¬â–¬â–¬ âœ¦ â–¬â–¬â–¬â–¬â–¬â–¬â–¬ ğŸ’š\n\nğŸ“ â”â”â” DETALHES DA ASSINATURA â”â”â” ğŸ“\nâ”ƒ \nâ”ƒ âœ… PLANO: ğŸ’šTESTE 3HRS || SEM ADULTOSğŸ’š\nâ”ƒ ğŸ’µ VALOR: R$Â 0,00\nâ”ƒ ğŸ‘¨â€ğŸ’» TELAS: 1\nâ”ƒ ğŸ“† VENCIMENTO: 19/01/2026 00:18:29\nâ”ƒ \nğŸ’³ â”â”â” RENOVAÃ‡ÃƒO / PAGAMENTO â”â”â” ğŸ’³\nâ”ƒ \nâ”ƒ ğŸ”— ACESSE AQUI: https://global.mplll.com/#/checkout/oQ1Y37GDON/loL7aMgMWX\nâ”ƒ \nğŸ”‘ â”â”â” SEUS DADOS DE ACESSO â”â”â” ğŸ”‘\nâ”ƒ \nâ”ƒ ğŸ‘¤ USUÃRIO: 606919\nâ”ƒ ğŸ” SENHA: 661411\nâ”ƒ ğŸŒ DNS 1: http://iptv3.glloball.shop:80\nâ”ƒ ğŸŒ DNS 2: http://3iptv.glloball.shop:80\nâ”ƒ \nğŸ“º â”â”â” APPS PARCEIROS POR CÃ“DIGO â”â”â” ğŸ“º\n(Basta abrir o app e digitar o cÃ³digo abaixo)\nâ”ƒ \nâ”ƒ ğŸ†” CÃ“DIGO: 248752\nâ”ƒ ğŸ”¹ Assist+ | Playsim\nâ”ƒ \nâ”ƒ ğŸ†” CÃ“DIGO: 333741\nâ”ƒ ğŸ”¹ Vizzion Play\nâ”ƒ \nâ”ƒ ğŸ†” CÃ“DIGO: 1274\nâ”ƒ ğŸ”¹ Top Play | Magic Play (Roku e iOS)\nâ”ƒ \nâ”ƒ ğŸ†” CÃ“DIGO: 129051 (Power Play)\nâ”ƒ ğŸ†” CÃ“DIGO: 443300 (Epic Play)\nâ”ƒ \nâ”ƒ ğŸ‘¤ USUÃRIO: 606919\nâ”ƒ ğŸ” SENHA: 661411\nâ”ƒ \nâœ¨ â”â”â” PARCERIA XCLOUD TV â”â”â” âœ¨\nâ”ƒ \nâ”ƒ ğŸ†” PROVIDER: pd\nâ”ƒ ğŸ‘¤ USUÃRIO: 606919\nâ”ƒ ğŸ” SENHA: 661411\nâ”ƒ \nğŸ› ï¸ â”â”â” APPS QUE USAM LISTA (M3U) â”â”â” ğŸ› ï¸\nâ”ƒ \nâ”ƒ ğŸ”˜ MULTIAPPS (Samsung, LG, Roku, Android)\nâ”ƒ ğŸ“± IPTV Player io, OTT Player, IPTV 4K, \nâ”ƒ Stream Player, Pro Player, Star, TVIP, etc.\nâ”ƒ \nâ”ƒ ğŸ”— COPIE ESTA LISTA:\nâ”ƒ http://topcdn.fun/get.php?username=606919&password=661411&type=m3u_plus&output=mpegts\nâ”ƒ \nğŸ“¥ â”â”â” BAIXAR NO ANDROID / TV BOX â”â”â” ğŸ“¥\nâ”ƒ \nâ”ƒ ğŸ“º ASSIST+ â” Downloader: 8209473\nâ”ƒ ğŸ“º PLAYSIM â” Downloader: 7275096\nâ”ƒ ğŸ“º VIZZION PLAY â” Downloader: 2868880\nâ”ƒ \nâ”ƒ ğŸ“¥ Alternativo (Ntdown):\nâ”ƒ ğŸ”¹ Assist+: 77646 | ğŸ”¹ Playsim: 72853\nâ”ƒ \nğŸ“¥ â”â”â” BAIXAR NO ANDROID / TV BOX â”â”â” ğŸ“¥\nâ”ƒ \nâ”ƒ ğŸ›’ LOJA VIP: https://globalplay.pds01.site\nâ”ƒ \nâ”ƒ ğŸ“º GLOBAL PLAY SMV3 \nâ”ƒ ğŸ“¥ Downloader: 7921297\nâ”ƒ \nâ”ƒ ğŸ“º GLOBAL XC 3D\nâ”ƒ ğŸ“¥ Downloader: 5763684\nâ”ƒ \nâ”ƒ ğŸ“º GLOBAL PLAY UNI\nâ”ƒ ğŸ“¥ Downloader: 9772871\nâ”ƒ \nğŸ”— â”â”â” LISTAS DIRETAS (URL) â”â”â” ğŸ”—\nâ”ƒ \nâ”ƒ ğŸš€ RECOMENDADO (HLS):\nâ”ƒ ğŸ”— http://iptv3.glloball.shop:80/get.php?username=606919&password=661411&type=m3u_plus&output=hls\nâ”ƒ \nâ”ƒ ğŸï¸ OPÃ‡ÃƒO 2 (MPEG-TS):\nâ”ƒ ğŸ”— http://iptv3.glloball.shop:80/get.php?username=606919&password=661411&type=m3u_plus&output=mpegts\nâ”ƒ \nâ”ƒ ğŸ“º SMART TV (SSIPTV):\nâ”ƒ ğŸ”— http://e.iptv3.glloball.shop/p/606919/661411/ssiptv\nâ”ƒ \nâ”â”â”â”â”â”â”â”â”â”â”â”â”â”â”â”â”â”â”â”â”â”â”â”\nğŸ“© DÃºvidas? Estamos Ã  disposiÃ§Ã£o! ğŸ¤"
        }
    ]
}