{"dns":"http:\/\/iptv1.glloball.shop:80","username":"959626","connections":1,"password":"599215","package":"\ud83d\udc9cTESTE 1HR || SEM ADULTOS\ud83d\udc9c","createdAt":"2026-01-31 23:40:52","createdAtFormatted":"31\/01\/2026 23:40:52","expiresAt":"2026-02-01 00:40:51","expiresAtFormatted":"01\/02\/2026 00:40:51","payUrl":"https:\/\/global.mplll.com\/#\/checkout\/oQ1Y37GDON\/YAWREzr0Dj","reply":"\ud83d\udc9c \u25ac\u25ac\u25ac\u25ac\u25ac\u25ac\u25ac \u2726 \u25ac\u25ac\u25ac\u25ac\u25ac\u25ac\u25ac \ud83d\udc9c\n      \ud83c\udf1f IPTV 1 - ACESSO VIP \ud83c\udf1f\n\ud83d\udc9c \u25ac\u25ac\u25ac\u25ac\u25ac\u25ac\u25ac \u2726 \u25ac\u25ac\u25ac\u25ac\u25ac\u25ac\u25ac \ud83d\udc9c\n\n\ud83d\udcdd \u2501\u2501\u2501 DETALHES DA ASSINATURA \u2501\u2501\u2501 \ud83d\udcdd\n\u2503 \n\u2503 \u2705 PLANO: \ud83d\udc9cTESTE 1HR || SEM ADULTOS\ud83d\udc9c\n\u2503 \ud83d\udcb5 VALOR: R$\u00a00,00\n\u2503 \ud83d\udc68\u200d\ud83d\udcbb TELAS: 1\n\u2503 \ud83d\udcc6 VENCIMENTO: 01\/02\/2026 00:40:51\n\u2503 \n\ud83d\udcb3 \u2501\u2501\u2501 RENOVA\u00c7\u00c3O \/ PAGAMENTO \u2501\u2501\u2501 \ud83d\udcb3\n\u2503 \n\u2503 \ud83d\udd17 ACESSE AQUI: https:\/\/global.mplll.com\/#\/checkout\/oQ1Y37GDON\/YAWREzr0Dj\n\u2503 \n\ud83d\udd11 \u2501\u2501\u2501 SEUS DADOS DE ACESSO \u2501\u2501\u2501 \ud83d\udd11\n\u2503 \n\u2503 \ud83d\udc64 USU\u00c1RIO: 959626\n\u2503 \ud83d\udd10 SENHA: 599215\n\u2503 \n\ud83c\udf10 \u2501\u2501\u2501 SERVIDORES (DNS) \u2501\u2501\u2501 \ud83c\udf10\n\u2503 \n\u2503 \ud83d\udce1 PARA SMARTERS: http:\/\/1iptv.glloball.shop:80\n\u2503 \ud83d\udce1 PARA XCIPTV: http:\/\/iptv1.glloball.shop:80\n\u2503 \n\ud83d\udcfa \u2501\u2501\u2501 APLICATIVOS PARCEIROS \u2501\u2501\u2501 \ud83d\udcfa\n(Samsung, LG, Roku, Android, TCL, PC)\n\u2503 \n\u2503 \ud83c\udd94 C\u00d3DIGO GERAL: 00894\n\u2503 \n\u2503 \ud83d\udc9c Vizzion Play\n\u2503 \ud83d\udc9c ASSIST+\n\u2503 \ud83d\udc9c SUPER PLAY\n\u2503 \ud83d\udc9c PLAYSIM\n\u2503 \n\u2503 \u2601\ufe0f XCloud TV (Exclusivo)\n\u2503 \ud83c\udd94 PROVEDOR: pd\n\u2503 \ud83d\udc64 USU\u00c1RIO: 959626\n\u2503 \ud83d\udd10 SENHA: 599215\n\u2503 \n\u2699\ufe0f \u2501\u2501\u2501 SMART TV (SAMSUNG \/ LG) \u2501\u2501\u2501 \u2699\ufe0f\n\u2503 \n\u2503 \ud83d\udcfa APP: SMARTUP \/ STB\n\u2503 \ud83c\udf10 DNS: 178.156.169.43\n\u2503 \ud83d\udc64 USU\u00c1RIO: 959626 | \ud83d\udd10 SENHA: 599215\n\u2503 \n\ud83d\udce5 \u2501\u2501\u2501 BAIXAR NO ANDROID \/ TV BOX \u2501\u2501\u2501 \ud83d\udce5\n\u2503 \n\u2503 \ud83d\uded2 LOJA VIP: https:\/\/global.pds01.site\/\n\u2503 \n\u2503 \ud83d\udcfa IBO GLOBAL\n\u2503 \ud83d\udce5 Downloader: 7339409\n\u2503 \n\u2503 \ud83d\udcfa GLOBAL XC 3D\n\u2503 \ud83d\udce5 Downloader: 5763684\n\u2503 \n\u2503 \ud83d\udcfa GLOBAL PLAY UNI\n\u2503 \ud83d\udce5 Downloader: 9772871\n\u2503 \n\ud83d\udd17 \u2501\u2501\u2501 LISTAS DIRETAS (URL) \u2501\u2501\u2501 \ud83d\udd17\n\u2503 \n\u2503 \ud83d\ude80 RECOMENDADO (HLS):\n\u2503 \ud83d\udd17 http:\/\/iptv1.glloball.shop:80\/get.php?username=959626&password=599215&type=m3u_plus&output=hls\n\u2503 \n\u2503 \ud83c\udf9e\ufe0f OP\u00c7\u00c3O 2 (MPEG-TS):\n\u2503 \ud83d\udd17 http:\/\/iptv1.glloball.shop:80\/get.php?username=959626&password=599215&type=m3u_plus&output=mpegts\n\u2503 \n\u2503 \ud83d\udcfa SMART TV (SSIPTV):\n\u2503 \ud83d\udd17 http:\/\/e.iptv1.glloball.shop\/p\/959626\/599215\/ssiptv\n\u2503 \n\u2501\u2501\u2501\u2501\u2501\u2501\u2501\u2501\u2501\u2501\u2501\u2501\u2501\u2501\u2501\u2501\u2501\u2501\u2501\u2501\u2501\u2501\u2501\u2501\n\ud83d\udce9 D\u00favidas? Estamos \u00e0 disposi\u00e7\u00e3o! \ud83e\udd1d","data":[{"message":"\ud83d\udc9c \u25ac\u25ac\u25ac\u25ac\u25ac\u25ac\u25ac \u2726 \u25ac\u25ac\u25ac\u25ac\u25ac\u25ac\u25ac \ud83d\udc9c\n      \ud83c\udf1f IPTV 1 - ACESSO VIP \ud83c\udf1f\n\ud83d\udc9c \u25ac\u25ac\u25ac\u25ac\u25ac\u25ac\u25ac \u2726 \u25ac\u25ac\u25ac\u25ac\u25ac\u25ac\u25ac \ud83d\udc9c\n\n\ud83d\udcdd \u2501\u2501\u2501 DETALHES DA ASSINATURA \u2501\u2501\u2501 \ud83d\udcdd\n\u2503 \n\u2503 \u2705 PLANO: \ud83d\udc9cTESTE 1HR || SEM ADULTOS\ud83d\udc9c\n\u2503 \ud83d\udcb5 VALOR: R$\u00a00,00\n\u2503 \ud83d\udc68\u200d\ud83d\udcbb TELAS: 1\n\u2503 \ud83d\udcc6 VENCIMENTO: 01\/02\/2026 00:40:51\n\u2503 \n\ud83d\udcb3 \u2501\u2501\u2501 RENOVA\u00c7\u00c3O \/ PAGAMENTO \u2501\u2501\u2501 \ud83d\udcb3\n\u2503 \n\u2503 \ud83d\udd17 ACESSE AQUI: https:\/\/global.mplll.com\/#\/checkout\/oQ1Y37GDON\/YAWREzr0Dj\n\u2503 \n\ud83d\udd11 \u2501\u2501\u2501 SEUS DADOS DE ACESSO \u2501\u2501\u2501 \ud83d\udd11\n\u2503 \n\u2503 \ud83d\udc64 USU\u00c1RIO: 959626\n\u2503 \ud83d\udd10 SENHA: 599215\n\u2503 \n\ud83c\udf10 \u2501\u2501\u2501 SERVIDORES (DNS) \u2501\u2501\u2501 \ud83c\udf10\n\u2503 \n\u2503 \ud83d\udce1 PARA SMARTERS: http:\/\/1iptv.glloball.shop:80\n\u2503 \ud83d\udce1 PARA XCIPTV: http:\/\/iptv1.glloball.shop:80\n\u2503 \n\ud83d\udcfa \u2501\u2501\u2501 APLICATIVOS PARCEIROS \u2501\u2501\u2501 \ud83d\udcfa\n(Samsung, LG, Roku, Android, TCL, PC)\n\u2503 \n\u2503 \ud83c\udd94 C\u00d3DIGO GERAL: 00894\n\u2503 \n\u2503 \ud83d\udc9c Vizzion Play\n\u2503 \ud83d\udc9c ASSIST+\n\u2503 \ud83d\udc9c SUPER PLAY\n\u2503 \ud83d\udc9c PLAYSIM\n\u2503 \n\u2503 \u2601\ufe0f XCloud TV (Exclusivo)\n\u2503 \ud83c\udd94 PROVEDOR: pd\n\u2503 \ud83d\udc64 USU\u00c1RIO: 959626\n\u2503 \ud83d\udd10 SENHA: 599215\n\u2503 \n\u2699\ufe0f \u2501\u2501\u2501 SMART TV (SAMSUNG \/ LG) \u2501\u2501\u2501 \u2699\ufe0f\n\u2503 \n\u2503 \ud83d\udcfa APP: SMARTUP \/ STB\n\u2503 \ud83c\udf10 DNS: 178.156.169.43\n\u2503 \ud83d\udc64 USU\u00c1RIO: 959626 | \ud83d\udd10 SENHA: 599215\n\u2503 \n\ud83d\udce5 \u2501\u2501\u2501 BAIXAR NO ANDROID \/ TV BOX \u2501\u2501\u2501 \ud83d\udce5\n\u2503 \n\u2503 \ud83d\uded2 LOJA VIP: https:\/\/global.pds01.site\/\n\u2503 \n\u2503 \ud83d\udcfa IBO GLOBAL\n\u2503 \ud83d\udce5 Downloader: 7339409\n\u2503 \n\u2503 \ud83d\udcfa GLOBAL XC 3D\n\u2503 \ud83d\udce5 Downloader: 5763684\n\u2503 \n\u2503 \ud83d\udcfa GLOBAL PLAY UNI\n\u2503 \ud83d\udce5 Downloader: 9772871\n\u2503 \n\ud83d\udd17 \u2501\u2501\u2501 LISTAS DIRETAS (URL) \u2501\u2501\u2501 \ud83d\udd17\n\u2503 \n\u2503 \ud83d\ude80 RECOMENDADO (HLS):\n\u2503 \ud83d\udd17 http:\/\/iptv1.glloball.shop:80\/get.php?username=959626&password=599215&type=m3u_plus&output=hls\n\u2503 \n\u2503 \ud83c\udf9e\ufe0f OP\u00c7\u00c3O 2 (MPEG-TS):\n\u2503 \ud83d\udd17 http:\/\/iptv1.glloball.shop:80\/get.php?username=959626&password=599215&type=m3u_plus&output=mpegts\n\u2503 \n\u2503 \ud83d\udcfa SMART TV (SSIPTV):\n\u2503 \ud83d\udd17 http:\/\/e.iptv1.glloball.shop\/p\/959626\/599215\/ssiptv\n\u2503 \n\u2501\u2501\u2501\u2501\u2501\u2501\u2501\u2501\u2501\u2501\u2501\u2501\u2501\u2501\u2501\u2501\u2501\u2501\u2501\u2501\u2501\u2501\u2501\u2501\n\ud83d\udce9 D\u00favidas? Estamos \u00e0 disposi\u00e7\u00e3o! \ud83e\udd1d"}]}