{
    "dns": "http://iptv2.glloball.shop:80",
    "username": "744543",
    "connections": 1,
    "password": "260232",
    "package": "ğŸ¤TESTE 3HRS || COMPLETOğŸ¤",
    "createdAt": "2026-01-16 17:06:52",
    "createdAtFormatted": "16/01/2026 17:06:52",
    "expiresAt": "2026-01-16 20:06:52",
    "expiresAtFormatted": "16/01/2026 20:06:52",
    "payUrl": "https://global.mplll.com/#/checkout/oQ1Y37GDON/241KExq6Dm",
    "reply": "ğŸ¤ â–¬â–¬â–¬â–¬â–¬â–¬â–¬ âœ¦ â–¬â–¬â–¬â–¬â–¬â–¬â–¬ ğŸ¤\n      ğŸŒŸ IPTV 2 - ACESSO VIP ğŸŒŸ\nğŸ¤ â–¬â–¬â–¬â–¬â–¬â–¬â–¬ âœ¦ â–¬â–¬â–¬â–¬â–¬â–¬â–¬ ğŸ¤\n\nğŸ“ â”â”â” DETALHES DA ASSINATURA â”â”â” ğŸ“\nâ”ƒ \nâ”ƒ âœ… PLANO: ğŸ¤TESTE 3HRS || COMPLETOğŸ¤\nâ”ƒ ğŸ’µ VALOR: R$Â 0,00\nâ”ƒ ğŸ‘¨â€ğŸ’» TELAS: 1\nâ”ƒ ğŸ“† VENCIMENTO: 16/01/2026 20:06:52\nâ”ƒ \nğŸ’³ â”â”â” RENOVAÃ‡ÃƒO / PAGAMENTO â”â”â” ğŸ’³\nâ”ƒ \nâ”ƒ ğŸ”— ACESSE AQUI: https://global.mplll.com/#/checkout/oQ1Y37GDON/241KExq6Dm\nâ”ƒ \nğŸ”‘ â”â”â” SEUS DADOS DE ACESSO â”â”â” ğŸ”‘\nâ”ƒ \nâ”ƒ ğŸ‘¤ USUÃRIO: 744543\nâ”ƒ ğŸ” SENHA: 260232\nâ”ƒ \nğŸŒ â”â”â” SERVIDORES (DNS) â”â”â” ğŸŒ\nâ”ƒ \nâ”ƒ ğŸ“¡ PARA SMARTERS: http://2iptv.glloball.shop:80\nâ”ƒ ğŸ“¡ PARA XCIPTV: http://iptv2.glloball.shop:80\nâ”ƒ \nğŸ“º â”â”â” APLICATIVOS PARCEIROS â”â”â” ğŸ“º\n(Samsung, LG, Roku, Android, TCL, iOS)\nâ”ƒ \nâ”ƒ ğŸ†” CÃ“DIGO: 251 â” Assist+ | Playsim\nâ”ƒ ğŸ†” CÃ“DIGO: 2027 â” Brasil IPTV\nâ”ƒ ğŸ†” CÃ“DIGO: 687524 â” Vizzion Play\nâ”ƒ ğŸ†” CÃ“DIGO: 1273 â” Top Play | Magic Play\nâ”ƒ â˜ï¸ XCloud TV (Parceria Exclusiva)\nâ”ƒ ğŸ†” PROVEDOR: pd\nâ”ƒ ğŸ‘¤ USUÃRIO: 744543 | ğŸ” SENHA: 260232\nâ”ƒ \nâš™ï¸ â”â”â” SMART TV (SAMSUNG / LG) â”â”â” âš™ï¸\nâ”ƒ \nâ”ƒ ğŸ“º APP: SMARTUP / STB\nâ”ƒ ğŸŒ DNS: 5.161.103.130\nâ”ƒ ğŸ‘¤ USUÃRIO: 744543 | ğŸ” SENHA: 260232\nâ”ƒ \nğŸ› ï¸ â”â”â” ATIVAÃ‡ÃƒO POR LISTA (URL) â”â”â” ğŸ› ï¸\nâ”ƒ \nâ”ƒ ğŸ”˜ FLEX PLAY (Samsung, LG, Roku)\nâ”ƒ ğŸŒ Site: https://flexplayer.io/#/upload-playlist\nâ”ƒ ğŸ“¥ Android (NTDOWN): 75556\nâ”ƒ ğŸ”— Lista: http://parceria.parclll.site/get.php?username=744543&password=260232&type=m3u_plus&output=mpegts\nâ”ƒ \nâ”ƒ ğŸ”˜ MULTIAPPS (IPTV Player io, OTT Player, \nâ”ƒ IPTV 4K, Stream Player, Pro Player, etc.)\nâ”ƒ ğŸ”— Lista: http://server10.fun/get.php?username=744543&password=260232&type=m3u_plus&output=mpegts\nâ”ƒ \nğŸ“¥ â”â”â” BAIXAR NO ANDROID / TV BOX â”â”â” ğŸ“¥\nâ”ƒ \nâ”ƒ ğŸ›’ LOJA VIP: https://global.pds01.site/\nâ”ƒ \nâ”ƒ ğŸ“º IBO GLOBAL\nâ”ƒ ğŸ“¥ Downloader: 7339409\nâ”ƒ ğŸ“º GLOBAL XC 3D â” Downloader: 5763684\nâ”ƒ ğŸ“º GLOBAL PLAY UNI â” Downloader: 9772871\nâ”ƒ \nğŸ”— â”â”â” LISTAS DIRETAS (URL) â”â”â” ğŸ”—\nâ”ƒ \nâ”ƒ ğŸš€ RECOMENDADO (HLS):\nâ”ƒ ğŸ”— http://iptv2.glloball.shop:80/get.php?username=744543&password=260232&type=m3u_plus&output=hls\nâ”ƒ \nâ”ƒ ğŸï¸ OPÃ‡ÃƒO 2 (MPEG-TS):\nâ”ƒ ğŸ”— http://iptv2.glloball.shop:80/get.php?username=744543&password=260232&type=m3u_plus&output=mpegts\nâ”ƒ \nâ”ƒ ğŸ“º SMART TV (SSIPTV):\nâ”ƒ ğŸ”— http://e.iptv2.glloball.shop/p/744543/260232/ssiptv\nâ”ƒ\nâ”â”â”â”â”â”â”â”â”â”â”â”â”â”â”â”â”â”â”â”â”â”â”â”\nğŸ“© DÃºvidas? Estamos Ã  disposiÃ§Ã£o! ğŸ¤",
    "data": [
        {
            "message": "ğŸ¤ â–¬â–¬â–¬â–¬â–¬â–¬â–¬ âœ¦ â–¬â–¬â–¬â–¬â–¬â–¬â–¬ ğŸ¤\n      ğŸŒŸ IPTV 2 - ACESSO VIP ğŸŒŸ\nğŸ¤ â–¬â–¬â–¬â–¬â–¬â–¬â–¬ âœ¦ â–¬â–¬â–¬â–¬â–¬â–¬â–¬ ğŸ¤\n\nğŸ“ â”â”â” DETALHES DA ASSINATURA â”â”â” ğŸ“\nâ”ƒ \nâ”ƒ âœ… PLANO: ğŸ¤TESTE 3HRS || COMPLETOğŸ¤\nâ”ƒ ğŸ’µ VALOR: R$Â 0,00\nâ”ƒ ğŸ‘¨â€ğŸ’» TELAS: 1\nâ”ƒ ğŸ“† VENCIMENTO: 16/01/2026 20:06:52\nâ”ƒ \nğŸ’³ â”â”â” RENOVAÃ‡ÃƒO / PAGAMENTO â”â”â” ğŸ’³\nâ”ƒ \nâ”ƒ ğŸ”— ACESSE AQUI: https://global.mplll.com/#/checkout/oQ1Y37GDON/241KExq6Dm\nâ”ƒ \nğŸ”‘ â”â”â” SEUS DADOS DE ACESSO â”â”â” ğŸ”‘\nâ”ƒ \nâ”ƒ ğŸ‘¤ USUÃRIO: 744543\nâ”ƒ ğŸ” SENHA: 260232\nâ”ƒ \nğŸŒ â”â”â” SERVIDORES (DNS) â”â”â” ğŸŒ\nâ”ƒ \nâ”ƒ ğŸ“¡ PARA SMARTERS: http://2iptv.glloball.shop:80\nâ”ƒ ğŸ“¡ PARA XCIPTV: http://iptv2.glloball.shop:80\nâ”ƒ \nğŸ“º â”â”â” APLICATIVOS PARCEIROS â”â”â” ğŸ“º\n(Samsung, LG, Roku, Android, TCL, iOS)\nâ”ƒ \nâ”ƒ ğŸ†” CÃ“DIGO: 251 â” Assist+ | Playsim\nâ”ƒ ğŸ†” CÃ“DIGO: 2027 â” Brasil IPTV\nâ”ƒ ğŸ†” CÃ“DIGO: 687524 â” Vizzion Play\nâ”ƒ ğŸ†” CÃ“DIGO: 1273 â” Top Play | Magic Play\nâ”ƒ â˜ï¸ XCloud TV (Parceria Exclusiva)\nâ”ƒ ğŸ†” PROVEDOR: pd\nâ”ƒ ğŸ‘¤ USUÃRIO: 744543 | ğŸ” SENHA: 260232\nâ”ƒ \nâš™ï¸ â”â”â” SMART TV (SAMSUNG / LG) â”â”â” âš™ï¸\nâ”ƒ \nâ”ƒ ğŸ“º APP: SMARTUP / STB\nâ”ƒ ğŸŒ DNS: 5.161.103.130\nâ”ƒ ğŸ‘¤ USUÃRIO: 744543 | ğŸ” SENHA: 260232\nâ”ƒ \nğŸ› ï¸ â”â”â” ATIVAÃ‡ÃƒO POR LISTA (URL) â”â”â” ğŸ› ï¸\nâ”ƒ \nâ”ƒ ğŸ”˜ FLEX PLAY (Samsung, LG, Roku)\nâ”ƒ ğŸŒ Site: https://flexplayer.io/#/upload-playlist\nâ”ƒ ğŸ“¥ Android (NTDOWN): 75556\nâ”ƒ ğŸ”— Lista: http://parceria.parclll.site/get.php?username=744543&password=260232&type=m3u_plus&output=mpegts\nâ”ƒ \nâ”ƒ ğŸ”˜ MULTIAPPS (IPTV Player io, OTT Player, \nâ”ƒ IPTV 4K, Stream Player, Pro Player, etc.)\nâ”ƒ ğŸ”— Lista: http://server10.fun/get.php?username=744543&password=260232&type=m3u_plus&output=mpegts\nâ”ƒ \nğŸ“¥ â”â”â” BAIXAR NO ANDROID / TV BOX â”â”â” ğŸ“¥\nâ”ƒ \nâ”ƒ ğŸ›’ LOJA VIP: https://global.pds01.site/\nâ”ƒ \nâ”ƒ ğŸ“º IBO GLOBAL\nâ”ƒ ğŸ“¥ Downloader: 7339409\nâ”ƒ ğŸ“º GLOBAL XC 3D â” Downloader: 5763684\nâ”ƒ ğŸ“º GLOBAL PLAY UNI â” Downloader: 9772871\nâ”ƒ \nğŸ”— â”â”â” LISTAS DIRETAS (URL) â”â”â” ğŸ”—\nâ”ƒ \nâ”ƒ ğŸš€ RECOMENDADO (HLS):\nâ”ƒ ğŸ”— http://iptv2.glloball.shop:80/get.php?username=744543&password=260232&type=m3u_plus&output=hls\nâ”ƒ \nâ”ƒ ğŸï¸ OPÃ‡ÃƒO 2 (MPEG-TS):\nâ”ƒ ğŸ”— http://iptv2.glloball.shop:80/get.php?username=744543&password=260232&type=m3u_plus&output=mpegts\nâ”ƒ \nâ”ƒ ğŸ“º SMART TV (SSIPTV):\nâ”ƒ ğŸ”— http://e.iptv2.glloball.shop/p/744543/260232/ssiptv\nâ”ƒ\nâ”â”â”â”â”â”â”â”â”â”â”â”â”â”â”â”â”â”â”â”â”â”â”â”\nğŸ“© DÃºvidas? Estamos Ã  disposiÃ§Ã£o! ğŸ¤"
        }
    ]
}