{
    "dns": "http://iptv4.glloball.shop:80",
    "username": "363517",
    "connections": 1,
    "password": "499493",
    "package": "💛TESTE 6HRS || SEM ADULTOS💛",
    "createdAt": "2026-01-19 01:20:13",
    "createdAtFormatted": "19/01/2026 01:20:13",
    "expiresAt": "2026-01-19 07:20:13",
    "expiresAtFormatted": "19/01/2026 07:20:13",
    "payUrl": "https://global.mplll.com/#/checkout/oQ1Y37GDON/r6LJ6AljLv",
    "reply": "💛 ▬▬▬▬▬▬▬ ✦ ▬▬▬▬▬▬▬ 💛\n      🌟 IPTV 4 - ACESSO VIP 🌟\n💛 ▬▬▬▬▬▬▬ ✦ ▬▬▬▬▬▬▬ 💛\n\n📝 ━━━ DETALHES DA ASSINATURA ━━━ 📝\n┃ \n┃ ✅ PLANO: 💛TESTE 6HRS || SEM ADULTOS💛\n┃ 💵 VALOR: R$ 0,00\n┃ 👨‍💻 TELAS: 1\n┃ 📆 VENCIMENTO: 19/01/2026 07:20:13\n┃ \n💳 ━━━ RENOVAÇÃO / PAGAMENTO ━━━ 💳\n┃ \n┃ 🔗 ACESSE AQUI: https://global.mplll.com/#/checkout/oQ1Y37GDON/r6LJ6AljLv\n┃ \n🔑 ━━━ SEUS DADOS DE ACESSO ━━━ 🔑\n┃ \n┃ 👤 USUÁRIO: 363517\n┃ 🔐 SENHA: 499493\n┃ 🌐 DNS 1: http://iptv4.glloball.shop:80\n┃ 🌐 DNS 2: http://4iptv.glloball.shop:80\n┃ \n⚙️ ━━━ SMART TV (SAMSUNG / LG) ━━━ ⚙️\n┃ \n┃ 📺 APP: SMARTUP / STB\n┃ 🌐 DNS: 178.156.157.187\n┃ 👤 USUÁRIO: 363517 | 🔐 SENHA: 499493\n┃ \n📺 ━━━ APPS PARCEIROS POR CÓDIGO ━━━ 📺\n(Basta abrir o app e digitar o código abaixo)\n┃ \n┃ 🆔 CÓDIGO: 333336\n┃ 🔹 Assist+ | Playsim\n┃ \n┃ 🆔 CÓDIGO: 1197\n┃ 🔹 Infinity Play | Pop Smart (Roku, Samsung, LG)\n┃ \n┃ 🆔 CÓDIGO: 2026\n┃ 🔹 Brasil IPTV | Flex Player\n┃ \n┃ 👤 USUÁRIO: 363517\n┃ 🔐 SENHA: 499493\n┃ \n✨ ━━━ PARCERIA XCLOUD TV ━━━ ✨\n┃ \n┃ 🆔 PROVIDER: pd\n┃ 👤 USUÁRIO: 363517\n┃ 🔐 SENHA: 499493\n┃ \n💻 ━━━ ACESSO VIA NAVEGADOR (WEB) ━━━ 💻\n┃ \n┃ 🔗 Opção 1: http://web.pds01.site/\n┃ 🔗 Opção 2: http://webtv.iptvblinkplayer.com/xtream-code\n┃ \n🛠️ ━━━ LISTAS DIRETAS (URL M3U) ━━━ 🛠️\n┃ \n┃ 🚀 RECOMENDADO (HLS):\n┃ 🔗 http://iptv4.glloball.shop:80/get.php?username=363517&password=499493&type=m3u_plus&output=hls\n┃ \n┃ 🎞️ OPÇÃO 2 (MPEG-TS):\n┃ 🔗 http://iptv4.glloball.shop:80/get.php?username=363517&password=499493&type=m3u_plus&output=mpegts\n┃ \n┃ 📺 SMART TV (SSIPTV):\n┃ 🔗 http://e.iptv4.glloball.shop/p/363517/499493/ssiptv\n┃ \n📥 ━━━ BAIXAR NO ANDROID / TV BOX ━━━ 📥\n┃ \n┃ 🛒 LOJA VIP: https://globalplay.pds01.site\n┃ \n┃ 📺 GLOBAL PLAY SMV3 ➔ Downloader: 7921297\n┃ 📺 GLOBAL XC 3D ➔ Downloader: 5763684\n┃ 📺 GLOBAL PLAY UNI ➔ Downloader: 9772871\n┃ \n━━━━━━━━━━━━━━━━━━━━━━━━\n📩 Dúvidas? Estamos à disposição! 🤝",
    "data": [
        {
            "message": "💛 ▬▬▬▬▬▬▬ ✦ ▬▬▬▬▬▬▬ 💛\n      🌟 IPTV 4 - ACESSO VIP 🌟\n💛 ▬▬▬▬▬▬▬ ✦ ▬▬▬▬▬▬▬ 💛\n\n📝 ━━━ DETALHES DA ASSINATURA ━━━ 📝\n┃ \n┃ ✅ PLANO: 💛TESTE 6HRS || SEM ADULTOS💛\n┃ 💵 VALOR: R$ 0,00\n┃ 👨‍💻 TELAS: 1\n┃ 📆 VENCIMENTO: 19/01/2026 07:20:13\n┃ \n💳 ━━━ RENOVAÇÃO / PAGAMENTO ━━━ 💳\n┃ \n┃ 🔗 ACESSE AQUI: https://global.mplll.com/#/checkout/oQ1Y37GDON/r6LJ6AljLv\n┃ \n🔑 ━━━ SEUS DADOS DE ACESSO ━━━ 🔑\n┃ \n┃ 👤 USUÁRIO: 363517\n┃ 🔐 SENHA: 499493\n┃ 🌐 DNS 1: http://iptv4.glloball.shop:80\n┃ 🌐 DNS 2: http://4iptv.glloball.shop:80\n┃ \n⚙️ ━━━ SMART TV (SAMSUNG / LG) ━━━ ⚙️\n┃ \n┃ 📺 APP: SMARTUP / STB\n┃ 🌐 DNS: 178.156.157.187\n┃ 👤 USUÁRIO: 363517 | 🔐 SENHA: 499493\n┃ \n📺 ━━━ APPS PARCEIROS POR CÓDIGO ━━━ 📺\n(Basta abrir o app e digitar o código abaixo)\n┃ \n┃ 🆔 CÓDIGO: 333336\n┃ 🔹 Assist+ | Playsim\n┃ \n┃ 🆔 CÓDIGO: 1197\n┃ 🔹 Infinity Play | Pop Smart (Roku, Samsung, LG)\n┃ \n┃ 🆔 CÓDIGO: 2026\n┃ 🔹 Brasil IPTV | Flex Player\n┃ \n┃ 👤 USUÁRIO: 363517\n┃ 🔐 SENHA: 499493\n┃ \n✨ ━━━ PARCERIA XCLOUD TV ━━━ ✨\n┃ \n┃ 🆔 PROVIDER: pd\n┃ 👤 USUÁRIO: 363517\n┃ 🔐 SENHA: 499493\n┃ \n💻 ━━━ ACESSO VIA NAVEGADOR (WEB) ━━━ 💻\n┃ \n┃ 🔗 Opção 1: http://web.pds01.site/\n┃ 🔗 Opção 2: http://webtv.iptvblinkplayer.com/xtream-code\n┃ \n🛠️ ━━━ LISTAS DIRETAS (URL M3U) ━━━ 🛠️\n┃ \n┃ 🚀 RECOMENDADO (HLS):\n┃ 🔗 http://iptv4.glloball.shop:80/get.php?username=363517&password=499493&type=m3u_plus&output=hls\n┃ \n┃ 🎞️ OPÇÃO 2 (MPEG-TS):\n┃ 🔗 http://iptv4.glloball.shop:80/get.php?username=363517&password=499493&type=m3u_plus&output=mpegts\n┃ \n┃ 📺 SMART TV (SSIPTV):\n┃ 🔗 http://e.iptv4.glloball.shop/p/363517/499493/ssiptv\n┃ \n📥 ━━━ BAIXAR NO ANDROID / TV BOX ━━━ 📥\n┃ \n┃ 🛒 LOJA VIP: https://globalplay.pds01.site\n┃ \n┃ 📺 GLOBAL PLAY SMV3 ➔ Downloader: 7921297\n┃ 📺 GLOBAL XC 3D ➔ Downloader: 5763684\n┃ 📺 GLOBAL PLAY UNI ➔ Downloader: 9772871\n┃ \n━━━━━━━━━━━━━━━━━━━━━━━━\n📩 Dúvidas? Estamos à disposição! 🤝"
        }
    ]
}