{"dns":"http:\/\/iptv4.glloball.shop:80","username":"345737","connections":1,"password":"133955","package":"\ud83d\udc9bTESTE 1HR || COMPLETO\ud83d\udc9b","createdAt":"2026-01-29 18:33:02","createdAtFormatted":"29\/01\/2026 18:33:02","expiresAt":"2026-01-29 19:33:01","expiresAtFormatted":"29\/01\/2026 19:33:01","payUrl":"https:\/\/global.mplll.com\/#\/checkout\/oQ1Y37GDON\/231qRJoRL4","reply":"\ud83d\udc9b \u25ac\u25ac\u25ac\u25ac\u25ac\u25ac\u25ac \u2726 \u25ac\u25ac\u25ac\u25ac\u25ac\u25ac\u25ac \ud83d\udc9b\n      \ud83c\udf1f IPTV 4 - ACESSO VIP \ud83c\udf1f\n\ud83d\udc9b \u25ac\u25ac\u25ac\u25ac\u25ac\u25ac\u25ac \u2726 \u25ac\u25ac\u25ac\u25ac\u25ac\u25ac\u25ac \ud83d\udc9b\n\n\ud83d\udcdd \u2501\u2501\u2501 DETALHES DA ASSINATURA \u2501\u2501\u2501 \ud83d\udcdd\n\u2503 \n\u2503 \u2705 PLANO: \ud83d\udc9bTESTE 1HR || COMPLETO\ud83d\udc9b\n\u2503 \ud83d\udcb5 VALOR: R$\u00a00,00\n\u2503 \ud83d\udc68\u200d\ud83d\udcbb TELAS: 1\n\u2503 \ud83d\udcc6 VENCIMENTO: 29\/01\/2026 19:33:01\n\u2503 \n\ud83d\udcb3 \u2501\u2501\u2501 RENOVA\u00c7\u00c3O \/ PAGAMENTO \u2501\u2501\u2501 \ud83d\udcb3\n\u2503 \n\u2503 \ud83d\udd17 ACESSE AQUI: https:\/\/global.mplll.com\/#\/checkout\/oQ1Y37GDON\/231qRJoRL4\n\u2503 \n\ud83d\udd11 \u2501\u2501\u2501 SEUS DADOS DE ACESSO \u2501\u2501\u2501 \ud83d\udd11\n\u2503 \n\u2503 \ud83d\udc64 USU\u00c1RIO: 345737\n\u2503 \ud83d\udd10 SENHA: 133955\n\u2503 \ud83c\udf10 DNS 1: http:\/\/iptv4.glloball.shop:80\n\u2503 \ud83c\udf10 DNS 2: http:\/\/4iptv.glloball.shop:80\n\u2503 \n\u2699\ufe0f \u2501\u2501\u2501 SMART TV (SAMSUNG \/ LG) \u2501\u2501\u2501 \u2699\ufe0f\n\u2503 \n\u2503 \ud83d\udcfa APP: SMARTUP \/ STB\n\u2503 \ud83c\udf10 DNS: 178.156.157.187\n\u2503 \ud83d\udc64 USU\u00c1RIO: 345737 | \ud83d\udd10 SENHA: 133955\n\u2503 \n\ud83d\udcfa \u2501\u2501\u2501 APPS PARCEIROS POR C\u00d3DIGO \u2501\u2501\u2501 \ud83d\udcfa\n(Basta abrir o app e digitar o c\u00f3digo abaixo)\n\u2503 \n\u2503 \ud83c\udd94 C\u00d3DIGO: 333336\n\u2503 \ud83d\udd39 Assist+ | Playsim\n\u2503 \n\u2503 \ud83c\udd94 C\u00d3DIGO: 1197\n\u2503 \ud83d\udd39 Infinity Play | Pop Smart (Roku, Samsung, LG)\n\u2503 \n\u2503 \ud83c\udd94 C\u00d3DIGO: 2026\n\u2503 \ud83d\udd39 Brasil IPTV | Flex Player\n\u2503 \n\u2503 \ud83d\udc64 USU\u00c1RIO: 345737\n\u2503 \ud83d\udd10 SENHA: 133955\n\u2503 \n\u2728 \u2501\u2501\u2501 PARCERIA XCLOUD TV \u2501\u2501\u2501 \u2728\n\u2503 \n\u2503 \ud83c\udd94 PROVIDER: pd\n\u2503 \ud83d\udc64 USU\u00c1RIO: 345737\n\u2503 \ud83d\udd10 SENHA: 133955\n\u2503 \n\ud83d\udcbb \u2501\u2501\u2501 ACESSO VIA NAVEGADOR (WEB) \u2501\u2501\u2501 \ud83d\udcbb\n\u2503 \n\u2503 \ud83d\udd17 Op\u00e7\u00e3o 1: http:\/\/web.pds01.site\/\n\u2503 \ud83d\udd17 Op\u00e7\u00e3o 2: http:\/\/webtv.iptvblinkplayer.com\/xtream-code\n\u2503 \n\ud83d\udee0\ufe0f \u2501\u2501\u2501 LISTAS DIRETAS (URL M3U) \u2501\u2501\u2501 \ud83d\udee0\ufe0f\n\u2503 \n\u2503 \ud83d\ude80 RECOMENDADO (HLS):\n\u2503 \ud83d\udd17 http:\/\/iptv4.glloball.shop:80\/get.php?username=345737&password=133955&type=m3u_plus&output=hls\n\u2503 \n\u2503 \ud83c\udf9e\ufe0f OP\u00c7\u00c3O 2 (MPEG-TS):\n\u2503 \ud83d\udd17 http:\/\/iptv4.glloball.shop:80\/get.php?username=345737&password=133955&type=m3u_plus&output=mpegts\n\u2503 \n\u2503 \ud83d\udcfa SMART TV (SSIPTV):\n\u2503 \ud83d\udd17 http:\/\/e.iptv4.glloball.shop\/p\/345737\/133955\/ssiptv\n\u2503 \n\ud83d\udce5 \u2501\u2501\u2501 BAIXAR NO ANDROID \/ TV BOX \u2501\u2501\u2501 \ud83d\udce5\n\u2503 \n\u2503 \ud83d\uded2 LOJA VIP: https:\/\/globalplay.pds01.site\n\u2503 \n\u2503 \ud83d\udcfa GLOBAL PLAY SMV3 \u2794 Downloader: 7921297\n\u2503 \ud83d\udcfa GLOBAL XC 3D \u2794 Downloader: 5763684\n\u2503 \ud83d\udcfa GLOBAL PLAY UNI \u2794 Downloader: 9772871\n\u2503 \n\u2501\u2501\u2501\u2501\u2501\u2501\u2501\u2501\u2501\u2501\u2501\u2501\u2501\u2501\u2501\u2501\u2501\u2501\u2501\u2501\u2501\u2501\u2501\u2501\n\ud83d\udce9 D\u00favidas? Estamos \u00e0 disposi\u00e7\u00e3o! \ud83e\udd1d","data":[{"message":"\ud83d\udc9b \u25ac\u25ac\u25ac\u25ac\u25ac\u25ac\u25ac \u2726 \u25ac\u25ac\u25ac\u25ac\u25ac\u25ac\u25ac \ud83d\udc9b\n      \ud83c\udf1f IPTV 4 - ACESSO VIP \ud83c\udf1f\n\ud83d\udc9b \u25ac\u25ac\u25ac\u25ac\u25ac\u25ac\u25ac \u2726 \u25ac\u25ac\u25ac\u25ac\u25ac\u25ac\u25ac \ud83d\udc9b\n\n\ud83d\udcdd \u2501\u2501\u2501 DETALHES DA ASSINATURA \u2501\u2501\u2501 \ud83d\udcdd\n\u2503 \n\u2503 \u2705 PLANO: \ud83d\udc9bTESTE 1HR || COMPLETO\ud83d\udc9b\n\u2503 \ud83d\udcb5 VALOR: R$\u00a00,00\n\u2503 \ud83d\udc68\u200d\ud83d\udcbb TELAS: 1\n\u2503 \ud83d\udcc6 VENCIMENTO: 29\/01\/2026 19:33:01\n\u2503 \n\ud83d\udcb3 \u2501\u2501\u2501 RENOVA\u00c7\u00c3O \/ PAGAMENTO \u2501\u2501\u2501 \ud83d\udcb3\n\u2503 \n\u2503 \ud83d\udd17 ACESSE AQUI: https:\/\/global.mplll.com\/#\/checkout\/oQ1Y37GDON\/231qRJoRL4\n\u2503 \n\ud83d\udd11 \u2501\u2501\u2501 SEUS DADOS DE ACESSO \u2501\u2501\u2501 \ud83d\udd11\n\u2503 \n\u2503 \ud83d\udc64 USU\u00c1RIO: 345737\n\u2503 \ud83d\udd10 SENHA: 133955\n\u2503 \ud83c\udf10 DNS 1: http:\/\/iptv4.glloball.shop:80\n\u2503 \ud83c\udf10 DNS 2: http:\/\/4iptv.glloball.shop:80\n\u2503 \n\u2699\ufe0f \u2501\u2501\u2501 SMART TV (SAMSUNG \/ LG) \u2501\u2501\u2501 \u2699\ufe0f\n\u2503 \n\u2503 \ud83d\udcfa APP: SMARTUP \/ STB\n\u2503 \ud83c\udf10 DNS: 178.156.157.187\n\u2503 \ud83d\udc64 USU\u00c1RIO: 345737 | \ud83d\udd10 SENHA: 133955\n\u2503 \n\ud83d\udcfa \u2501\u2501\u2501 APPS PARCEIROS POR C\u00d3DIGO \u2501\u2501\u2501 \ud83d\udcfa\n(Basta abrir o app e digitar o c\u00f3digo abaixo)\n\u2503 \n\u2503 \ud83c\udd94 C\u00d3DIGO: 333336\n\u2503 \ud83d\udd39 Assist+ | Playsim\n\u2503 \n\u2503 \ud83c\udd94 C\u00d3DIGO: 1197\n\u2503 \ud83d\udd39 Infinity Play | Pop Smart (Roku, Samsung, LG)\n\u2503 \n\u2503 \ud83c\udd94 C\u00d3DIGO: 2026\n\u2503 \ud83d\udd39 Brasil IPTV | Flex Player\n\u2503 \n\u2503 \ud83d\udc64 USU\u00c1RIO: 345737\n\u2503 \ud83d\udd10 SENHA: 133955\n\u2503 \n\u2728 \u2501\u2501\u2501 PARCERIA XCLOUD TV \u2501\u2501\u2501 \u2728\n\u2503 \n\u2503 \ud83c\udd94 PROVIDER: pd\n\u2503 \ud83d\udc64 USU\u00c1RIO: 345737\n\u2503 \ud83d\udd10 SENHA: 133955\n\u2503 \n\ud83d\udcbb \u2501\u2501\u2501 ACESSO VIA NAVEGADOR (WEB) \u2501\u2501\u2501 \ud83d\udcbb\n\u2503 \n\u2503 \ud83d\udd17 Op\u00e7\u00e3o 1: http:\/\/web.pds01.site\/\n\u2503 \ud83d\udd17 Op\u00e7\u00e3o 2: http:\/\/webtv.iptvblinkplayer.com\/xtream-code\n\u2503 \n\ud83d\udee0\ufe0f \u2501\u2501\u2501 LISTAS DIRETAS (URL M3U) \u2501\u2501\u2501 \ud83d\udee0\ufe0f\n\u2503 \n\u2503 \ud83d\ude80 RECOMENDADO (HLS):\n\u2503 \ud83d\udd17 http:\/\/iptv4.glloball.shop:80\/get.php?username=345737&password=133955&type=m3u_plus&output=hls\n\u2503 \n\u2503 \ud83c\udf9e\ufe0f OP\u00c7\u00c3O 2 (MPEG-TS):\n\u2503 \ud83d\udd17 http:\/\/iptv4.glloball.shop:80\/get.php?username=345737&password=133955&type=m3u_plus&output=mpegts\n\u2503 \n\u2503 \ud83d\udcfa SMART TV (SSIPTV):\n\u2503 \ud83d\udd17 http:\/\/e.iptv4.glloball.shop\/p\/345737\/133955\/ssiptv\n\u2503 \n\ud83d\udce5 \u2501\u2501\u2501 BAIXAR NO ANDROID \/ TV BOX \u2501\u2501\u2501 \ud83d\udce5\n\u2503 \n\u2503 \ud83d\uded2 LOJA VIP: https:\/\/globalplay.pds01.site\n\u2503 \n\u2503 \ud83d\udcfa GLOBAL PLAY SMV3 \u2794 Downloader: 7921297\n\u2503 \ud83d\udcfa GLOBAL XC 3D \u2794 Downloader: 5763684\n\u2503 \ud83d\udcfa GLOBAL PLAY UNI \u2794 Downloader: 9772871\n\u2503 \n\u2501\u2501\u2501\u2501\u2501\u2501\u2501\u2501\u2501\u2501\u2501\u2501\u2501\u2501\u2501\u2501\u2501\u2501\u2501\u2501\u2501\u2501\u2501\u2501\n\ud83d\udce9 D\u00favidas? Estamos \u00e0 disposi\u00e7\u00e3o! \ud83e\udd1d"}]}