{"dns":"http:\/\/iptv3.glloball.shop:80","username":"783884","connections":1,"password":"213129","package":"\ud83d\udc9aTESTE 1HR || COMPLETO\ud83d\udc9a","createdAt":"2026-01-31 23:40:54","createdAtFormatted":"31\/01\/2026 23:40:54","expiresAt":"2026-02-01 00:40:53","expiresAtFormatted":"01\/02\/2026 00:40:53","payUrl":"https:\/\/global.mplll.com\/#\/checkout\/oQ1Y37GDON\/V4D3rnG9La","reply":"\ud83d\udc9a \u25ac\u25ac\u25ac\u25ac\u25ac\u25ac\u25ac \u2726 \u25ac\u25ac\u25ac\u25ac\u25ac\u25ac\u25ac \ud83d\udc9a\n      \ud83c\udf1f IPTV 3 - ACESSO VIP \ud83c\udf1f\n\ud83d\udc9a \u25ac\u25ac\u25ac\u25ac\u25ac\u25ac\u25ac \u2726 \u25ac\u25ac\u25ac\u25ac\u25ac\u25ac\u25ac \ud83d\udc9a\n\n\ud83d\udcdd \u2501\u2501\u2501 DETALHES DA ASSINATURA \u2501\u2501\u2501 \ud83d\udcdd\n\u2503 \n\u2503 \u2705 PLANO: \ud83d\udc9aTESTE 1HR || COMPLETO\ud83d\udc9a\n\u2503 \ud83d\udcb5 VALOR: R$\u00a00,00\n\u2503 \ud83d\udc68\u200d\ud83d\udcbb TELAS: 1\n\u2503 \ud83d\udcc6 VENCIMENTO: 01\/02\/2026 00:40:53\n\u2503 \n\ud83d\udcb3 \u2501\u2501\u2501 RENOVA\u00c7\u00c3O \/ PAGAMENTO \u2501\u2501\u2501 \ud83d\udcb3\n\u2503 \n\u2503 \ud83d\udd17 ACESSE AQUI: https:\/\/global.mplll.com\/#\/checkout\/oQ1Y37GDON\/V4D3rnG9La\n\u2503 \n\ud83d\udd11 \u2501\u2501\u2501 SEUS DADOS DE ACESSO \u2501\u2501\u2501 \ud83d\udd11\n\u2503 \n\u2503 \ud83d\udc64 USU\u00c1RIO: 783884\n\u2503 \ud83d\udd10 SENHA: 213129\n\u2503 \ud83c\udf10 DNS 1: http:\/\/iptv3.glloball.shop:80\n\u2503 \ud83c\udf10 DNS 2: http:\/\/3iptv.glloball.shop:80\n\u2503 \n\ud83d\udcfa \u2501\u2501\u2501 APPS PARCEIROS POR C\u00d3DIGO \u2501\u2501\u2501 \ud83d\udcfa\n(Basta abrir o app e digitar o c\u00f3digo abaixo)\n\u2503 \n\u2503 \ud83c\udd94 C\u00d3DIGO: 248752\n\u2503 \ud83d\udd39 Assist+ | Playsim\n\u2503 \n\u2503 \ud83c\udd94 C\u00d3DIGO: 333741\n\u2503 \ud83d\udd39 Vizzion Play\n\u2503 \n\u2503 \ud83c\udd94 C\u00d3DIGO: 1274\n\u2503 \ud83d\udd39 Top Play | Magic Play (Roku e iOS)\n\u2503 \n\u2503 \ud83c\udd94 C\u00d3DIGO: 129051 (Power Play)\n\u2503 \ud83c\udd94 C\u00d3DIGO: 443300 (Epic Play)\n\u2503 \n\u2503 \ud83d\udc64 USU\u00c1RIO: 783884\n\u2503 \ud83d\udd10 SENHA: 213129\n\u2503 \n\u2728 \u2501\u2501\u2501 PARCERIA XCLOUD TV \u2501\u2501\u2501 \u2728\n\u2503 \n\u2503 \ud83c\udd94 PROVIDER: pd\n\u2503 \ud83d\udc64 USU\u00c1RIO: 783884\n\u2503 \ud83d\udd10 SENHA: 213129\n\u2503 \n\ud83d\udee0\ufe0f \u2501\u2501\u2501 APPS QUE USAM LISTA (M3U) \u2501\u2501\u2501 \ud83d\udee0\ufe0f\n\u2503 \n\u2503 \ud83d\udd18 MULTIAPPS (Samsung, LG, Roku, Android)\n\u2503 \ud83d\udcf1 IPTV Player io, OTT Player, IPTV 4K, \n\u2503 Stream Player, Pro Player, Star, TVIP, etc.\n\u2503 \n\u2503 \ud83d\udd17 COPIE ESTA LISTA:\n\u2503 http:\/\/topcdn.fun\/get.php?username=783884&password=213129&type=m3u_plus&output=mpegts\n\u2503 \n\ud83d\udce5 \u2501\u2501\u2501 BAIXAR NO ANDROID \/ TV BOX \u2501\u2501\u2501 \ud83d\udce5\n\u2503 \n\u2503 \ud83d\udcfa ASSIST+ \u2794 Downloader: 8209473\n\u2503 \ud83d\udcfa PLAYSIM \u2794 Downloader: 7275096\n\u2503 \ud83d\udcfa VIZZION PLAY \u2794 Downloader: 2868880\n\u2503 \n\u2503 \ud83d\udce5 Alternativo (Ntdown):\n\u2503 \ud83d\udd39 Assist+: 77646 | \ud83d\udd39 Playsim: 72853\n\u2503 \n\ud83d\udce5 \u2501\u2501\u2501 BAIXAR NO ANDROID \/ TV BOX \u2501\u2501\u2501 \ud83d\udce5\n\u2503 \n\u2503 \ud83d\uded2 LOJA VIP: https:\/\/globalplay.pds01.site\n\u2503 \n\u2503 \ud83d\udcfa GLOBAL PLAY SMV3 \n\u2503 \ud83d\udce5 Downloader: 7921297\n\u2503 \n\u2503 \ud83d\udcfa GLOBAL XC 3D\n\u2503 \ud83d\udce5 Downloader: 5763684\n\u2503 \n\u2503 \ud83d\udcfa GLOBAL PLAY UNI\n\u2503 \ud83d\udce5 Downloader: 9772871\n\u2503 \n\ud83d\udd17 \u2501\u2501\u2501 LISTAS DIRETAS (URL) \u2501\u2501\u2501 \ud83d\udd17\n\u2503 \n\u2503 \ud83d\ude80 RECOMENDADO (HLS):\n\u2503 \ud83d\udd17 http:\/\/iptv3.glloball.shop:80\/get.php?username=783884&password=213129&type=m3u_plus&output=hls\n\u2503 \n\u2503 \ud83c\udf9e\ufe0f OP\u00c7\u00c3O 2 (MPEG-TS):\n\u2503 \ud83d\udd17 http:\/\/iptv3.glloball.shop:80\/get.php?username=783884&password=213129&type=m3u_plus&output=mpegts\n\u2503 \n\u2503 \ud83d\udcfa SMART TV (SSIPTV):\n\u2503 \ud83d\udd17 http:\/\/e.iptv3.glloball.shop\/p\/783884\/213129\/ssiptv\n\u2503 \n\u2501\u2501\u2501\u2501\u2501\u2501\u2501\u2501\u2501\u2501\u2501\u2501\u2501\u2501\u2501\u2501\u2501\u2501\u2501\u2501\u2501\u2501\u2501\u2501\n\ud83d\udce9 D\u00favidas? Estamos \u00e0 disposi\u00e7\u00e3o! \ud83e\udd1d","data":[{"message":"\ud83d\udc9a \u25ac\u25ac\u25ac\u25ac\u25ac\u25ac\u25ac \u2726 \u25ac\u25ac\u25ac\u25ac\u25ac\u25ac\u25ac \ud83d\udc9a\n      \ud83c\udf1f IPTV 3 - ACESSO VIP \ud83c\udf1f\n\ud83d\udc9a \u25ac\u25ac\u25ac\u25ac\u25ac\u25ac\u25ac \u2726 \u25ac\u25ac\u25ac\u25ac\u25ac\u25ac\u25ac \ud83d\udc9a\n\n\ud83d\udcdd \u2501\u2501\u2501 DETALHES DA ASSINATURA \u2501\u2501\u2501 \ud83d\udcdd\n\u2503 \n\u2503 \u2705 PLANO: \ud83d\udc9aTESTE 1HR || COMPLETO\ud83d\udc9a\n\u2503 \ud83d\udcb5 VALOR: R$\u00a00,00\n\u2503 \ud83d\udc68\u200d\ud83d\udcbb TELAS: 1\n\u2503 \ud83d\udcc6 VENCIMENTO: 01\/02\/2026 00:40:53\n\u2503 \n\ud83d\udcb3 \u2501\u2501\u2501 RENOVA\u00c7\u00c3O \/ PAGAMENTO \u2501\u2501\u2501 \ud83d\udcb3\n\u2503 \n\u2503 \ud83d\udd17 ACESSE AQUI: https:\/\/global.mplll.com\/#\/checkout\/oQ1Y37GDON\/V4D3rnG9La\n\u2503 \n\ud83d\udd11 \u2501\u2501\u2501 SEUS DADOS DE ACESSO \u2501\u2501\u2501 \ud83d\udd11\n\u2503 \n\u2503 \ud83d\udc64 USU\u00c1RIO: 783884\n\u2503 \ud83d\udd10 SENHA: 213129\n\u2503 \ud83c\udf10 DNS 1: http:\/\/iptv3.glloball.shop:80\n\u2503 \ud83c\udf10 DNS 2: http:\/\/3iptv.glloball.shop:80\n\u2503 \n\ud83d\udcfa \u2501\u2501\u2501 APPS PARCEIROS POR C\u00d3DIGO \u2501\u2501\u2501 \ud83d\udcfa\n(Basta abrir o app e digitar o c\u00f3digo abaixo)\n\u2503 \n\u2503 \ud83c\udd94 C\u00d3DIGO: 248752\n\u2503 \ud83d\udd39 Assist+ | Playsim\n\u2503 \n\u2503 \ud83c\udd94 C\u00d3DIGO: 333741\n\u2503 \ud83d\udd39 Vizzion Play\n\u2503 \n\u2503 \ud83c\udd94 C\u00d3DIGO: 1274\n\u2503 \ud83d\udd39 Top Play | Magic Play (Roku e iOS)\n\u2503 \n\u2503 \ud83c\udd94 C\u00d3DIGO: 129051 (Power Play)\n\u2503 \ud83c\udd94 C\u00d3DIGO: 443300 (Epic Play)\n\u2503 \n\u2503 \ud83d\udc64 USU\u00c1RIO: 783884\n\u2503 \ud83d\udd10 SENHA: 213129\n\u2503 \n\u2728 \u2501\u2501\u2501 PARCERIA XCLOUD TV \u2501\u2501\u2501 \u2728\n\u2503 \n\u2503 \ud83c\udd94 PROVIDER: pd\n\u2503 \ud83d\udc64 USU\u00c1RIO: 783884\n\u2503 \ud83d\udd10 SENHA: 213129\n\u2503 \n\ud83d\udee0\ufe0f \u2501\u2501\u2501 APPS QUE USAM LISTA (M3U) \u2501\u2501\u2501 \ud83d\udee0\ufe0f\n\u2503 \n\u2503 \ud83d\udd18 MULTIAPPS (Samsung, LG, Roku, Android)\n\u2503 \ud83d\udcf1 IPTV Player io, OTT Player, IPTV 4K, \n\u2503 Stream Player, Pro Player, Star, TVIP, etc.\n\u2503 \n\u2503 \ud83d\udd17 COPIE ESTA LISTA:\n\u2503 http:\/\/topcdn.fun\/get.php?username=783884&password=213129&type=m3u_plus&output=mpegts\n\u2503 \n\ud83d\udce5 \u2501\u2501\u2501 BAIXAR NO ANDROID \/ TV BOX \u2501\u2501\u2501 \ud83d\udce5\n\u2503 \n\u2503 \ud83d\udcfa ASSIST+ \u2794 Downloader: 8209473\n\u2503 \ud83d\udcfa PLAYSIM \u2794 Downloader: 7275096\n\u2503 \ud83d\udcfa VIZZION PLAY \u2794 Downloader: 2868880\n\u2503 \n\u2503 \ud83d\udce5 Alternativo (Ntdown):\n\u2503 \ud83d\udd39 Assist+: 77646 | \ud83d\udd39 Playsim: 72853\n\u2503 \n\ud83d\udce5 \u2501\u2501\u2501 BAIXAR NO ANDROID \/ TV BOX \u2501\u2501\u2501 \ud83d\udce5\n\u2503 \n\u2503 \ud83d\uded2 LOJA VIP: https:\/\/globalplay.pds01.site\n\u2503 \n\u2503 \ud83d\udcfa GLOBAL PLAY SMV3 \n\u2503 \ud83d\udce5 Downloader: 7921297\n\u2503 \n\u2503 \ud83d\udcfa GLOBAL XC 3D\n\u2503 \ud83d\udce5 Downloader: 5763684\n\u2503 \n\u2503 \ud83d\udcfa GLOBAL PLAY UNI\n\u2503 \ud83d\udce5 Downloader: 9772871\n\u2503 \n\ud83d\udd17 \u2501\u2501\u2501 LISTAS DIRETAS (URL) \u2501\u2501\u2501 \ud83d\udd17\n\u2503 \n\u2503 \ud83d\ude80 RECOMENDADO (HLS):\n\u2503 \ud83d\udd17 http:\/\/iptv3.glloball.shop:80\/get.php?username=783884&password=213129&type=m3u_plus&output=hls\n\u2503 \n\u2503 \ud83c\udf9e\ufe0f OP\u00c7\u00c3O 2 (MPEG-TS):\n\u2503 \ud83d\udd17 http:\/\/iptv3.glloball.shop:80\/get.php?username=783884&password=213129&type=m3u_plus&output=mpegts\n\u2503 \n\u2503 \ud83d\udcfa SMART TV (SSIPTV):\n\u2503 \ud83d\udd17 http:\/\/e.iptv3.glloball.shop\/p\/783884\/213129\/ssiptv\n\u2503 \n\u2501\u2501\u2501\u2501\u2501\u2501\u2501\u2501\u2501\u2501\u2501\u2501\u2501\u2501\u2501\u2501\u2501\u2501\u2501\u2501\u2501\u2501\u2501\u2501\n\ud83d\udce9 D\u00favidas? Estamos \u00e0 disposi\u00e7\u00e3o! \ud83e\udd1d"}]}