{"dns":"http:\/\/lite.morfeus.site","username":"2380916","connections":1,"password":"8433475","package":"\ud83c\udfa9 [TESTE 04H] - SHAZAM","createdAt":"2026-01-22 21:14:09","createdAtFormatted":"22\/01\/2026 21:14:09","expiresAt":"2026-01-23 01:14:09","expiresAtFormatted":"23\/01\/2026 01:14:09","payUrl":"https:\/\/havoktv.top\/#\/checkout\/231qZgNL4q\/MeWe0EpODn","reply":"\u2b50 Seja bem vindo ao SHAZAM \u2b50\n\n\u256d\n\u251c\u25cf \u2705 Usu\u00e1rio: 2380916\n\u251c\u25cf \u2705 Senha: 8433475\n\u251c\u25cf \ud83d\udcf6 Conex\u00f5es: 3\n\u251c\u25cf \ud83d\udcb5 Pre\u00e7o do Plano: R$\u00a025,00\n\u251c\u25cf \ud83d\uddd3\ufe0f Criado em: 22\/01\/2026 21:14:09\n\u251c\u25cf \ud83d\uddd3\ufe0f Vencimento: 23\/01\/2026 01:14:09\n\n\u256d \ud83d\udcb3 Assinar\/Renovar Plano: \n\u251c\u25cf https:\/\/havoktv.top\/#\/checkout\/231qZgNL4q\/MeWe0EpODn\n\n\u2501\u2501\u2501\u2501\u2501\u2501\u2501\u2501\u2501\u2501\u2501\u2501\u2501\u2501 \n\n\ud83d\udfe2 LINKS M3U - URL - PLAY LIST - PARA APPS PAGOS:\n\n\ud83d\udfe2 Se uma lista n\u00e3o funcionar bem, basta trocar por outra. Voc\u00ea tem 3 op\u00e7\u00f5es dispon\u00edveis: TS, MPEGTS e HLS.\n\n\n\u256d \ud83d\udfe0 Link M3U - TS\n\u251c\u25cf http:\/\/lite.morfeus.site\/get.php?username=2380916&password=8433475&type=m3u_plus&output=ts\n\n\u256d \ud83d\udfe0 Link M3U - MPEGTS\n\u251c\u25cf http:\/\/lite.morfeus.site\/get.php?username=2380916&password=8433475&type=m3u_plus&output=mpegts\n\n\u256d \ud83d\udfe0 Link M3U - HLS\n\u251c\u25cf http:\/\/lite.morfeus.site\/get.php?username=2380916&password=8433475&type=m3u_plus&output=hls\n\n\u256d \ud83d\udfe0 Link SSIPTV\n\u251c\u25cf http:\/\/e.lite.morfeus.site\/p\/2380916\/8433475\/ssiptv\n\n\u256d \ud83d\udfe0 DNS - XCIPTV - 9XTREAM - APPS PR\u00d3PRIOS\n\u251c\u25cf http:\/\/lite.morfeus.site\n\n\ud83c\udf10 STB 5.189.150.71\n\n\u2501\u2501\u2501\u2501\u2501\u2501\u2501\u2501\u2501\u2501\u2501\u2501\u2501\u2501 \n\n\u27a1\ufe0f Acesse o link abaixo e conhe\u00e7a nosso bot de ativa\u00e7\u00f5es autom\u00e1ticas:\n \n\u26a1\ufe0fAtivador de aplicativos no Telegram:\nhttps:\/\/t.me\/ATIVADORTOP_BOT\n\n\u26a1\ufe0fAtivador de aplicativos Site Web 01:\nhttp:\/\/ativadortop.com\/\n\n\u26a1\ufe0fAtivador de aplicativos Site Web 02:\nhttps:\/\/ativeapp.com\/index\/havoktv\n\n\u2501\u2501\u2501\u2501\u2501\u2501\u2501\u2501\u2501\u2501\u2501\u2501\u2501\u2501 \n\n\ud83d\udfe2 APLICATIVOS PARCEIRO\n\n\n\u251c\u25cf\ud83c\udf00 PLAY SIM \n\u256d\n\u251c\u25cf \u2705 C\u00f3digo: 00639\n\u251c\u25cf \u2705 Usu\u00e1rio: 2380916                                                                \n\u251c\u25cf \u2705 Senha: 8433475                                                                  \n\u2570\n\u2501\u2501\u2501\u2501\u2501\u2501\u2501\u2501\u2501\u2501\u2501\u2501\u2501\u2501\n\n\u251c\u25cf\ud83c\udf00 ASSIST PLUS\n\u256d\n\u251c\u25cf \u2705 C\u00f3digo: 00639\n\u251c\u25cf \u2705 Usu\u00e1rio: 2380916                                                                \n\u251c\u25cf \u2705 Senha: 8433475                                                                  \n\u2570\n\u2501\u2501\u2501\u2501\u2501\u2501\u2501\u2501\u2501\u2501\u2501\u2501\u2501\u2501\n\n\u251c\u25cf\ud83c\udf00 VIZION PLAY\n\u256d\n\u251c\u25cf \u2705 C\u00f3digo: 00639\n\u251c\u25cf \u2705 Usu\u00e1rio: 2380916                                                                \n\u251c\u25cf \u2705 Senha: 8433475                                                                  \n\u2570\n\u2501\u2501\u2501\u2501\u2501\u2501\u2501\u2501\u2501\u2501\u2501\u2501\u2501\u2501\n\n\u251c\u25cf\ud83c\udf00 POWER PLAY\n\u256d\n\u251c\u25cf \u2705 C\u00f3digo: 00639\n\u251c\u25cf \u2705 Usu\u00e1rio: 2380916                                                                \n\u251c\u25cf \u2705 Senha: 8433475                                                                  \n\u2570\n\u2501\u2501\u2501\u2501\u2501\u2501\u2501\u2501\u2501\u2501\u2501\u2501\u2501\u2501\n\n\u251c\u25cf\ud83c\udf00 SUPER PLAY\n\u256d\n\u251c\u25cf \u2705 C\u00f3digo: 00639\n\u251c\u25cf \u2705 Usu\u00e1rio: 2380916                                                                \n\u251c\u25cf \u2705 Senha: 8433475                                                                  \n\u2570\n\u2501\u2501\u2501\u2501\u2501\u2501\u2501\u2501\u2501\u2501\u2501\u2501\u2501\u2501\n\n\u251c\u25cf\ud83c\udf00 XCLOUD - SAMSUNG - LG - ROKU \n\u256d\n\u251c\u25cf \u2705 C\u00f3digo: CY33 ou THX50\n\u251c\u25cf \u2705 Usu\u00e1rio: 2380916                                                                \n\u251c\u25cf \u2705 Senha: 8433475                                                                  \n\u2570\u2500\n\u2501\u2501\u2501\u2501\u2501\u2501\u2501\u2501\u2501\u2501\u2501\u2501\u2501\u2501\n\n\u251c\u25cf\ud83c\udf00 IPTV PREMIUM \nSAMSUNG - LG - ROKU - IOS - ANDROID - PLAY STORE\n\n\u256d\n\u251c\u25cf \u2705 C\u00f3digo: CY33 ou THX50\n\u251c\u25cf \u2705 Usu\u00e1rio: 2380916\n\u251c\u25cf \u2705 Senha: 8433475\n\u2570\n\u2501\u2501\u2501\u2501\u2501\u2501\u2501\u2501\u2501\u2501\u2501\u2501\u2501\u2501\n\n\ud83d\udfe2 APLICATIVOS: XCIPTV - 9XTREAM - SMARTERS \n\u256d\n\u251c\u25cf \u2705 Usu\u00e1rio: 2380916\n\u251c\u25cf \u2705 Senha: 8433475\n\u251c\u25cf \u2705 DNS: http:\/\/lite.morfeus.site\n\u2570\n\u2501\u2501\u2501\u2501\u2501\u2501\u2501\u2501\u2501\u2501\u2501\u2501\u2501\u2501\n\n\ud83d\udc47 App (Via DOWNLOADER BY AFTVNEWS E NTDOWN):\n\nloja 1:  https:\/\/lojacinebr.in\nloja 2: https:\/\/loja-cineflix.appshow.top\n\n\ud83c\udf00 XC LITE - O MAIS LEVE \n\n\ud83d\udfe0 Apk: https:\/\/fui.ai\/xclite\n\ud83d\udfe4 C\u00f3digo Downloader: 3564741\n\ud83d\udfe4 C\u00f3digo NTdown: 32475\n\n\u2501\u2501\u2501\u2501\u2501\u2501\u2501\u2501\u2501\u2501\u2501\u2501\u2501\u2501\n\n\u251c\u25cf \ud83c\udf00 HAVOK IBO 4K PLUS\n\n- N\u00c3O \u00c9 RECOMENDAOD PARA APARELHOS COM POUCA MEM\u00d3RIA\n- N\u00c3O \u00c9 RECOMENDADO PARA TV BOX MXQ\n\n- PODE USAR NO CELULAR\n- PODE USAR EM TVs ANDROIDS E GOOGLE TV\n- PODE USAR EM FIRE STICK E MI STICK\n\n\u251c\u25cf \u2705 Usu\u00e1rio: 2380916\n\u251c\u25cf \u2705 Senha: 8433475\n\u251c\u25cf \ud83d\udfe0 Apk: https:\/\/aftv.news\/9538197\n\u251c\u25cf \ud83d\udfe4 C\u00f3digo Downloader: 9538197\n\u251c\u25cf \ud83d\udfe4 C\u00f3digo NTdown: 13373\n\n\u2501\u2501\u2501\u2501\u2501\u2501\u2501\u2501\u2501\u2501\u2501\u2501\u2501\u2501\n\n\u251c\u25cf \ud83c\udf00  HAVOK TIVI\n\n- N\u00c3O \u00c9 RECOMENDAOD PARA APARELHOS COM POUCA MEM\u00d3RIA\n- N\u00c3O \u00c9 RECOMENDADO PARA TV BOX MXQ\n- N\u00c3O PODE USAR NO CELULAR\n\n- PODE USAR EM TVs ANDROIDS E GOOGLE TV\n- PODE USAR EM FIRE STICK E MI STICK\n\n\u256d\n\u251c\u25cf \u2705 Usu\u00e1rio: 2380916\n\u251c\u25cf \u2705 Senha: 8433475\n\u251c\u25cf \ud83d\udfe0 Apk: https:\/\/aftv.news\/2625911\n\u251c\u25cf \ud83d\udfe4 C\u00f3digo Downloader: 2625911\n\u251c\u25cf \ud83d\udfe4 C\u00f3digo NTdown: 55846\n\u2570\n\u2501\u2501\u2501\u2501\u2501\u2501\u2501\u2501\u2501\u2501\u2501\u2501\u2501\u2501\n\n\u251c\u25cf\ud83c\udf00  HAVOK V3\n\n- APP PARA TV BOX MXQ E APARELHOS COM POUCA MEM\u00d3RIA.\n- BOM PRA CELULAR\n- FAZ ESPELHAMENTO\n\u256d\n\u251c\u25cf  \u2705 Usu\u00e1rio: 2380916\n\u251c\u25cf  \u2705 Senha: 8433475\n\u251c\u25cf  \ud83d\udfe0 Apk: https:\/\/aftv.news\/6442116\n\u251c\u25cf  \ud83d\udfe4 C\u00f3digo Downloader: 6442116\n\u251c\u25cf  \ud83d\udfe4 C\u00f3digo NTdown: 47959\n\u2570\n\u2501\u2501\u2501\u2501\u2501\u2501\u2501\u2501\u2501\u2501\u2501\u2501\u2501\u2501\n\n\u251c\u25cf\ud83c\udf00  HAVOK LEGACY\n\n- N\u00c3O \u00c9 RECOMENDAOD PARA APARELHOS COM POUCA MEM\u00d3RIA\n- N\u00c3O \u00c9 RECOMENDADO PARA TV BOX MXQ\n- N\u00c3O \u00c9 RECOMENDADO USAR NO CELULAR\n\n- PODE USAR EM TVs ANDROIDS E GOOGLE TV\n- PODE USAR EM FIRE STICK E MI STICK\n\n\u256d\n\u251c\u25cf  \u2705 Usu\u00e1rio: 2380916\n\u251c\u25cf  \u2705 Senha: 8433475\n\u251c\u25cf  \ud83d\udfe0 Apk: https:\/\/fui.ai\/havoklegacy\n\u251c\u25cf  \ud83d\udfe4 C\u00f3digo Downloader: 8621576\n\u251c\u25cf  \ud83d\udfe4 C\u00f3digo NTdown: 23381\n\u2570\n\u2501\u2501\u2501\u2501\u2501\u2501\u2501\u2501\u2501\u2501\u2501\u2501\u2501\u2501\n\n\u251c\u25cf\ud83c\udf00  HAVOK IBO PRO\n\n- APP PARA TV BOX MXQ E APARELHOS COM POUCA MEM\u00d3RIA.\n- BOM PRA CELULAR\n\u256d\n\u251c\u25cf  \u2705 Usu\u00e1rio: 2380916\n\u251c\u25cf  \u2705 Senha: 8433475\n\u251c\u25cf  \ud83d\udfe0 Apk: https:\/\/aftv.news\/2660097\n\u251c\u25cf  \ud83d\udfe4 C\u00f3digo Downloader: 2660097\n\u251c\u25cf  \ud83d\udfe4 C\u00f3digo NTdown: 23412\n\u2570\n\n\u2501\u2501\u2501\u2501\u2501\u2501\u2501\u2501\u2501\u2501\u2501\u2501\u2501\u2501 \n\n\ud83d\udc47 APLICATIVO IOS IPHONE\n\n\u251c\u25cf\ud83c\udf00IPTV SMARTERS LITE\n\n\u256d\u2500 \n\u251c\u25cf  \u2705 Usu\u00e1rio: 2380916\n\u251c\u25cf  \u2705 Senha: 8433475\n\u251c\u25cf  \u2705 DNS: http:\/\/lite.morfeus.site\n\u2570 https:\/\/apps.apple.com\/br\/app\/smarters-player-lite\/id1628995509\n\n\u2501\u2501\u2501\u2501\u2501\u2501\u2501\u2501\u2501\u2501\u2501\u2501\u2501\u2501 \n\n\u251c\u25cf\ud83c\udf00 XCLOUD ou IPTV PREMIUM \n\u256d\n\u251c\u25cf \u2705 C\u00f3digo: CN1030\n\u251c\u25cf \u2705 Usu\u00e1rio: 2380916                                                                \n\u251c\u25cf \u2705 Senha: 8433475                                                                  \n\u2570 https:\/\/apps.apple.com\/br\/app\/xcloud-mobile\/id6471106231\n\n\u2501\u2501\u2501\u2501\u2501\u2501\u2501\u2501\u2501\u2501\u2501\u2501\u2501\u2501 \n\n\ud83d\udc47 APLICATIVO WEB COMPUTADOR\n\n\u256d\n\u251c\u25cf  \u2705 Usu\u00e1rio: 2380916\n\u251c\u25cf  \u2705 Senha: 8433475\n\nhttp:\/\/web.pds01.site\/\n\n\u2501\u2501\u2501\u2501\u2501\u2501\u2501\u2501\u2501\u2501\u2501\u2501\u2501\u2501 \n\n\ud83d\udc47 APLICATIVO PARA VIDEO GAME\n\n\u251c\u25cf\ud83c\udf00  XBOX ONE \n\u256d\n\u251c\u25cf  \u2705 Usu\u00e1rio: 2380916\n\u251c\u25cf  \u2705 Senha: 8433475\n\u2570\n\u256d \ud83d\udfe0 DUPLEX PLAY SITE LSITA:\n\u251c\u25cf https:\/\/edit.duplexplay.com\/\n\u2570\n\u256d \ud83d\udfe0 APRENDA A COMO ADICIONAR LISTA NO XBOX\n\u251c\u25cfhttps:\/\/www.youtube.com\/watch?v=YQ-i8I5l910\n\n\u2501\u2501\u2501\u2501\u2501\u2501\u2501\u2501\u2501\u2501\u2501\u2501\u2501\u2501 \n\n\u251c\u25cf\ud83c\udf00 PS4\u25cf\n\n\u256d\n\u251c\u25cf  \u2705 Usu\u00e1rio: 2380916\n\u251c\u25cf  \u2705 Senha: 8433475\n\u2570\n\u256d\n\u251c\u25cf \ud83d\udfe0 SS-IPTV via Navegador           \n\u251c\u25cf \ud83d\udfe0 Link (SSIPTV): http:\/\/e.lite.morfeus.site\/p\/2380916\/8433475\/ssiptv\n\n\u2501\u2501\u2501\u2501\u2501\u2501\u2501\u2501\u2501\u2501\u2501\u2501\u2501\u2501 \n\n\ud83d\udc47 APLICATIVO PARA CHROMECAST\n\n\u251c\u25cf\ud83c\udf00  V3 - ANDROID  \n\u256d\n\u251c\u25cf  \u2705 Usu\u00e1rio: 2380916\n\u251c\u25cf  \u2705 Senha: 8433475\n\u251c\u25cf  \ud83d\udfe0 Apk: https:\/\/aftv.news\/6442116\n\u251c\u25cf  \ud83d\udfe4 C\u00f3digo Downloader: 6442116\n\u251c\u25cf  \ud83d\udfe4 C\u00f3digo NTdown: 47959\n\u2570\n\n\u251c\u25cf\ud83c\udf00  SMARTERS PLAYER (VERS\u00c3O PAGA) - IPHONE \n\u256d\n\u251c\u25cf  \u2705 Usu\u00e1rio: 2380916\n\u251c\u25cf  \u2705 Senha: 8433475\n\u251c\u25cf  \u2705 DNS: http:\/\/lite.morfeus.site\n\u2570 https:\/\/apps.apple.com\/app\/id1628995509\n\n\u2501\u2501\u2501\u2501\u2501\u2501\u2501\u2501\u2501\u2501\u2501\u2501\u2501\u2501 \n\n\ud83d\udc47  DEVELOPS IP\n\u256d\n\u251c\u25cf  \ud83c\udf00 DUPLECAST: 65.108.220.18\n\u251c\u25cf  \ud83c\udf00 CLOUDDY: 46.165.236.165\n\u251c\u25cf  \ud83c\udf00 SMARTONE: 5.78.42.49\n\u251c\u25cf  \ud83c\udf00 SMART IPTV: 116.202.226.250\n\u251c\u25cf  \ud83c\udf00 SS IPTV: 91.122.100.196 (gr\u00e1tis)\n\u251c\u25cf  \ud83c\udf00 SET IPTV: 94.23.97.11\n\u251c\u25cf  \ud83c\udf00 DUPLEX: 192.185.7.111\n\u2570\n\u256d \u26a0\ufe0f Ativar modo develop Samsung\n\u251c\u25cf \ud83d\udfe0 https:\/\/abrela.me\/clouddysamsung\n\n\u2501\u2501\u2501\u2501\u2501\u2501\u2501\u2501\u2501\u2501\u2501\u2501\u2501\u2501 \n\n\ud83d\udc47 APLICATIVO PARA PANASONIC\n\n\u251c\u25cf\ud83c\udf00 SSIPTV  \n\u256d\n\u251c\u25cf  \u2705 SS IPTV: 91.122.100.196 (gr\u00e1tis)\n\u2570 http:\/\/e.dns.invernoquente.online\/p\/3489741\/3057520\/ssiptv\n\n\u2501\u2501\u2501\u2501\u2501\u2501\u2501\u2501\u2501\u2501\u2501\u2501\u2501\u2501 \n\n\ud83d\udc47 APLICATIVO PARA TV MUITO ANTIGA \n\u256d\n\u251c\u25cf \ud83c\udf00 Smart One\n\u251c\u25cf \ud83d\udfe0 https:\/\/smartone-iptv.com\/\n\u2570\n\u256d\n\u251c\u25cf \ud83c\udf00 Bay IPTV\n\u251c\u25cf \ud83d\udfe0 https:\/\/bayip.tv\/\n\u2570\n\u256d\n\u251c\u25cf \ud83c\udf00  SSIPTV\n\u251c\u25cf \ud83d\udfe0 https:\/\/ss-iptv.com\/en\/users\/playlist\n\n\u256d\n\u251c\u25cf \ud83c\udf00 CLOUDDY\n\u251c\u25cf \ud83d\udfe0 https:\/\/clouddy.online\/\n\u2570\n\n\u256d\u26a0\ufe0f APRENDA CRIAR EMAILS PARA O CLOUDDY:\n\u251c\u25cf \ud83d\udfe0 https:\/\/youtu.be\/ccCKcccPSEI?si=2Z7JRzrxDiL6tGpg\n\n\u256d \u26a0\ufe0fAPRENDA A COMO ADICIONAR LISTA NO CLOUDDY:\n\u251c\u25cf \ud83d\udfe0 https:\/\/www.youtube.com\/watch?v=HsAjq5O7G3c\n\u251c\u25cf \ud83d\udfe0 https:\/\/www.youtube.com\/watch?v=gXDCR4Nccx8\n\n\u256d\n\u251c\u25cf  \ud83d\udfe4 Download: 533745\n\u251c\u25cf \ud83d\udfe4 DEVLOP IP: 65.108.220.18\n\u2570\n\n\u2501\u2501\u2501\u2501\u2501\u2501\u2501\u2501\u2501\u2501\u2501\u2501\u2501\u2501\n\n\ud83e\udde9 Tutoriais de instala\u00e7\u00e3o e ativa\u00e7\u00e3o de aplicativos pagos\n\n\n\u2705 Compat\u00edvel com qualquer tipo de sistema:\nRoku, Samsung, LG, Android, Windows, iPhone e dispositivos da Play Store.\n\n\u26a0\ufe0f A lista que voc\u00ea precisa inserir no site em Play List, chama-se lista M3U.\n\nVoc\u00ea pode obter essa lista gerando um teste diretamente no servidor de sua escolha.\n\n\n\ud83d\udcfa Para modelos novos \ud83d\udcfa\n\n\u27a1\ufe0f Vu Player Pro\nSite pra por a lista: https:\/\/vuproplayer.org\/\nDownload: 327187\nTutorial: https:\/\/www.youtube.com\/watch?v=X_cpOSz535k\n\n\u27a1\ufe0f Ibo Pro\nSite pra por a lista: https:\/\/iboproapp.com\/\nDownload: 481220\nTutorial:\u00a0https:\/\/www.youtube.com\/watch?v=hY9pWlPQEMs\n\n\u27a1\ufe0f Ibo Player\nSite pra por a lista: https:\/\/iboproapp.com\/\nTutorial:\u00a0https:\/\/www.youtube.com\/watch?v=9dkg8Or3IQo\n\n\u27a1\ufe0f Duplex Play \nSite pra por a lista: https:\/\/www.duplexplay.net\/\nTutorial: https:\/\/www.youtube.com\/watch?v=ZuLQS8sy_4A\n\n\u27a1\ufe0f Duplecast\nSite pra por a lista: https:\/\/duplecast.com\/\nTutorial: https:\/\/www.youtube.com\/watch?v=AuyTY8gOvZI\n\n\u27a1\ufe0f Enzo Player\nSite pra por a lista: https:\/\/enzoplayer.com\/\nTutorial: https:\/\/www.youtube.com\/watch?v=Uu9Rl7agjAA\n\n\u27a1\ufe0f Ninja Player\nSite pra por a lista: https:\/\/meta-player.app\/\nTutorial: https:\/\/www.youtube.com\/watch?v=5FN8J-ceu6c\n\n\n\ud83d\udcfa Para modelos antigos \ud83d\udcfa\n\n\n\u27a1\ufe0f SSIPTV  \nSite pra por a lista: https:\/\/ss-iptv.com\/en\/users\/playlist\nTutorial: https:\/\/www.youtube.com\/watch?v=yuZwkY9IF3k\n\n\u27a1\ufe0f CLOUDDY  \nSite pra por a lista: https:\/\/clouddy.online\/\nTutorial: https:\/\/www.youtube.com\/watch?v=e83E91MlsHM\n\n\u27a1\ufe0f SmartOne \nSite pra por a lista: https:\/\/smartone-iptv.com\/\nTutorial: https:\/\/www.youtube.com\/watch?v=fQnzN7C0TwA\n\n\u27a1\ufe0f SET IPTV \nSite pra por a lista: https:\/\/cms.manage-setiptv.com\/set.app\nTutorial: https:\/\/www.youtube.com\/watch?v=UqP7HJUBqNY\n\n\u27a1\ufe0f BAY IPTV\nSite pra por a lista: https:\/\/cms.bayip.tv\/user\/manage\/playlist\nTutorial: https:\/\/www.youtube.com\/watch?v=Bg9ZSzZPKEo\n\n\n\u2705 Ibo Player ou Ibo Pro Descubra Qual \u00e9 o Melhor para Voc\u00ea!\nhttps:\/\/www.youtube.com\/watch?v=rDiHGTdd5ww\n\n\u2705 Ative a licen\u00e7a do aplicativo por aqui:\nhttps:\/\/t.me\/ativacaoprobot?start=828282836","data":[{"message":"\u2b50 Seja bem vindo ao SHAZAM \u2b50\n\n\u256d\n\u251c\u25cf \u2705 Usu\u00e1rio: 2380916\n\u251c\u25cf \u2705 Senha: 8433475\n\u251c\u25cf \ud83d\udcf6 Conex\u00f5es: 3\n\u251c\u25cf \ud83d\udcb5 Pre\u00e7o do Plano: R$\u00a025,00\n\u251c\u25cf \ud83d\uddd3\ufe0f Criado em: 22\/01\/2026 21:14:09\n\u251c\u25cf \ud83d\uddd3\ufe0f Vencimento: 23\/01\/2026 01:14:09\n\n\u256d \ud83d\udcb3 Assinar\/Renovar Plano: \n\u251c\u25cf https:\/\/havoktv.top\/#\/checkout\/231qZgNL4q\/MeWe0EpODn\n\n\u2501\u2501\u2501\u2501\u2501\u2501\u2501\u2501\u2501\u2501\u2501\u2501\u2501\u2501 \n\n\ud83d\udfe2 LINKS M3U - URL - PLAY LIST - PARA APPS PAGOS:\n\n\ud83d\udfe2 Se uma lista n\u00e3o funcionar bem, basta trocar por outra. Voc\u00ea tem 3 op\u00e7\u00f5es dispon\u00edveis: TS, MPEGTS e HLS.\n\n\n\u256d \ud83d\udfe0 Link M3U - TS\n\u251c\u25cf http:\/\/lite.morfeus.site\/get.php?username=2380916&password=8433475&type=m3u_plus&output=ts\n\n\u256d \ud83d\udfe0 Link M3U - MPEGTS\n\u251c\u25cf http:\/\/lite.morfeus.site\/get.php?username=2380916&password=8433475&type=m3u_plus&output=mpegts\n\n\u256d \ud83d\udfe0 Link M3U - HLS\n\u251c\u25cf http:\/\/lite.morfeus.site\/get.php?username=2380916&password=8433475&type=m3u_plus&output=hls\n\n\u256d \ud83d\udfe0 Link SSIPTV\n\u251c\u25cf http:\/\/e.lite.morfeus.site\/p\/2380916\/8433475\/ssiptv\n\n\u256d \ud83d\udfe0 DNS - XCIPTV - 9XTREAM - APPS PR\u00d3PRIOS\n\u251c\u25cf http:\/\/lite.morfeus.site\n\n\ud83c\udf10 STB 5.189.150.71\n\n\u2501\u2501\u2501\u2501\u2501\u2501\u2501\u2501\u2501\u2501\u2501\u2501\u2501\u2501 \n\n\u27a1\ufe0f Acesse o link abaixo e conhe\u00e7a nosso bot de ativa\u00e7\u00f5es autom\u00e1ticas:\n \n\u26a1\ufe0fAtivador de aplicativos no Telegram:\nhttps:\/\/t.me\/ATIVADORTOP_BOT\n\n\u26a1\ufe0fAtivador de aplicativos Site Web 01:\nhttp:\/\/ativadortop.com\/\n\n\u26a1\ufe0fAtivador de aplicativos Site Web 02:\nhttps:\/\/ativeapp.com\/index\/havoktv\n\n\u2501\u2501\u2501\u2501\u2501\u2501\u2501\u2501\u2501\u2501\u2501\u2501\u2501\u2501 \n\n\ud83d\udfe2 APLICATIVOS PARCEIRO\n\n\n\u251c\u25cf\ud83c\udf00 PLAY SIM \n\u256d\n\u251c\u25cf \u2705 C\u00f3digo: 00639\n\u251c\u25cf \u2705 Usu\u00e1rio: 2380916                                                                \n\u251c\u25cf \u2705 Senha: 8433475                                                                  \n\u2570\n\u2501\u2501\u2501\u2501\u2501\u2501\u2501\u2501\u2501\u2501\u2501\u2501\u2501\u2501\n\n\u251c\u25cf\ud83c\udf00 ASSIST PLUS\n\u256d\n\u251c\u25cf \u2705 C\u00f3digo: 00639\n\u251c\u25cf \u2705 Usu\u00e1rio: 2380916                                                                \n\u251c\u25cf \u2705 Senha: 8433475                                                                  \n\u2570\n\u2501\u2501\u2501\u2501\u2501\u2501\u2501\u2501\u2501\u2501\u2501\u2501\u2501\u2501\n\n\u251c\u25cf\ud83c\udf00 VIZION PLAY\n\u256d\n\u251c\u25cf \u2705 C\u00f3digo: 00639\n\u251c\u25cf \u2705 Usu\u00e1rio: 2380916                                                                \n\u251c\u25cf \u2705 Senha: 8433475                                                                  \n\u2570\n\u2501\u2501\u2501\u2501\u2501\u2501\u2501\u2501\u2501\u2501\u2501\u2501\u2501\u2501\n\n\u251c\u25cf\ud83c\udf00 POWER PLAY\n\u256d\n\u251c\u25cf \u2705 C\u00f3digo: 00639\n\u251c\u25cf \u2705 Usu\u00e1rio: 2380916                                                                \n\u251c\u25cf \u2705 Senha: 8433475                                                                  \n\u2570\n\u2501\u2501\u2501\u2501\u2501\u2501\u2501\u2501\u2501\u2501\u2501\u2501\u2501\u2501\n\n\u251c\u25cf\ud83c\udf00 SUPER PLAY\n\u256d\n\u251c\u25cf \u2705 C\u00f3digo: 00639\n\u251c\u25cf \u2705 Usu\u00e1rio: 2380916                                                                \n\u251c\u25cf \u2705 Senha: 8433475                                                                  \n\u2570\n\u2501\u2501\u2501\u2501\u2501\u2501\u2501\u2501\u2501\u2501\u2501\u2501\u2501\u2501\n\n\u251c\u25cf\ud83c\udf00 XCLOUD - SAMSUNG - LG - ROKU \n\u256d\n\u251c\u25cf \u2705 C\u00f3digo: CY33 ou THX50\n\u251c\u25cf \u2705 Usu\u00e1rio: 2380916                                                                \n\u251c\u25cf \u2705 Senha: 8433475                                                                  \n\u2570\u2500\n\u2501\u2501\u2501\u2501\u2501\u2501\u2501\u2501\u2501\u2501\u2501\u2501\u2501\u2501\n\n\u251c\u25cf\ud83c\udf00 IPTV PREMIUM \nSAMSUNG - LG - ROKU - IOS - ANDROID - PLAY STORE\n\n\u256d\n\u251c\u25cf \u2705 C\u00f3digo: CY33 ou THX50\n\u251c\u25cf \u2705 Usu\u00e1rio: 2380916\n\u251c\u25cf \u2705 Senha: 8433475\n\u2570\n\u2501\u2501\u2501\u2501\u2501\u2501\u2501\u2501\u2501\u2501\u2501\u2501\u2501\u2501\n\n\ud83d\udfe2 APLICATIVOS: XCIPTV - 9XTREAM - SMARTERS \n\u256d\n\u251c\u25cf \u2705 Usu\u00e1rio: 2380916\n\u251c\u25cf \u2705 Senha: 8433475\n\u251c\u25cf \u2705 DNS: http:\/\/lite.morfeus.site\n\u2570\n\u2501\u2501\u2501\u2501\u2501\u2501\u2501\u2501\u2501\u2501\u2501\u2501\u2501\u2501\n\n\ud83d\udc47 App (Via DOWNLOADER BY AFTVNEWS E NTDOWN):\n\nloja 1:  https:\/\/lojacinebr.in\nloja 2: https:\/\/loja-cineflix.appshow.top\n\n\ud83c\udf00 XC LITE - O MAIS LEVE \n\n\ud83d\udfe0 Apk: https:\/\/fui.ai\/xclite\n\ud83d\udfe4 C\u00f3digo Downloader: 3564741\n\ud83d\udfe4 C\u00f3digo NTdown: 32475\n\n\u2501\u2501\u2501\u2501\u2501\u2501\u2501\u2501\u2501\u2501\u2501\u2501\u2501\u2501\n\n\u251c\u25cf \ud83c\udf00 HAVOK IBO 4K PLUS\n\n- N\u00c3O \u00c9 RECOMENDAOD PARA APARELHOS COM POUCA MEM\u00d3RIA\n- N\u00c3O \u00c9 RECOMENDADO PARA TV BOX MXQ\n\n- PODE USAR NO CELULAR\n- PODE USAR EM TVs ANDROIDS E GOOGLE TV\n- PODE USAR EM FIRE STICK E MI STICK\n\n\u251c\u25cf \u2705 Usu\u00e1rio: 2380916\n\u251c\u25cf \u2705 Senha: 8433475\n\u251c\u25cf \ud83d\udfe0 Apk: https:\/\/aftv.news\/9538197\n\u251c\u25cf \ud83d\udfe4 C\u00f3digo Downloader: 9538197\n\u251c\u25cf \ud83d\udfe4 C\u00f3digo NTdown: 13373\n\n\u2501\u2501\u2501\u2501\u2501\u2501\u2501\u2501\u2501\u2501\u2501\u2501\u2501\u2501\n\n\u251c\u25cf \ud83c\udf00  HAVOK TIVI\n\n- N\u00c3O \u00c9 RECOMENDAOD PARA APARELHOS COM POUCA MEM\u00d3RIA\n- N\u00c3O \u00c9 RECOMENDADO PARA TV BOX MXQ\n- N\u00c3O PODE USAR NO CELULAR\n\n- PODE USAR EM TVs ANDROIDS E GOOGLE TV\n- PODE USAR EM FIRE STICK E MI STICK\n\n\u256d\n\u251c\u25cf \u2705 Usu\u00e1rio: 2380916\n\u251c\u25cf \u2705 Senha: 8433475\n\u251c\u25cf \ud83d\udfe0 Apk: https:\/\/aftv.news\/2625911\n\u251c\u25cf \ud83d\udfe4 C\u00f3digo Downloader: 2625911\n\u251c\u25cf \ud83d\udfe4 C\u00f3digo NTdown: 55846\n\u2570\n\u2501\u2501\u2501\u2501\u2501\u2501\u2501\u2501\u2501\u2501\u2501\u2501\u2501\u2501\n\n\u251c\u25cf\ud83c\udf00  HAVOK V3\n\n- APP PARA TV BOX MXQ E APARELHOS COM POUCA MEM\u00d3RIA.\n- BOM PRA CELULAR\n- FAZ ESPELHAMENTO\n\u256d\n\u251c\u25cf  \u2705 Usu\u00e1rio: 2380916\n\u251c\u25cf  \u2705 Senha: 8433475\n\u251c\u25cf  \ud83d\udfe0 Apk: https:\/\/aftv.news\/6442116\n\u251c\u25cf  \ud83d\udfe4 C\u00f3digo Downloader: 6442116\n\u251c\u25cf  \ud83d\udfe4 C\u00f3digo NTdown: 47959\n\u2570\n\u2501\u2501\u2501\u2501\u2501\u2501\u2501\u2501\u2501\u2501\u2501\u2501\u2501\u2501\n\n\u251c\u25cf\ud83c\udf00  HAVOK LEGACY\n\n- N\u00c3O \u00c9 RECOMENDAOD PARA APARELHOS COM POUCA MEM\u00d3RIA\n- N\u00c3O \u00c9 RECOMENDADO PARA TV BOX MXQ\n- N\u00c3O \u00c9 RECOMENDADO USAR NO CELULAR\n\n- PODE USAR EM TVs ANDROIDS E GOOGLE TV\n- PODE USAR EM FIRE STICK E MI STICK\n\n\u256d\n\u251c\u25cf  \u2705 Usu\u00e1rio: 2380916\n\u251c\u25cf  \u2705 Senha: 8433475\n\u251c\u25cf  \ud83d\udfe0 Apk: https:\/\/fui.ai\/havoklegacy\n\u251c\u25cf  \ud83d\udfe4 C\u00f3digo Downloader: 8621576\n\u251c\u25cf  \ud83d\udfe4 C\u00f3digo NTdown: 23381\n\u2570\n\u2501\u2501\u2501\u2501\u2501\u2501\u2501\u2501\u2501\u2501\u2501\u2501\u2501\u2501\n\n\u251c\u25cf\ud83c\udf00  HAVOK IBO PRO\n\n- APP PARA TV BOX MXQ E APARELHOS COM POUCA MEM\u00d3RIA.\n- BOM PRA CELULAR\n\u256d\n\u251c\u25cf  \u2705 Usu\u00e1rio: 2380916\n\u251c\u25cf  \u2705 Senha: 8433475\n\u251c\u25cf  \ud83d\udfe0 Apk: https:\/\/aftv.news\/2660097\n\u251c\u25cf  \ud83d\udfe4 C\u00f3digo Downloader: 2660097\n\u251c\u25cf  \ud83d\udfe4 C\u00f3digo NTdown: 23412\n\u2570\n\n\u2501\u2501\u2501\u2501\u2501\u2501\u2501\u2501\u2501\u2501\u2501\u2501\u2501\u2501 \n\n\ud83d\udc47 APLICATIVO IOS IPHONE\n\n\u251c\u25cf\ud83c\udf00IPTV SMARTERS LITE\n\n\u256d\u2500 \n\u251c\u25cf  \u2705 Usu\u00e1rio: 2380916\n\u251c\u25cf  \u2705 Senha: 8433475\n\u251c\u25cf  \u2705 DNS: http:\/\/lite.morfeus.site\n\u2570 https:\/\/apps.apple.com\/br\/app\/smarters-player-lite\/id1628995509\n\n\u2501\u2501\u2501\u2501\u2501\u2501\u2501\u2501\u2501\u2501\u2501\u2501\u2501\u2501 \n\n\u251c\u25cf\ud83c\udf00 XCLOUD ou IPTV PREMIUM \n\u256d\n\u251c\u25cf \u2705 C\u00f3digo: CN1030\n\u251c\u25cf \u2705 Usu\u00e1rio: 2380916                                                                \n\u251c\u25cf \u2705 Senha: 8433475                                                                  \n\u2570 https:\/\/apps.apple.com\/br\/app\/xcloud-mobile\/id6471106231\n\n\u2501\u2501\u2501\u2501\u2501\u2501\u2501\u2501\u2501\u2501\u2501\u2501\u2501\u2501 \n\n\ud83d\udc47 APLICATIVO WEB COMPUTADOR\n\n\u256d\n\u251c\u25cf  \u2705 Usu\u00e1rio: 2380916\n\u251c\u25cf  \u2705 Senha: 8433475\n\nhttp:\/\/web.pds01.site\/\n\n\u2501\u2501\u2501\u2501\u2501\u2501\u2501\u2501\u2501\u2501\u2501\u2501\u2501\u2501 \n\n\ud83d\udc47 APLICATIVO PARA VIDEO GAME\n\n\u251c\u25cf\ud83c\udf00  XBOX ONE \n\u256d\n\u251c\u25cf  \u2705 Usu\u00e1rio: 2380916\n\u251c\u25cf  \u2705 Senha: 8433475\n\u2570\n\u256d \ud83d\udfe0 DUPLEX PLAY SITE LSITA:\n\u251c\u25cf https:\/\/edit.duplexplay.com\/\n\u2570\n\u256d \ud83d\udfe0 APRENDA A COMO ADICIONAR LISTA NO XBOX\n\u251c\u25cfhttps:\/\/www.youtube.com\/watch?v=YQ-i8I5l910\n\n\u2501\u2501\u2501\u2501\u2501\u2501\u2501\u2501\u2501\u2501\u2501\u2501\u2501\u2501 \n\n\u251c\u25cf\ud83c\udf00 PS4\u25cf\n\n\u256d\n\u251c\u25cf  \u2705 Usu\u00e1rio: 2380916\n\u251c\u25cf  \u2705 Senha: 8433475\n\u2570\n\u256d\n\u251c\u25cf \ud83d\udfe0 SS-IPTV via Navegador           \n\u251c\u25cf \ud83d\udfe0 Link (SSIPTV): http:\/\/e.lite.morfeus.site\/p\/2380916\/8433475\/ssiptv\n\n\u2501\u2501\u2501\u2501\u2501\u2501\u2501\u2501\u2501\u2501\u2501\u2501\u2501\u2501 \n\n\ud83d\udc47 APLICATIVO PARA CHROMECAST\n\n\u251c\u25cf\ud83c\udf00  V3 - ANDROID  \n\u256d\n\u251c\u25cf  \u2705 Usu\u00e1rio: 2380916\n\u251c\u25cf  \u2705 Senha: 8433475\n\u251c\u25cf  \ud83d\udfe0 Apk: https:\/\/aftv.news\/6442116\n\u251c\u25cf  \ud83d\udfe4 C\u00f3digo Downloader: 6442116\n\u251c\u25cf  \ud83d\udfe4 C\u00f3digo NTdown: 47959\n\u2570\n\n\u251c\u25cf\ud83c\udf00  SMARTERS PLAYER (VERS\u00c3O PAGA) - IPHONE \n\u256d\n\u251c\u25cf  \u2705 Usu\u00e1rio: 2380916\n\u251c\u25cf  \u2705 Senha: 8433475\n\u251c\u25cf  \u2705 DNS: http:\/\/lite.morfeus.site\n\u2570 https:\/\/apps.apple.com\/app\/id1628995509\n\n\u2501\u2501\u2501\u2501\u2501\u2501\u2501\u2501\u2501\u2501\u2501\u2501\u2501\u2501 \n\n\ud83d\udc47  DEVELOPS IP\n\u256d\n\u251c\u25cf  \ud83c\udf00 DUPLECAST: 65.108.220.18\n\u251c\u25cf  \ud83c\udf00 CLOUDDY: 46.165.236.165\n\u251c\u25cf  \ud83c\udf00 SMARTONE: 5.78.42.49\n\u251c\u25cf  \ud83c\udf00 SMART IPTV: 116.202.226.250\n\u251c\u25cf  \ud83c\udf00 SS IPTV: 91.122.100.196 (gr\u00e1tis)\n\u251c\u25cf  \ud83c\udf00 SET IPTV: 94.23.97.11\n\u251c\u25cf  \ud83c\udf00 DUPLEX: 192.185.7.111\n\u2570\n\u256d \u26a0\ufe0f Ativar modo develop Samsung\n\u251c\u25cf \ud83d\udfe0 https:\/\/abrela.me\/clouddysamsung\n\n\u2501\u2501\u2501\u2501\u2501\u2501\u2501\u2501\u2501\u2501\u2501\u2501\u2501\u2501 \n\n\ud83d\udc47 APLICATIVO PARA PANASONIC\n\n\u251c\u25cf\ud83c\udf00 SSIPTV  \n\u256d\n\u251c\u25cf  \u2705 SS IPTV: 91.122.100.196 (gr\u00e1tis)\n\u2570 http:\/\/e.dns.invernoquente.online\/p\/3489741\/3057520\/ssiptv\n\n\u2501\u2501\u2501\u2501\u2501\u2501\u2501\u2501\u2501\u2501\u2501\u2501\u2501\u2501 \n\n\ud83d\udc47 APLICATIVO PARA TV MUITO ANTIGA \n\u256d\n\u251c\u25cf \ud83c\udf00 Smart One\n\u251c\u25cf \ud83d\udfe0 https:\/\/smartone-iptv.com\/\n\u2570\n\u256d\n\u251c\u25cf \ud83c\udf00 Bay IPTV\n\u251c\u25cf \ud83d\udfe0 https:\/\/bayip.tv\/\n\u2570\n\u256d\n\u251c\u25cf \ud83c\udf00  SSIPTV\n\u251c\u25cf \ud83d\udfe0 https:\/\/ss-iptv.com\/en\/users\/playlist\n\n\u256d\n\u251c\u25cf \ud83c\udf00 CLOUDDY\n\u251c\u25cf \ud83d\udfe0 https:\/\/clouddy.online\/\n\u2570\n\n\u256d\u26a0\ufe0f APRENDA CRIAR EMAILS PARA O CLOUDDY:\n\u251c\u25cf \ud83d\udfe0 https:\/\/youtu.be\/ccCKcccPSEI?si=2Z7JRzrxDiL6tGpg\n\n\u256d \u26a0\ufe0fAPRENDA A COMO ADICIONAR LISTA NO CLOUDDY:\n\u251c\u25cf \ud83d\udfe0 https:\/\/www.youtube.com\/watch?v=HsAjq5O7G3c\n\u251c\u25cf \ud83d\udfe0 https:\/\/www.youtube.com\/watch?v=gXDCR4Nccx8\n\n\u256d\n\u251c\u25cf  \ud83d\udfe4 Download: 533745\n\u251c\u25cf \ud83d\udfe4 DEVLOP IP: 65.108.220.18\n\u2570\n\n\u2501\u2501\u2501\u2501\u2501\u2501\u2501\u2501\u2501\u2501\u2501\u2501\u2501\u2501\n\n\ud83e\udde9 Tutoriais de instala\u00e7\u00e3o e ativa\u00e7\u00e3o de aplicativos pagos\n\n\n\u2705 Compat\u00edvel com qualquer tipo de sistema:\nRoku, Samsung, LG, Android, Windows, iPhone e dispositivos da Play Store.\n\n\u26a0\ufe0f A lista que voc\u00ea precisa inserir no site em Play List, chama-se lista M3U.\n\nVoc\u00ea pode obter essa lista gerando um teste diretamente no servidor de sua escolha.\n\n\n\ud83d\udcfa Para modelos novos \ud83d\udcfa\n\n\u27a1\ufe0f Vu Player Pro\nSite pra por a lista: https:\/\/vuproplayer.org\/\nDownload: 327187\nTutorial: https:\/\/www.youtube.com\/watch?v=X_cpOSz535k\n\n\u27a1\ufe0f Ibo Pro\nSite pra por a lista: https:\/\/iboproapp.com\/\nDownload: 481220\nTutorial:\u00a0https:\/\/www.youtube.com\/watch?v=hY9pWlPQEMs\n\n\u27a1\ufe0f Ibo Player\nSite pra por a lista: https:\/\/iboproapp.com\/\nTutorial:\u00a0https:\/\/www.youtube.com\/watch?v=9dkg8Or3IQo\n\n\u27a1\ufe0f Duplex Play \nSite pra por a lista: https:\/\/www.duplexplay.net\/\nTutorial: https:\/\/www.youtube.com\/watch?v=ZuLQS8sy_4A\n\n\u27a1\ufe0f Duplecast\nSite pra por a lista: https:\/\/duplecast.com\/\nTutorial: https:\/\/www.youtube.com\/watch?v=AuyTY8gOvZI\n\n\u27a1\ufe0f Enzo Player\nSite pra por a lista: https:\/\/enzoplayer.com\/\nTutorial: https:\/\/www.youtube.com\/watch?v=Uu9Rl7agjAA\n\n\u27a1\ufe0f Ninja Player\nSite pra por a lista: https:\/\/meta-player.app\/\nTutorial: https:\/\/www.youtube.com\/watch?v=5FN8J-ceu6c\n\n\n\ud83d\udcfa Para modelos antigos \ud83d\udcfa\n\n\n\u27a1\ufe0f SSIPTV  \nSite pra por a lista: https:\/\/ss-iptv.com\/en\/users\/playlist\nTutorial: https:\/\/www.youtube.com\/watch?v=yuZwkY9IF3k\n\n\u27a1\ufe0f CLOUDDY  \nSite pra por a lista: https:\/\/clouddy.online\/\nTutorial: https:\/\/www.youtube.com\/watch?v=e83E91MlsHM\n\n\u27a1\ufe0f SmartOne \nSite pra por a lista: https:\/\/smartone-iptv.com\/\nTutorial: https:\/\/www.youtube.com\/watch?v=fQnzN7C0TwA\n\n\u27a1\ufe0f SET IPTV \nSite pra por a lista: https:\/\/cms.manage-setiptv.com\/set.app\nTutorial: https:\/\/www.youtube.com\/watch?v=UqP7HJUBqNY\n\n\u27a1\ufe0f BAY IPTV\nSite pra por a lista: https:\/\/cms.bayip.tv\/user\/manage\/playlist\nTutorial: https:\/\/www.youtube.com\/watch?v=Bg9ZSzZPKEo\n\n\n\u2705 Ibo Player ou Ibo Pro Descubra Qual \u00e9 o Melhor para Voc\u00ea!\nhttps:\/\/www.youtube.com\/watch?v=rDiHGTdd5ww\n\n\u2705 Ative a licen\u00e7a do aplicativo por aqui:\nhttps:\/\/t.me\/ativacaoprobot?start=828282836"}]}