{
    "dns": null,
    "username": "6442443",
    "connections": 1,
    "password": "1138074",
    "package": "ğŸ”° [TESTE 04H] - P2P BINSTREAM",
    "createdAt": "2026-01-16 16:59:20",
    "createdAtFormatted": "16/01/2026 16:59:20",
    "expiresAt": "2026-01-16 20:59:19",
    "expiresAtFormatted": "16/01/2026 20:59:19",
    "payUrl": "https://havoktv.top/#/checkout/231qZgNL4q/QBWQ0V4zDG",
    "reply": "â”œâ— ğŸ“¶ ConexÃµes: 1\nâ”œâ— ğŸ’µ PreÃ§o do Plano: R$Â 30,00\nâ”œâ— ğŸ—“ï¸ Criado em: 16/01/2026 16:59:20\nâ”œâ— ğŸ—“ï¸ Vencimento: 16/01/2026 20:59:19\n\nâ•­ ğŸ’³ Assinar/Renovar Plano: \nâ”œâ— https://havoktv.top/#/checkout/231qZgNL4q/QBWQ0V4zDG\n\n\nâœ… ESSE SISTEMA SO FUNCIONA EM APARELHOS ANDROIDS VIA DOWNLOADER OU NTDOWN\n\n\nAPLICATIVO ANDROID VERSÃƒO V8: \n\nâœ… UsuÃ¡rio: 6442443\nâœ… Senha: 1138074\n\naftv.news/3295740\nCÃ³digo downloader 3295740\nCÃ³digo ntDown 36923\n\n---------------------------\n\nAPLICATIVO ANDROID VERSÃƒO V9: \n\nâœ… UsuÃ¡rio: 6442443\nâœ… Senha: 1138074\n\nhttps://aftv.news/2822574\nCÃ³digo downloader 2822574\nCÃ³digo ntDown em 2557390",
    "data": [
        {
            "message": "â”œâ— ğŸ“¶ ConexÃµes: 1\nâ”œâ— ğŸ’µ PreÃ§o do Plano: R$Â 30,00\nâ”œâ— ğŸ—“ï¸ Criado em: 16/01/2026 16:59:20\nâ”œâ— ğŸ—“ï¸ Vencimento: 16/01/2026 20:59:19\n\nâ•­ ğŸ’³ Assinar/Renovar Plano: \nâ”œâ— https://havoktv.top/#/checkout/231qZgNL4q/QBWQ0V4zDG\n\n\nâœ… ESSE SISTEMA SO FUNCIONA EM APARELHOS ANDROIDS VIA DOWNLOADER OU NTDOWN\n\n\nAPLICATIVO ANDROID VERSÃƒO V8: \n\nâœ… UsuÃ¡rio: 6442443\nâœ… Senha: 1138074\n\naftv.news/3295740\nCÃ³digo downloader 3295740\nCÃ³digo ntDown 36923\n\n---------------------------\n\nAPLICATIVO ANDROID VERSÃƒO V9: \n\nâœ… UsuÃ¡rio: 6442443\nâœ… Senha: 1138074\n\nhttps://aftv.news/2822574\nCÃ³digo downloader 2822574\nCÃ³digo ntDown em 2557390"
        }
    ]
}