{
    "dns": "http://mydotz.xyz",
    "username": "3754020",
    "connections": 1,
    "password": "6336967",
    "package": "âš¡ï¸ [TESTE 04H] - KYROS",
    "createdAt": "2026-01-10 01:13:26",
    "createdAtFormatted": "10/01/2026 01:13:26",
    "expiresAt": "2026-01-10 05:13:25",
    "expiresAtFormatted": "10/01/2026 05:13:25",
    "payUrl": "https://havoktv.top/#/checkout/231qZgNL4q/YB1wvEjnWv",
    "reply": "â­ Seja bem vindo ao KYROS â­\n\nâ•­\nâ”œâ— âœ… UsuÃ¡rio: 3754020\nâ”œâ— âœ… Senha: 6336967\nâ”œâ— ğŸ“¶ ConexÃµes: 3\nâ”œâ— ğŸ’µ PreÃ§o do Plano: R$Â 25,00\nâ”œâ— ğŸ—“ï¸ Criado em: 10/01/2026 01:13:26\nâ”œâ— ğŸ—“ï¸ Vencimento: 10/01/2026 05:13:25\n\nâ•­ ğŸ’³ Assinar/Renovar Plano: \nâ”œâ— https://havoktv.top/#/checkout/231qZgNL4q/YB1wvEjnWv\n\nâ”â”â”â”â”â”â”â”â”â”â”â”â”â” \n\nğŸŸ¢ LINKS M3U - URL - PLAY LIST - PARA APPS PAGOS:\n\nğŸŸ¢ Se uma lista nÃ£o funcionar bem, basta trocar por outra. VocÃª tem 3 opÃ§Ãµes disponÃ­veis: TS, MPEGTS e HLS.\n\n\nâ•­ ğŸŸ  Link M3U - TS\nâ”œâ— http://mydotz.xyz/get.php?username=3754020&password=6336967&type=m3u_plus&output=ts\n\nâ•­ ğŸŸ  Link M3U - MPEGTS\nâ”œâ— http://mydotz.xyz/get.php?username=3754020&password=6336967&type=m3u_plus&output=mpegts\n\nâ•­ ğŸŸ  Link M3U - HLS\nâ”œâ— http://mydotz.xyz/get.php?username=3754020&password=6336967&type=m3u_plus&output=hls\n\nâ•­ ğŸŸ  Link SSIPTV\nâ”œâ— http://e.mydotz.xyz/p/3754020/6336967/ssiptv\n\nâ•­ ğŸŸ  DNS - XCIPTV - 9XTREAM - APPS PRÃ“PRIOS\nâ”œâ— http://croxm.site\n\nğŸŸ  STB DISPONÃVEL: 200.9.154.53\n\nâ”â”â”â”â”â”â”â”â”â”â”â”â”â” \n\nğŸŸ¢ APLICATIVOS PARCEIRO\n\nâ”œâ—ğŸŒ€ XCLOUD \nSAMSUNG - LG - ROKU - IOS - ANDROID - PLAY STORE\n\nâ•­\nâ”œâ— âœ… CÃ³digo: 11a11\nâ”œâ— âœ… UsuÃ¡rio: 3754020                                                                \nâ”œâ— âœ… Senha: 6336967                                                                  \nâ•°â”€\nâ”â”â”â”â”â”â”â”â”â”â”â”â”â”\n\nâ”œâ—ğŸŒ€ IPTV PREMIUM \nSAMSUNG - LG - ROKU - IOS - ANDROID - PLAY STORE\n\nâ•­\nâ”œâ— âœ… CÃ³digo: 11a11\nâ”œâ— âœ… UsuÃ¡rio: 3754020\nâ”œâ— âœ… Senha: 6336967\nâ•°\nâ”â”â”â”â”â”â”â”â”â”â”â”â”â”\n\nğŸŸ¢ APLICATIVOS: XCIPTV - 9XTREAM - SMARTERS \nâ•­\nâ”œâ— âœ… UsuÃ¡rio: 3754020\nâ”œâ— âœ… Senha: 6336967\nâ”œâ— âœ… DNS: http://mydotz.xyz\nâ•°\nâ”â”â”â”â”â”â”â”â”â”â”â”â”â”\n\nğŸ‘‡ App (Via DOWNLOADER BY AFTVNEWS E NTDOWN):\n\nEsses aplicativos sÃ£o destinados a dispositivos com sistema Android.\nPrimeiro, acesse a Play Store e instale o NTdown ou o Downloader.\nApÃ³s instalar um deles, basta escolher um dos apps abaixo e usar o cÃ³digo correspondente para iniciar a instalaÃ§Ã£o.\n\n\nâ”œâ— ğŸŒ€  XC MAX - O MAIS LEVE\n\n- O MELHOR APP PARA TV BOX MXQ E APARELHOS COM POUCA MEMÃ“RIA.\n\nâ”œâ— âœ… UsuÃ¡rio: 3754020\nâ”œâ— âœ… Senha: 6336967\nâ”œâ— ğŸŸ  Apk:https://fui.ai/xcmax\nâ”œâ— ğŸŸ¤ CÃ³digo Downloader: 9980196\nâ”œâ— ğŸŸ¤ CÃ³digo NTdown: 38535\n\nâ”â”â”â”â”â”â”â”â”â”â”â”â”â”\n\nâ”œâ— ğŸŒ€ HAVOK IBO 4K PLUS\n\n- NÃƒO Ã‰ RECOMENDAOD PARA APARELHOS COM POUCA MEMÃ“RIA\n- NÃƒO Ã‰ RECOMENDADO PARA TV BOX MXQ\n\n- PODE USAR NO CELULAR\n- PODE USAR EM TVs ANDROIDS E GOOGLE TV\n- PODE USAR EM FIRE STICK E MI STICK\n\nâ”œâ— âœ… UsuÃ¡rio: 3754020\nâ”œâ— âœ… Senha: 6336967\nâ”œâ— ğŸŸ  Apk: https://aftv.news/9538197\nâ”œâ— ğŸŸ¤ CÃ³digo Downloader: 9538197\nâ”œâ— ğŸŸ¤ CÃ³digo NTdown: 13373\n\nâ”â”â”â”â”â”â”â”â”â”â”â”â”â”\n\nâ”œâ— ğŸŒ€  HAVOK TIVI\n\n- NÃƒO Ã‰ RECOMENDAOD PARA APARELHOS COM POUCA MEMÃ“RIA\n- NÃƒO Ã‰ RECOMENDADO PARA TV BOX MXQ\n- NÃƒO PODE USAR NO CELULAR\n\n- PODE USAR EM TVs ANDROIDS E GOOGLE TV\n- PODE USAR EM FIRE STICK E MI STICK\n\nâ•­\nâ”œâ— âœ… UsuÃ¡rio: 3754020\nâ”œâ— âœ… Senha: 6336967\nâ”œâ— ğŸŸ  Apk: https://aftv.news/2625911\nâ”œâ— ğŸŸ¤ CÃ³digo Downloader: 2625911\nâ”œâ— ğŸŸ¤ CÃ³digo NTdown: 55846\nâ•°\nâ”â”â”â”â”â”â”â”â”â”â”â”â”â”\n\nâ”œâ—ğŸŒ€  HAVOK V3\n\n- APP PARA TV BOX MXQ E APARELHOS COM POUCA MEMÃ“RIA.\n- BOM PRA CELULAR\n- FAZ ESPELHAMENTO\nâ•­\nâ”œâ—  âœ… UsuÃ¡rio: 3754020\nâ”œâ—  âœ… Senha: 6336967\nâ”œâ—  ğŸŸ  Apk: https://aftv.news/6442116\nâ”œâ—  ğŸŸ¤ CÃ³digo Downloader: 6442116\nâ”œâ—  ğŸŸ¤ CÃ³digo NTdown: 47959\nâ•°\nâ”â”â”â”â”â”â”â”â”â”â”â”â”â”\n\nâ”œâ—ğŸŒ€  HAVOK LEGACY\n\n- NÃƒO Ã‰ RECOMENDAOD PARA APARELHOS COM POUCA MEMÃ“RIA\n- NÃƒO Ã‰ RECOMENDADO PARA TV BOX MXQ\n- NÃƒO Ã‰ RECOMENDADO USAR NO CELULAR\n\n- PODE USAR EM TVs ANDROIDS E GOOGLE TV\n- PODE USAR EM FIRE STICK E MI STICK\n\nâ•­\nâ”œâ—  âœ… UsuÃ¡rio: 3754020\nâ”œâ—  âœ… Senha: 6336967\nâ”œâ—  ğŸŸ  Apk: https://fui.ai/havoklegacy\nâ”œâ—  ğŸŸ¤ CÃ³digo Downloader: 8621576\nâ”œâ—  ğŸŸ¤ CÃ³digo NTdown: 23381\nâ•°\nâ”â”â”â”â”â”â”â”â”â”â”â”â”â”\n\nâ”œâ—ğŸŒ€  HAVOK IBO PRO\n\n- APP PARA TV BOX MXQ E APARELHOS COM POUCA MEMÃ“RIA.\n- BOM PRA CELULAR\nâ•­\nâ”œâ—  âœ… UsuÃ¡rio: 3754020\nâ”œâ—  âœ… Senha: 6336967\nâ”œâ—  ğŸŸ  Apk: https://aftv.news/2660097\nâ”œâ—  ğŸŸ¤ CÃ³digo Downloader: 2660097\nâ”œâ—  ğŸŸ¤ CÃ³digo NTdown: 23412\nâ•°\n\nâ”â”â”â”â”â”â”â”â”â”â”â”â”â” \n\nğŸ‘‡ APLICATIVO IOS IPHONE\n\nâ”œâ—ğŸŒ€IPTV SMARTERS LITE\n\nâ•­â”€ \nâ”œâ—  âœ… UsuÃ¡rio: 3754020\nâ”œâ—  âœ… Senha: 6336967\nâ”œâ—  âœ… DNS: http://mydotz.xyz\nâ•° https://apps.apple.com/br/app/smarters-player-lite/id1628995509\n\nâ”â”â”â”â”â”â”â”â”â”â”â”â”â” \n\nâ”œâ—ğŸŒ€ XCLOUD ou IPTV PREMIUM \nâ•­\nâ”œâ— âœ… CÃ³digo: CN1030\nâ”œâ— âœ… UsuÃ¡rio: 3754020                                                                \nâ”œâ— âœ… Senha: 6336967                                                                  \nâ•° https://apps.apple.com/br/app/xcloud-mobile/id6471106231\n\nâ”â”â”â”â”â”â”â”â”â”â”â”â”â” \n\nğŸ‘‡ APLICATIVO WEB COMPUTADOR\n\nâ•­\nâ”œâ—  âœ… UsuÃ¡rio: 3754020\nâ”œâ—  âœ… Senha: 6336967\n\nWEB PLAYER:\nrubi.appwebplayer.online\n\nâ”â”â”â”â”â”â”â”â”â”â”â”â”â” \n\nğŸ‘‡ APLICATIVO PARA VIDEO GAME\n\nâ”œâ—ğŸŒ€  XBOX ONE \nâ•­\nâ”œâ—  âœ… UsuÃ¡rio: 3754020\nâ”œâ—  âœ… Senha: 6336967\nâ•°\nâ•­ ğŸŸ  DUPLEX PLAY SITE LSITA:\nâ”œâ— https://edit.duplexplay.com/\nâ•°\nâ•­ ğŸŸ  APRENDA A COMO ADICIONAR LISTA NO XBOX\nâ”œâ—https://www.youtube.com/watch?v=YQ-i8I5l910\n\nâ”â”â”â”â”â”â”â”â”â”â”â”â”â” \n\nâ”œâ—ğŸŒ€ PS4â—\n\nâ•­\nâ”œâ—  âœ… UsuÃ¡rio: 3754020\nâ”œâ—  âœ… Senha: 6336967\nâ•°\nâ•­\nâ”œâ— ğŸŸ  SS-IPTV via Navegador           \nâ”œâ— ğŸŸ  Link (SSIPTV): http://e.mydotz.xyz/p/3754020/6336967/ssiptv\n\nâ”â”â”â”â”â”â”â”â”â”â”â”â”â” \n\nğŸ‘‡ APLICATIVO PARA CHROMECAST\n\nâ”œâ—ğŸŒ€  V3 - ANDROID  \nâ•­\nâ”œâ—  âœ… UsuÃ¡rio: 3754020\nâ”œâ—  âœ… Senha: 6336967\nâ”œâ—  ğŸŸ  Apk: https://aftv.news/6442116\nâ”œâ—  ğŸŸ¤ CÃ³digo Downloader: 6442116\nâ”œâ—  ğŸŸ¤ CÃ³digo NTdown: 47959\nâ•°\n\nâ”œâ—ğŸŒ€  SMARTERS PLAYER (VERSÃƒO PAGA) - IPHONE \nâ•­\nâ”œâ—  âœ… UsuÃ¡rio: 3754020\nâ”œâ—  âœ… Senha: 6336967\nâ”œâ—  âœ… DNS: http://mydotz.xyz\nâ•° https://apps.apple.com/app/id1628995509\n\nâ”â”â”â”â”â”â”â”â”â”â”â”â”â” \n\nğŸ‘‡  DEVELOPS IP\nâ•­\nâ”œâ—  ğŸŒ€ DUPLECAST: 65.108.220.18\nâ”œâ—  ğŸŒ€ CLOUDDY: 46.165.236.165\nâ”œâ—  ğŸŒ€ SMARTONE: 5.78.42.49\nâ”œâ—  ğŸŒ€ SMART IPTV: 116.202.226.250\nâ”œâ—  ğŸŒ€ SS IPTV: 91.122.100.196 (grÃ¡tis)\nâ”œâ—  ğŸŒ€ SET IPTV: 94.23.97.11\nâ”œâ—  ğŸŒ€ DUPLEX: 192.185.7.111\nâ•°\nâ•­ âš ï¸ Ativar modo develop Samsung\nâ”œâ— ğŸŸ  https://abrela.me/clouddysamsung\n\nâ”â”â”â”â”â”â”â”â”â”â”â”â”â” \n\nğŸ‘‡ APLICATIVO PARA PANASONIC\n\nâ”œâ—ğŸŒ€ SSIPTV  \nâ•­\nâ”œâ—  âœ… SS IPTV: 91.122.100.196 (grÃ¡tis)\nâ•° http://e.dns.invernoquente.online/p/3489741/3057520/ssiptv\n\nâ”â”â”â”â”â”â”â”â”â”â”â”â”â” \n\nğŸ‘‡ APLICATIVO PARA TV MUITO ANTIGA \nâ•­\nâ”œâ— ğŸŒ€ Smart One\nâ”œâ— ğŸŸ  https://smartone-iptv.com/\nâ•°\nâ•­\nâ”œâ— ğŸŒ€ Bay IPTV\nâ”œâ— ğŸŸ  https://bayip.tv/\nâ•°\nâ•­\nâ”œâ— ğŸŒ€  SSIPTV\nâ”œâ— ğŸŸ  https://ss-iptv.com/en/users/playlist\n\nâ•­\nâ”œâ— ğŸŒ€ CLOUDDY\nâ”œâ— ğŸŸ  https://clouddy.online/\nâ•°\n\nâ•­âš ï¸ APRENDA CRIAR EMAILS PARA O CLOUDDY:\nâ”œâ— ğŸŸ  https://youtu.be/ccCKcccPSEI?si=2Z7JRzrxDiL6tGpg\n\nâ•­ âš ï¸APRENDA A COMO ADICIONAR LISTA NO CLOUDDY:\nâ”œâ— ğŸŸ  https://www.youtube.com/watch?v=HsAjq5O7G3c\nâ”œâ— ğŸŸ  https://www.youtube.com/watch?v=gXDCR4Nccx8\n\nâ•­\nâ”œâ—  ğŸŸ¤ Download: 533745\nâ”œâ— ğŸŸ¤ DEVLOP IP: 65.108.220.18\nâ•°\n\nâ”â”â”â”â”â”â”â”â”â”â”â”â”â”\n\nğŸ§© Tutoriais de instalaÃ§Ã£o e ativaÃ§Ã£o de aplicativos pagos\n\n\nâœ… CompatÃ­vel com qualquer tipo de sistema:\nRoku, Samsung, LG, Android, Windows, iPhone e dispositivos da Play Store.\n\nâš ï¸ A lista que vocÃª precisa inserir no site em Play List, chama-se lista M3U.\n\nVocÃª pode obter essa lista gerando um teste diretamente no servidor de sua escolha.\n\n\nğŸ“º Para modelos novos ğŸ“º\n\nâ¡ï¸ Vu Player Pro\nSite pra por a lista: https://vuproplayer.org/\nDownload: 327187\nTutorial: https://www.youtube.com/watch?v=X_cpOSz535k\n\nâ¡ï¸ Ibo Pro\nSite pra por a lista: https://iboproapp.com/\nDownload: 481220\nTutorial:Â https://www.youtube.com/watch?v=hY9pWlPQEMs\n\nâ¡ï¸ Ibo Player\nSite pra por a lista: https://iboproapp.com/\nTutorial:Â https://www.youtube.com/watch?v=9dkg8Or3IQo\n\nâ¡ï¸ Duplex Play \nSite pra por a lista: https://www.duplexplay.net/\nTutorial: https://www.youtube.com/watch?v=ZuLQS8sy_4A\n\nâ¡ï¸ Duplecast\nSite pra por a lista: https://duplecast.com/\nTutorial: https://www.youtube.com/watch?v=AuyTY8gOvZI\n\nâ¡ï¸ Enzo Player\nSite pra por a lista: https://enzoplayer.com/\nTutorial: https://www.youtube.com/watch?v=Uu9Rl7agjAA\n\nâ¡ï¸ Ninja Player\nSite pra por a lista: https://meta-player.app/\nTutorial: https://www.youtube.com/watch?v=5FN8J-ceu6c\n\n\nğŸ“º Para modelos antigos ğŸ“º\n\n\nâ¡ï¸ SSIPTV  \nSite pra por a lista: https://ss-iptv.com/en/users/playlist\nTutorial: https://www.youtube.com/watch?v=yuZwkY9IF3k\n\nâ¡ï¸ CLOUDDY  \nSite pra por a lista: https://clouddy.online/\nTutorial: https://www.youtube.com/watch?v=e83E91MlsHM\n\nâ¡ï¸ SmartOne \nSite pra por a lista: https://smartone-iptv.com/\nTutorial: https://www.youtube.com/watch?v=fQnzN7C0TwA\n\nâ¡ï¸ SET IPTV \nSite pra por a lista: https://cms.manage-setiptv.com/set.app\nTutorial: https://www.youtube.com/watch?v=UqP7HJUBqNY\n\nâ¡ï¸ BAY IPTV\nSite pra por a lista: https://cms.bayip.tv/user/manage/playlist\nTutorial: https://www.youtube.com/watch?v=Bg9ZSzZPKEo\n\n\nâœ… Ibo Player ou Ibo Pro Descubra Qual Ã© o Melhor para VocÃª!\nhttps://www.youtube.com/watch?v=rDiHGTdd5ww\n\nâœ… Ative a licenÃ§a do aplicativo por aqui:\nhttps://t.me/ativacaoprobot?start=828282836",
    "data": [
        {
            "message": "â­ Seja bem vindo ao KYROS â­\n\nâ•­\nâ”œâ— âœ… UsuÃ¡rio: 3754020\nâ”œâ— âœ… Senha: 6336967\nâ”œâ— ğŸ“¶ ConexÃµes: 3\nâ”œâ— ğŸ’µ PreÃ§o do Plano: R$Â 25,00\nâ”œâ— ğŸ—“ï¸ Criado em: 10/01/2026 01:13:26\nâ”œâ— ğŸ—“ï¸ Vencimento: 10/01/2026 05:13:25\n\nâ•­ ğŸ’³ Assinar/Renovar Plano: \nâ”œâ— https://havoktv.top/#/checkout/231qZgNL4q/YB1wvEjnWv\n\nâ”â”â”â”â”â”â”â”â”â”â”â”â”â” \n\nğŸŸ¢ LINKS M3U - URL - PLAY LIST - PARA APPS PAGOS:\n\nğŸŸ¢ Se uma lista nÃ£o funcionar bem, basta trocar por outra. VocÃª tem 3 opÃ§Ãµes disponÃ­veis: TS, MPEGTS e HLS.\n\n\nâ•­ ğŸŸ  Link M3U - TS\nâ”œâ— http://mydotz.xyz/get.php?username=3754020&password=6336967&type=m3u_plus&output=ts\n\nâ•­ ğŸŸ  Link M3U - MPEGTS\nâ”œâ— http://mydotz.xyz/get.php?username=3754020&password=6336967&type=m3u_plus&output=mpegts\n\nâ•­ ğŸŸ  Link M3U - HLS\nâ”œâ— http://mydotz.xyz/get.php?username=3754020&password=6336967&type=m3u_plus&output=hls\n\nâ•­ ğŸŸ  Link SSIPTV\nâ”œâ— http://e.mydotz.xyz/p/3754020/6336967/ssiptv\n\nâ•­ ğŸŸ  DNS - XCIPTV - 9XTREAM - APPS PRÃ“PRIOS\nâ”œâ— http://croxm.site\n\nğŸŸ  STB DISPONÃVEL: 200.9.154.53\n\nâ”â”â”â”â”â”â”â”â”â”â”â”â”â” \n\nğŸŸ¢ APLICATIVOS PARCEIRO\n\nâ”œâ—ğŸŒ€ XCLOUD \nSAMSUNG - LG - ROKU - IOS - ANDROID - PLAY STORE\n\nâ•­\nâ”œâ— âœ… CÃ³digo: 11a11\nâ”œâ— âœ… UsuÃ¡rio: 3754020                                                                \nâ”œâ— âœ… Senha: 6336967                                                                  \nâ•°â”€\nâ”â”â”â”â”â”â”â”â”â”â”â”â”â”\n\nâ”œâ—ğŸŒ€ IPTV PREMIUM \nSAMSUNG - LG - ROKU - IOS - ANDROID - PLAY STORE\n\nâ•­\nâ”œâ— âœ… CÃ³digo: 11a11\nâ”œâ— âœ… UsuÃ¡rio: 3754020\nâ”œâ— âœ… Senha: 6336967\nâ•°\nâ”â”â”â”â”â”â”â”â”â”â”â”â”â”\n\nğŸŸ¢ APLICATIVOS: XCIPTV - 9XTREAM - SMARTERS \nâ•­\nâ”œâ— âœ… UsuÃ¡rio: 3754020\nâ”œâ— âœ… Senha: 6336967\nâ”œâ— âœ… DNS: http://mydotz.xyz\nâ•°\nâ”â”â”â”â”â”â”â”â”â”â”â”â”â”\n\nğŸ‘‡ App (Via DOWNLOADER BY AFTVNEWS E NTDOWN):\n\nEsses aplicativos sÃ£o destinados a dispositivos com sistema Android.\nPrimeiro, acesse a Play Store e instale o NTdown ou o Downloader.\nApÃ³s instalar um deles, basta escolher um dos apps abaixo e usar o cÃ³digo correspondente para iniciar a instalaÃ§Ã£o.\n\n\nâ”œâ— ğŸŒ€  XC MAX - O MAIS LEVE\n\n- O MELHOR APP PARA TV BOX MXQ E APARELHOS COM POUCA MEMÃ“RIA.\n\nâ”œâ— âœ… UsuÃ¡rio: 3754020\nâ”œâ— âœ… Senha: 6336967\nâ”œâ— ğŸŸ  Apk:https://fui.ai/xcmax\nâ”œâ— ğŸŸ¤ CÃ³digo Downloader: 9980196\nâ”œâ— ğŸŸ¤ CÃ³digo NTdown: 38535\n\nâ”â”â”â”â”â”â”â”â”â”â”â”â”â”\n\nâ”œâ— ğŸŒ€ HAVOK IBO 4K PLUS\n\n- NÃƒO Ã‰ RECOMENDAOD PARA APARELHOS COM POUCA MEMÃ“RIA\n- NÃƒO Ã‰ RECOMENDADO PARA TV BOX MXQ\n\n- PODE USAR NO CELULAR\n- PODE USAR EM TVs ANDROIDS E GOOGLE TV\n- PODE USAR EM FIRE STICK E MI STICK\n\nâ”œâ— âœ… UsuÃ¡rio: 3754020\nâ”œâ— âœ… Senha: 6336967\nâ”œâ— ğŸŸ  Apk: https://aftv.news/9538197\nâ”œâ— ğŸŸ¤ CÃ³digo Downloader: 9538197\nâ”œâ— ğŸŸ¤ CÃ³digo NTdown: 13373\n\nâ”â”â”â”â”â”â”â”â”â”â”â”â”â”\n\nâ”œâ— ğŸŒ€  HAVOK TIVI\n\n- NÃƒO Ã‰ RECOMENDAOD PARA APARELHOS COM POUCA MEMÃ“RIA\n- NÃƒO Ã‰ RECOMENDADO PARA TV BOX MXQ\n- NÃƒO PODE USAR NO CELULAR\n\n- PODE USAR EM TVs ANDROIDS E GOOGLE TV\n- PODE USAR EM FIRE STICK E MI STICK\n\nâ•­\nâ”œâ— âœ… UsuÃ¡rio: 3754020\nâ”œâ— âœ… Senha: 6336967\nâ”œâ— ğŸŸ  Apk: https://aftv.news/2625911\nâ”œâ— ğŸŸ¤ CÃ³digo Downloader: 2625911\nâ”œâ— ğŸŸ¤ CÃ³digo NTdown: 55846\nâ•°\nâ”â”â”â”â”â”â”â”â”â”â”â”â”â”\n\nâ”œâ—ğŸŒ€  HAVOK V3\n\n- APP PARA TV BOX MXQ E APARELHOS COM POUCA MEMÃ“RIA.\n- BOM PRA CELULAR\n- FAZ ESPELHAMENTO\nâ•­\nâ”œâ—  âœ… UsuÃ¡rio: 3754020\nâ”œâ—  âœ… Senha: 6336967\nâ”œâ—  ğŸŸ  Apk: https://aftv.news/6442116\nâ”œâ—  ğŸŸ¤ CÃ³digo Downloader: 6442116\nâ”œâ—  ğŸŸ¤ CÃ³digo NTdown: 47959\nâ•°\nâ”â”â”â”â”â”â”â”â”â”â”â”â”â”\n\nâ”œâ—ğŸŒ€  HAVOK LEGACY\n\n- NÃƒO Ã‰ RECOMENDAOD PARA APARELHOS COM POUCA MEMÃ“RIA\n- NÃƒO Ã‰ RECOMENDADO PARA TV BOX MXQ\n- NÃƒO Ã‰ RECOMENDADO USAR NO CELULAR\n\n- PODE USAR EM TVs ANDROIDS E GOOGLE TV\n- PODE USAR EM FIRE STICK E MI STICK\n\nâ•­\nâ”œâ—  âœ… UsuÃ¡rio: 3754020\nâ”œâ—  âœ… Senha: 6336967\nâ”œâ—  ğŸŸ  Apk: https://fui.ai/havoklegacy\nâ”œâ—  ğŸŸ¤ CÃ³digo Downloader: 8621576\nâ”œâ—  ğŸŸ¤ CÃ³digo NTdown: 23381\nâ•°\nâ”â”â”â”â”â”â”â”â”â”â”â”â”â”\n\nâ”œâ—ğŸŒ€  HAVOK IBO PRO\n\n- APP PARA TV BOX MXQ E APARELHOS COM POUCA MEMÃ“RIA.\n- BOM PRA CELULAR\nâ•­\nâ”œâ—  âœ… UsuÃ¡rio: 3754020\nâ”œâ—  âœ… Senha: 6336967\nâ”œâ—  ğŸŸ  Apk: https://aftv.news/2660097\nâ”œâ—  ğŸŸ¤ CÃ³digo Downloader: 2660097\nâ”œâ—  ğŸŸ¤ CÃ³digo NTdown: 23412\nâ•°\n\nâ”â”â”â”â”â”â”â”â”â”â”â”â”â” \n\nğŸ‘‡ APLICATIVO IOS IPHONE\n\nâ”œâ—ğŸŒ€IPTV SMARTERS LITE\n\nâ•­â”€ \nâ”œâ—  âœ… UsuÃ¡rio: 3754020\nâ”œâ—  âœ… Senha: 6336967\nâ”œâ—  âœ… DNS: http://mydotz.xyz\nâ•° https://apps.apple.com/br/app/smarters-player-lite/id1628995509\n\nâ”â”â”â”â”â”â”â”â”â”â”â”â”â” \n\nâ”œâ—ğŸŒ€ XCLOUD ou IPTV PREMIUM \nâ•­\nâ”œâ— âœ… CÃ³digo: CN1030\nâ”œâ— âœ… UsuÃ¡rio: 3754020                                                                \nâ”œâ— âœ… Senha: 6336967                                                                  \nâ•° https://apps.apple.com/br/app/xcloud-mobile/id6471106231\n\nâ”â”â”â”â”â”â”â”â”â”â”â”â”â” \n\nğŸ‘‡ APLICATIVO WEB COMPUTADOR\n\nâ•­\nâ”œâ—  âœ… UsuÃ¡rio: 3754020\nâ”œâ—  âœ… Senha: 6336967\n\nWEB PLAYER:\nrubi.appwebplayer.online\n\nâ”â”â”â”â”â”â”â”â”â”â”â”â”â” \n\nğŸ‘‡ APLICATIVO PARA VIDEO GAME\n\nâ”œâ—ğŸŒ€  XBOX ONE \nâ•­\nâ”œâ—  âœ… UsuÃ¡rio: 3754020\nâ”œâ—  âœ… Senha: 6336967\nâ•°\nâ•­ ğŸŸ  DUPLEX PLAY SITE LSITA:\nâ”œâ— https://edit.duplexplay.com/\nâ•°\nâ•­ ğŸŸ  APRENDA A COMO ADICIONAR LISTA NO XBOX\nâ”œâ—https://www.youtube.com/watch?v=YQ-i8I5l910\n\nâ”â”â”â”â”â”â”â”â”â”â”â”â”â” \n\nâ”œâ—ğŸŒ€ PS4â—\n\nâ•­\nâ”œâ—  âœ… UsuÃ¡rio: 3754020\nâ”œâ—  âœ… Senha: 6336967\nâ•°\nâ•­\nâ”œâ— ğŸŸ  SS-IPTV via Navegador           \nâ”œâ— ğŸŸ  Link (SSIPTV): http://e.mydotz.xyz/p/3754020/6336967/ssiptv\n\nâ”â”â”â”â”â”â”â”â”â”â”â”â”â” \n\nğŸ‘‡ APLICATIVO PARA CHROMECAST\n\nâ”œâ—ğŸŒ€  V3 - ANDROID  \nâ•­\nâ”œâ—  âœ… UsuÃ¡rio: 3754020\nâ”œâ—  âœ… Senha: 6336967\nâ”œâ—  ğŸŸ  Apk: https://aftv.news/6442116\nâ”œâ—  ğŸŸ¤ CÃ³digo Downloader: 6442116\nâ”œâ—  ğŸŸ¤ CÃ³digo NTdown: 47959\nâ•°\n\nâ”œâ—ğŸŒ€  SMARTERS PLAYER (VERSÃƒO PAGA) - IPHONE \nâ•­\nâ”œâ—  âœ… UsuÃ¡rio: 3754020\nâ”œâ—  âœ… Senha: 6336967\nâ”œâ—  âœ… DNS: http://mydotz.xyz\nâ•° https://apps.apple.com/app/id1628995509\n\nâ”â”â”â”â”â”â”â”â”â”â”â”â”â” \n\nğŸ‘‡  DEVELOPS IP\nâ•­\nâ”œâ—  ğŸŒ€ DUPLECAST: 65.108.220.18\nâ”œâ—  ğŸŒ€ CLOUDDY: 46.165.236.165\nâ”œâ—  ğŸŒ€ SMARTONE: 5.78.42.49\nâ”œâ—  ğŸŒ€ SMART IPTV: 116.202.226.250\nâ”œâ—  ğŸŒ€ SS IPTV: 91.122.100.196 (grÃ¡tis)\nâ”œâ—  ğŸŒ€ SET IPTV: 94.23.97.11\nâ”œâ—  ğŸŒ€ DUPLEX: 192.185.7.111\nâ•°\nâ•­ âš ï¸ Ativar modo develop Samsung\nâ”œâ— ğŸŸ  https://abrela.me/clouddysamsung\n\nâ”â”â”â”â”â”â”â”â”â”â”â”â”â” \n\nğŸ‘‡ APLICATIVO PARA PANASONIC\n\nâ”œâ—ğŸŒ€ SSIPTV  \nâ•­\nâ”œâ—  âœ… SS IPTV: 91.122.100.196 (grÃ¡tis)\nâ•° http://e.dns.invernoquente.online/p/3489741/3057520/ssiptv\n\nâ”â”â”â”â”â”â”â”â”â”â”â”â”â” \n\nğŸ‘‡ APLICATIVO PARA TV MUITO ANTIGA \nâ•­\nâ”œâ— ğŸŒ€ Smart One\nâ”œâ— ğŸŸ  https://smartone-iptv.com/\nâ•°\nâ•­\nâ”œâ— ğŸŒ€ Bay IPTV\nâ”œâ— ğŸŸ  https://bayip.tv/\nâ•°\nâ•­\nâ”œâ— ğŸŒ€  SSIPTV\nâ”œâ— ğŸŸ  https://ss-iptv.com/en/users/playlist\n\nâ•­\nâ”œâ— ğŸŒ€ CLOUDDY\nâ”œâ— ğŸŸ  https://clouddy.online/\nâ•°\n\nâ•­âš ï¸ APRENDA CRIAR EMAILS PARA O CLOUDDY:\nâ”œâ— ğŸŸ  https://youtu.be/ccCKcccPSEI?si=2Z7JRzrxDiL6tGpg\n\nâ•­ âš ï¸APRENDA A COMO ADICIONAR LISTA NO CLOUDDY:\nâ”œâ— ğŸŸ  https://www.youtube.com/watch?v=HsAjq5O7G3c\nâ”œâ— ğŸŸ  https://www.youtube.com/watch?v=gXDCR4Nccx8\n\nâ•­\nâ”œâ—  ğŸŸ¤ Download: 533745\nâ”œâ— ğŸŸ¤ DEVLOP IP: 65.108.220.18\nâ•°\n\nâ”â”â”â”â”â”â”â”â”â”â”â”â”â”\n\nğŸ§© Tutoriais de instalaÃ§Ã£o e ativaÃ§Ã£o de aplicativos pagos\n\n\nâœ… CompatÃ­vel com qualquer tipo de sistema:\nRoku, Samsung, LG, Android, Windows, iPhone e dispositivos da Play Store.\n\nâš ï¸ A lista que vocÃª precisa inserir no site em Play List, chama-se lista M3U.\n\nVocÃª pode obter essa lista gerando um teste diretamente no servidor de sua escolha.\n\n\nğŸ“º Para modelos novos ğŸ“º\n\nâ¡ï¸ Vu Player Pro\nSite pra por a lista: https://vuproplayer.org/\nDownload: 327187\nTutorial: https://www.youtube.com/watch?v=X_cpOSz535k\n\nâ¡ï¸ Ibo Pro\nSite pra por a lista: https://iboproapp.com/\nDownload: 481220\nTutorial:Â https://www.youtube.com/watch?v=hY9pWlPQEMs\n\nâ¡ï¸ Ibo Player\nSite pra por a lista: https://iboproapp.com/\nTutorial:Â https://www.youtube.com/watch?v=9dkg8Or3IQo\n\nâ¡ï¸ Duplex Play \nSite pra por a lista: https://www.duplexplay.net/\nTutorial: https://www.youtube.com/watch?v=ZuLQS8sy_4A\n\nâ¡ï¸ Duplecast\nSite pra por a lista: https://duplecast.com/\nTutorial: https://www.youtube.com/watch?v=AuyTY8gOvZI\n\nâ¡ï¸ Enzo Player\nSite pra por a lista: https://enzoplayer.com/\nTutorial: https://www.youtube.com/watch?v=Uu9Rl7agjAA\n\nâ¡ï¸ Ninja Player\nSite pra por a lista: https://meta-player.app/\nTutorial: https://www.youtube.com/watch?v=5FN8J-ceu6c\n\n\nğŸ“º Para modelos antigos ğŸ“º\n\n\nâ¡ï¸ SSIPTV  \nSite pra por a lista: https://ss-iptv.com/en/users/playlist\nTutorial: https://www.youtube.com/watch?v=yuZwkY9IF3k\n\nâ¡ï¸ CLOUDDY  \nSite pra por a lista: https://clouddy.online/\nTutorial: https://www.youtube.com/watch?v=e83E91MlsHM\n\nâ¡ï¸ SmartOne \nSite pra por a lista: https://smartone-iptv.com/\nTutorial: https://www.youtube.com/watch?v=fQnzN7C0TwA\n\nâ¡ï¸ SET IPTV \nSite pra por a lista: https://cms.manage-setiptv.com/set.app\nTutorial: https://www.youtube.com/watch?v=UqP7HJUBqNY\n\nâ¡ï¸ BAY IPTV\nSite pra por a lista: https://cms.bayip.tv/user/manage/playlist\nTutorial: https://www.youtube.com/watch?v=Bg9ZSzZPKEo\n\n\nâœ… Ibo Player ou Ibo Pro Descubra Qual Ã© o Melhor para VocÃª!\nhttps://www.youtube.com/watch?v=rDiHGTdd5ww\n\nâœ… Ative a licenÃ§a do aplicativo por aqui:\nhttps://t.me/ativacaoprobot?start=828282836"
        }
    ]
}