{"dns":"http:\/\/m.ofmp.site","username":"4314833","connections":1,"password":"3759526","package":"\ud83c\udf41 [TESTE 04H] - ORION","createdAt":"2026-01-23 15:52:16","createdAtFormatted":"23\/01\/2026 15:52:16","expiresAt":"2026-01-23 19:52:15","expiresAtFormatted":"23\/01\/2026 19:52:15","payUrl":"https:\/\/havoktv.top\/#\/checkout\/231qZgNL4q\/VrW8za46LK","reply":"\u2b50 Seja bem vindo ao ORION \u2b50\n\n\ud83d\ude80 Valorize o seu trabalho!\n\nPare de depender de aplicativos gratuitos ou de parceiros. Invista em qualidade, seguran\u00e7a e estabilidade para voc\u00ea e seus clientes.\n\n\u2705 Drive com todos os links e tutoriais de aplicativos pagos\n\n\u27a1\ufe0f  https:\/\/drive.google.com\/drive\/folders\/1PnZKZgCpdRzbaGCL6schaqUuif_DPU9b?usp=sharing\n\n \u2501\u2501\u2501\u2501\u2501\u2501\u2501\u2501\u2501\u2501\u2501\u2501\u2501\u2501 \n\n\u27a1\ufe0f Acesse o link abaixo e conhe\u00e7a nosso bot de ativa\u00e7\u00f5es autom\u00e1ticas:\n \n\u26a1\ufe0fAtivador de aplicativos no Telegram:\nhttps:\/\/t.me\/ATIVADORTOP_BOT\n\n\u26a1\ufe0fAtivador de aplicativos Site Web 01:\nhttp:\/\/ativadortop.com\/\n\n\u26a1\ufe0fAtivador de aplicativos Site Web 02:\nhttps:\/\/ativeapp.com\/index\/havoktv\n\n\u2501\u2501\u2501\u2501\u2501\u2501\u2501\u2501\u2501\u2501\u2501\u2501\u2501\u2501 \n\n\u2705 Quer ter seu pr\u00f3prio aplicativo dispon\u00edvel diretamente na Play Store, com sua marca e sem ficar ref\u00e9m de ningu\u00e9m?\n\nPor apenas R$ 30,00 mensais, voc\u00ea cria e gerencia seu APLICATIVO PR\u00d3PRIO de forma simples, profissional e segura.\n\n\u27a1\ufe0f V\u00cdDEO EXPLICATIVO (PASSO A PASSO):\nhttps:\/\/youtu.be\/XVLso6wwRCw\n\n\u27a1\ufe0f CADASTRE-SE AQUI:\nhttps:\/\/www.gerenciaapp.top\/afiliado\/d8ab0a2f-86be-4e2a-a0e6-2781eb4d2596\n\n\u2501\u2501\u2501\u2501\u2501\u2501\u2501\u2501\u2501\u2501\u2501\u2501\u2501\u2501 \n\n\u256d\n\u251c\u25cf \u2705 Usu\u00e1rio: 4314833\n\u251c\u25cf \u2705 Senha: 3759526\n\u251c\u25cf \ud83d\udcf6 Conex\u00f5es: 3\n\u251c\u25cf \ud83d\udcb5 Pre\u00e7o do Plano: R$\u00a025,00\n\u251c\u25cf \ud83d\uddd3\ufe0f Criado em: 23\/01\/2026 15:52:16\n\u251c\u25cf \ud83d\uddd3\ufe0f Vencimento: 23\/01\/2026 19:52:15\n\n\u256d \ud83d\udcb3 Assinar\/Renovar Plano:\n\u251c\u25cf https:\/\/havoktv.top\/#\/checkout\/231qZgNL4q\/VrW8za46LK\n\n\u2501\u2501\u2501\u2501\u2501\u2501\u2501\u2501\u2501\u2501\u2501\u2501\u2501\u2501\n\n\ud83d\udfe2 LINKS M3U - URL - PLAY LIST - PARA APPS PAGOS:\n\n\ud83d\udfe2 Se uma lista n\u00e3o funcionar bem, basta trocar por outra. Voc\u00ea tem 3 op\u00e7\u00f5es dispon\u00edveis: TS, MPEGTS e HLS.\n\n\n\u256d \ud83d\udfe0 Link M3U - TS\n\u251c\u25cf http:\/\/m.ofmp.site\/get.php?username=4314833&password=3759526&type=m3u_plus&output=ts\n\n\u256d \ud83d\udfe0 Link M3U - MPEGTS\n\u251c\u25cf http:\/\/m.ofmp.site\/get.php?username=4314833&password=3759526&type=m3u_plus&output=mpegts\n\n\u256d \ud83d\udfe0 Link M3U - HLS\n\u251c\u25cf http:\/\/m.ofmp.site\/get.php?username=4314833&password=3759526&type=m3u_plus&output=hls\n\n\u256d \ud83d\udfe0 Link SSIPTV\n\u251c\u25cf http:\/\/e.m.ofmp.site\/p\/4314833\/3759526\/ssiptv\n\n\u256d \ud83d\udfe0 DNS - XCIPTV - 9XTREAM - APPS PR\u00d3PRIOS\n\u251c\u25cf http:\/\/m.ofmp.site\n\n\ud83d\udfe0 STB: 178.156.157.187\n\n\u2501\u2501\u2501\u2501\u2501\u2501\u2501\u2501\u2501\u2501\u2501\u2501\u2501\u2501\n\n\ud83d\udfe2 APLICATIVOS PARCEIRO\n\n\n\u251c\u25cf\ud83c\udf00 BRASIL IPTV\nSAMSUNG - LG - ROKU\n\u256d\n\u251c\u25cf \u2705 C\u00f3digo:  2025 ou 2026\n\u251c\u25cf \u2705 Usu\u00e1rio: 4314833\n\u251c\u25cf \u2705 Senha: 3759526\n\u2570\n\u2501\u2501\u2501\u2501\u2501\u2501\u2501\u2501\u2501\u2501\u2501\u2501\u2501\u2501\n\n\u251c\u25cf\ud83c\udf00 ASSIST PLUS \nSAMSUNG - LG - ROKU\n\u256d\n\u251c\u25cf \u2705 C\u00f3digo:  92653\n\u251c\u25cf \u2705 Usu\u00e1rio: 4314833\n\u251c\u25cf \u2705 Senha: 3759526\n\u2570\n\u2501\u2501\u2501\u2501\u2501\u2501\u2501\u2501\u2501\u2501\u2501\u2501\u2501\u2501\n\n\u251c\u25cf\ud83c\udf00 PLAY SIM\nSAMSUNG - LG - ROKU\n\u256d\n\u251c\u25cf \u2705 C\u00f3digo:  92653\n\u251c\u25cf \u2705 Usu\u00e1rio: 4314833\n\u251c\u25cf \u2705 Senha: 3759526\n\u2570\n\u2501\u2501\u2501\u2501\u2501\u2501\u2501\u2501\u2501\u2501\u2501\u2501\u2501\u2501\n\n\u251c\u25cf\ud83c\udf00 FLEX PLAYER\nSAMSUNG - LG - ROKU\n\u256d\n\u251c\u25cf \u2705 C\u00f3digo:  2026\n\u251c\u25cf \u2705 Usu\u00e1rio: 4314833\n\u251c\u25cf \u2705 Senha: 3759526\n\u2570\n\u2501\u2501\u2501\u2501\u2501\u2501\u2501\u2501\u2501\u2501\u2501\u2501\u2501\u2501\n\n\u251c\u25cf\ud83c\udf00 BRASIL IPTV\nSAMSUNG - LG - ROKU\n\u256d\n\u251c\u25cf \u2705 C\u00f3digo:  2026\n\u251c\u25cf \u2705 Usu\u00e1rio: 4314833\n\u251c\u25cf \u2705 Senha: 3759526\n\u2570\n\u2501\u2501\u2501\u2501\u2501\u2501\u2501\u2501\u2501\u2501\u2501\u2501\u2501\u2501\n\n\u251c\u25cf\ud83c\udf00 XCLOUD \nSAMSUNG - LG - ROKU - IOS - ANDROID - PLAY STORE\n\u256d\n\u251c\u25cf \u2705 C\u00f3digo: 0180 ou 303000\n\u251c\u25cf \u2705 Usu\u00e1rio: 4314833\n\u251c\u25cf \u2705 Senha: 3759526\n\u2570\n\u2501\u2501\u2501\u2501\u2501\u2501\u2501\u2501\u2501\u2501\u2501\u2501\u2501\u2501\n\n\u251c\u25cf\ud83c\udf00 IPTV PREMIUM\nSAMSUNG - LG - ROKU - IOS - ANDROID - PLAY STORE\n\u256d\n\u251c\u25cf \u2705 C\u00f3digo: 0180 ou 303000\n\u251c\u25cf \u2705 Usu\u00e1rio: 4314833\n\u251c\u25cf \u2705 Senha: 3759526\n\u2570\n\n\ud83d\udfe2 APLICATIVOS: XCIPTV - 9XTREAM - SMARTERS \n\u256d\n\u251c\u25cf \u2705 Usu\u00e1rio: 4314833\n\u251c\u25cf \u2705 Senha: 3759526\n\u251c\u25cf \u2705 DNS: http:\/\/m.ofmp.site\n\u2570\n\u2501\u2501\u2501\u2501\u2501\u2501\u2501\u2501\u2501\u2501\u2501\u2501\u2501\u2501\n\n\ud83d\udc47 App (Via DOWNLOADER BY AFTVNEWS E NTDOWN):\n\nEsses aplicativos s\u00e3o destinados a dispositivos com sistema Android.\nPrimeiro, acesse a Play Store e instale o NTdown ou o Downloader.\nAp\u00f3s instalar um deles, basta escolher um dos apps abaixo e usar o c\u00f3digo correspondente para iniciar a instala\u00e7\u00e3o.\n\n\nloja 1 :\ud83d\udd17 https:\/\/lojacinebr.in\nloja 2 : https:\/\/loja-cineflix.appshow.top\n\n\n\u251c\u25cf \ud83c\udf00  XC MAX - O MAIS LEVE\n\n- O MELHOR APP PARA TV BOX MXQ E APARELHOS COM POUCA MEM\u00d3RIA.\n\n\u251c\u25cf \u2705 Usu\u00e1rio: 4314833\n\u251c\u25cf \u2705 Senha: 3759526\n\u251c\u25cf \ud83d\udfe0 Apk:https:\/\/fui.ai\/xcmax\n\u251c\u25cf \ud83d\udfe4 C\u00f3digo Downloader: 9980196\n\u251c\u25cf \ud83d\udfe4 C\u00f3digo NTdown: 38535\n\n\u2501\u2501\u2501\u2501\u2501\u2501\u2501\u2501\u2501\u2501\u2501\u2501\u2501\u2501\n\n\u251c\u25cf \ud83c\udf00 HAVOK IBO 4K PLUS\n\n- N\u00c3O \u00c9 RECOMENDAOD PARA APARELHOS COM POUCA MEM\u00d3RIA\n- N\u00c3O \u00c9 RECOMENDADO PARA TV BOX MXQ\n\n- PODE USAR NO CELULAR\n- PODE USAR EM TVs ANDROIDS E GOOGLE TV\n- PODE USAR EM FIRE STICK E MI STICK\n\n\u251c\u25cf \u2705 Usu\u00e1rio: 4314833\n\u251c\u25cf \u2705 Senha: 3759526\n\u251c\u25cf \ud83d\udfe0 Apk: https:\/\/aftv.news\/9538197\n\u251c\u25cf \ud83d\udfe4 C\u00f3digo Downloader: 9538197\n\u251c\u25cf \ud83d\udfe4 C\u00f3digo NTdown: 13373\n\n\u2501\u2501\u2501\u2501\u2501\u2501\u2501\u2501\u2501\u2501\u2501\u2501\u2501\u2501\n\n\u251c\u25cf \ud83c\udf00  HAVOK TIVI\n\n- N\u00c3O \u00c9 RECOMENDAOD PARA APARELHOS COM POUCA MEM\u00d3RIA\n- N\u00c3O \u00c9 RECOMENDADO PARA TV BOX MXQ\n- N\u00c3O PODE USAR NO CELULAR\n\n- PODE USAR EM TVs ANDROIDS E GOOGLE TV\n- PODE USAR EM FIRE STICK E MI STICK\n\n\u256d\n\u251c\u25cf \u2705 Usu\u00e1rio: 4314833\n\u251c\u25cf \u2705 Senha: 3759526\n\u251c\u25cf \ud83d\udfe0 Apk: https:\/\/aftv.news\/2625911\n\u251c\u25cf \ud83d\udfe4 C\u00f3digo Downloader: 2625911\n\u251c\u25cf \ud83d\udfe4 C\u00f3digo NTdown: 55846\n\u2570\n\u2501\u2501\u2501\u2501\u2501\u2501\u2501\u2501\u2501\u2501\u2501\u2501\u2501\u2501\n\n\u251c\u25cf\ud83c\udf00  HAVOK V3\n\n- APP PARA TV BOX MXQ E APARELHOS COM POUCA MEM\u00d3RIA.\n- BOM PRA CELULAR\n- FAZ ESPELHAMENTO\n\u256d\n\u251c\u25cf  \u2705 Usu\u00e1rio: 4314833\n\u251c\u25cf  \u2705 Senha: 3759526\n\u251c\u25cf  \ud83d\udfe0 Apk: https:\/\/aftv.news\/6442116\n\u251c\u25cf  \ud83d\udfe4 C\u00f3digo Downloader: 6442116\n\u251c\u25cf  \ud83d\udfe4 C\u00f3digo NTdown: 47959\n\u2570\n\u2501\u2501\u2501\u2501\u2501\u2501\u2501\u2501\u2501\u2501\u2501\u2501\u2501\u2501\n\n\u251c\u25cf\ud83c\udf00  HAVOK LEGACY\n\n- N\u00c3O \u00c9 RECOMENDAOD PARA APARELHOS COM POUCA MEM\u00d3RIA\n- N\u00c3O \u00c9 RECOMENDADO PARA TV BOX MXQ\n- N\u00c3O \u00c9 RECOMENDADO USAR NO CELULAR\n\n- PODE USAR EM TVs ANDROIDS E GOOGLE TV\n- PODE USAR EM FIRE STICK E MI STICK\n\n\u256d\n\u251c\u25cf  \u2705 Usu\u00e1rio: 4314833\n\u251c\u25cf  \u2705 Senha: 3759526\n\u251c\u25cf  \ud83d\udfe0 Apk: https:\/\/fui.ai\/havoklegacy\n\u251c\u25cf  \ud83d\udfe4 C\u00f3digo Downloader: 8621576\n\u251c\u25cf  \ud83d\udfe4 C\u00f3digo NTdown: 23381\n\u2570\n\u2501\u2501\u2501\u2501\u2501\u2501\u2501\u2501\u2501\u2501\u2501\u2501\u2501\u2501\n\n\u251c\u25cf\ud83c\udf00  HAVOK IBO PRO\n\n- APP PARA TV BOX MXQ E APARELHOS COM POUCA MEM\u00d3RIA.\n- BOM PRA CELULAR\n\u256d\n\u251c\u25cf  \u2705 Usu\u00e1rio: 4314833\n\u251c\u25cf  \u2705 Senha: 3759526\n\u251c\u25cf  \ud83d\udfe0 Apk: https:\/\/aftv.news\/2660097\n\u251c\u25cf  \ud83d\udfe4 C\u00f3digo Downloader: 2660097\n\u251c\u25cf  \ud83d\udfe4 C\u00f3digo NTdown: 23412\n\u2570\n\n\u2501\u2501\u2501\u2501\u2501\u2501\u2501\u2501\u2501\u2501\u2501\u2501\u2501\u2501\n\n\ud83d\udc47 APLICATIVO IOS IPHONE\n\n\u251c\u25cf\ud83c\udf00IPTV SMARTERS LITE\n\n\u256d\u2500\n\u251c\u25cf  \u2705 Usu\u00e1rio: 4314833\n\u251c\u25cf  \u2705 Senha: 3759526\n\u251c\u25cf  \u2705 DNS: http:\/\/m.ofmp.site\n\u2570 https:\/\/apps.apple.com\/br\/app\/smarters-player-lite\/id1628995509\n\n\u2501\u2501\u2501\u2501\u2501\u2501\u2501\u2501\u2501\u2501\u2501\u2501\u2501\u2501\n\n\ud83d\udc47 APLICATIVO WEB COMPUTADOR\n\n\u251c\u25cf  \u2705 Usu\u00e1rio: 4314833\n\u251c\u25cf  \u2705 Senha: 3759526\n\nhttp:\/\/web.pds01.site\/\n\n\u2501\u2501\u2501\u2501\u2501\u2501\u2501\u2501\u2501\u2501\u2501\u2501\u2501\u2501\n\n\ud83d\udc47 APLICATIVO PARA VIDEO GAME\n\n\u251c\u25cf\ud83c\udf00  XBOX ONE\n\u256d\n\u251c\u25cf  \u2705 Usu\u00e1rio: 4314833\n\u251c\u25cf  \u2705 Senha: 3759526\n\u2570\n\u256d \ud83d\udfe0 DUPLEX PLAY SITE LSITA:\n\u251c\u25cf https:\/\/edit.duplexplay.com\/\n\u2570\n\u256d \ud83d\udfe0 APRENDA A COMO ADICIONAR LISTA NO XBOX\n\u251c\u25cfhttps:\/\/www.youtube.com\/watch?v=YQ-i8I5l910\n\n\u2501\u2501\u2501\u2501\u2501\u2501\u2501\u2501\u2501\u2501\u2501\u2501\u2501\u2501\n\n\u251c\u25cf\ud83c\udf00 PS4\u25cf\n\n\u256d\n\u251c\u25cf  \u2705 Usu\u00e1rio: 4314833\n\u251c\u25cf  \u2705 Senha: 3759526\n\u2570\n\u256d\n\u251c\u25cf \ud83d\udfe0 SS-IPTV via Navegador\n\u251c\u25cf \ud83d\udfe0 Link (SSIPTV): http:\/\/e.m.ofmp.site\/p\/4314833\/3759526\/ssiptv\n\n\u2501\u2501\u2501\u2501\u2501\u2501\u2501\u2501\u2501\u2501\u2501\u2501\u2501\u2501\n\n\ud83d\udc47 APLICATIVO PARA CHROMECAST\n\n\u251c\u25cf\ud83c\udf00  HAVOK V3 - ANDROID\n\u256d\n\u251c\u25cf  \u2705 Usu\u00e1rio: 4314833\n\u251c\u25cf  \u2705 Senha: 3759526\n\u251c\u25cf  \ud83d\udfe0 Apk: https:\/\/aftv.news\/6442116\n\u251c\u25cf  \ud83d\udfe4 C\u00f3digo Downloader: 6442116\n\u251c\u25cf  \ud83d\udfe4 C\u00f3digo NTdown: 47959\n\u2570\n\u2501\u2501\u2501\u2501\u2501\u2501\u2501\u2501\u2501\u2501\u2501\u2501\u2501\u2501\n\n\u251c\u25cf\ud83c\udf00  SMARTERS PLAYER (VERS\u00c3O PAGA) - IPHONE\n\u256d\u2500\n\u251c\u25cf  \u2705 Usu\u00e1rio: 4314833\n\u251c\u25cf  \u2705 Senha: 3759526\n\u251c\u25cf  \u2705 DNS: http:\/\/m.ofmp.site\n\u2570 https:\/\/apps.apple.com\/app\/id1628995509\n\n\u2501\u2501\u2501\u2501\u2501\u2501\u2501\u2501\u2501\u2501\u2501\u2501\u2501\u2501\n\n\ud83d\udc47  DEVELOPS IP\n\u256d\n\u251c\u25cf  \ud83c\udf00 DUPLECAST: 65.108.220.18\n\u251c\u25cf  \ud83c\udf00 CLOUDDY: 46.165.236.165\n\u251c\u25cf  \ud83c\udf00 SMARTONE: 5.78.42.49\n\u251c\u25cf  \ud83c\udf00 SMART IPTV: 116.202.226.250\n\u251c\u25cf  \ud83c\udf00 SS IPTV: 91.122.100.196 (gr\u00e1tis)\n\u251c\u25cf  \ud83c\udf00 SET IPTV: 94.23.97.11\n\u251c\u25cf  \ud83c\udf00 DUPLEX: 192.185.7.111\n\u2570\n\u256d \u26a0\ufe0f Ativar modo develop Samsung\n\u251c\u25cf \ud83d\udfe0 https:\/\/abrela.me\/clouddysamsung\n\n\u2501\u2501\u2501\u2501\u2501\u2501\u2501\u2501\u2501\u2501\u2501\u2501\u2501\u2501\n\n\ud83d\udc47 APLICATIVO PARA PANASONIC\n\n\u251c\u25cf\ud83c\udf00 SSIPTV\n\u256d\n\u251c\u25cf  \u2705 SS IPTV: 91.122.100.196 (gr\u00e1tis)\n\u2570 http:\/\/e.dns.invernoquente.online\/p\/3489741\/3057520\/ssiptv\n\n\u2501\u2501\u2501\u2501\u2501\u2501\u2501\u2501\u2501\u2501\u2501\u2501\u2501\u2501\n\n\ud83d\udc47 APLICATIVO PARA TV MUITO ANTIGA\n\u256d\n\u251c\u25cf \ud83c\udf00 Smart One\n\u251c\u25cf \ud83d\udfe0 https:\/\/smartone-iptv.com\/\n\u2570\n\u256d\n\u251c\u25cf \ud83c\udf00 Bay IPTV\n\u251c\u25cf \ud83d\udfe0 https:\/\/bayip.tv\/\n\u2570\n\u256d\n\u251c\u25cf \ud83c\udf00  SSIPTV\n\u251c\u25cf \ud83d\udfe0 https:\/\/ss-iptv.com\/en\/users\/playlist\n\n\u256d\n\u251c\u25cf \ud83c\udf00 CLOUDDY\n\u251c\u25cf \ud83d\udfe0 https:\/\/clouddy.online\/\n\u2570\n\n\u256d\u26a0\ufe0f APRENDA CRIAR EMAILS PARA O CLOUDDY:\n\u251c\u25cf \ud83d\udfe0 https:\/\/youtu.be\/ccCKcccPSEI?si=2Z7JRzrxDiL6tGpg\n\n\u256d \u26a0\ufe0fAPRENDA A COMO ADICIONAR LISTA NO CLOUDDY:\n\u251c\u25cf \ud83d\udfe0 https:\/\/www.youtube.com\/watch?v=HsAjq5O7G3c\n\u251c\u25cf \ud83d\udfe0 https:\/\/www.youtube.com\/watch?v=gXDCR4Nccx8\n\n\u256d\n\u251c\u25cf  \ud83d\udfe4 Download: 533745\n\u251c\u25cf \ud83d\udfe4 DEVLOP IP: 65.108.220.18\n\u2570","data":[{"message":"\u2b50 Seja bem vindo ao ORION \u2b50\n\n\ud83d\ude80 Valorize o seu trabalho!\n\nPare de depender de aplicativos gratuitos ou de parceiros. Invista em qualidade, seguran\u00e7a e estabilidade para voc\u00ea e seus clientes.\n\n\u2705 Drive com todos os links e tutoriais de aplicativos pagos\n\n\u27a1\ufe0f  https:\/\/drive.google.com\/drive\/folders\/1PnZKZgCpdRzbaGCL6schaqUuif_DPU9b?usp=sharing\n\n \u2501\u2501\u2501\u2501\u2501\u2501\u2501\u2501\u2501\u2501\u2501\u2501\u2501\u2501 \n\n\u27a1\ufe0f Acesse o link abaixo e conhe\u00e7a nosso bot de ativa\u00e7\u00f5es autom\u00e1ticas:\n \n\u26a1\ufe0fAtivador de aplicativos no Telegram:\nhttps:\/\/t.me\/ATIVADORTOP_BOT\n\n\u26a1\ufe0fAtivador de aplicativos Site Web 01:\nhttp:\/\/ativadortop.com\/\n\n\u26a1\ufe0fAtivador de aplicativos Site Web 02:\nhttps:\/\/ativeapp.com\/index\/havoktv\n\n\u2501\u2501\u2501\u2501\u2501\u2501\u2501\u2501\u2501\u2501\u2501\u2501\u2501\u2501 \n\n\u2705 Quer ter seu pr\u00f3prio aplicativo dispon\u00edvel diretamente na Play Store, com sua marca e sem ficar ref\u00e9m de ningu\u00e9m?\n\nPor apenas R$ 30,00 mensais, voc\u00ea cria e gerencia seu APLICATIVO PR\u00d3PRIO de forma simples, profissional e segura.\n\n\u27a1\ufe0f V\u00cdDEO EXPLICATIVO (PASSO A PASSO):\nhttps:\/\/youtu.be\/XVLso6wwRCw\n\n\u27a1\ufe0f CADASTRE-SE AQUI:\nhttps:\/\/www.gerenciaapp.top\/afiliado\/d8ab0a2f-86be-4e2a-a0e6-2781eb4d2596\n\n\u2501\u2501\u2501\u2501\u2501\u2501\u2501\u2501\u2501\u2501\u2501\u2501\u2501\u2501 \n\n\u256d\n\u251c\u25cf \u2705 Usu\u00e1rio: 4314833\n\u251c\u25cf \u2705 Senha: 3759526\n\u251c\u25cf \ud83d\udcf6 Conex\u00f5es: 3\n\u251c\u25cf \ud83d\udcb5 Pre\u00e7o do Plano: R$\u00a025,00\n\u251c\u25cf \ud83d\uddd3\ufe0f Criado em: 23\/01\/2026 15:52:16\n\u251c\u25cf \ud83d\uddd3\ufe0f Vencimento: 23\/01\/2026 19:52:15\n\n\u256d \ud83d\udcb3 Assinar\/Renovar Plano:\n\u251c\u25cf https:\/\/havoktv.top\/#\/checkout\/231qZgNL4q\/VrW8za46LK\n\n\u2501\u2501\u2501\u2501\u2501\u2501\u2501\u2501\u2501\u2501\u2501\u2501\u2501\u2501\n\n\ud83d\udfe2 LINKS M3U - URL - PLAY LIST - PARA APPS PAGOS:\n\n\ud83d\udfe2 Se uma lista n\u00e3o funcionar bem, basta trocar por outra. Voc\u00ea tem 3 op\u00e7\u00f5es dispon\u00edveis: TS, MPEGTS e HLS.\n\n\n\u256d \ud83d\udfe0 Link M3U - TS\n\u251c\u25cf http:\/\/m.ofmp.site\/get.php?username=4314833&password=3759526&type=m3u_plus&output=ts\n\n\u256d \ud83d\udfe0 Link M3U - MPEGTS\n\u251c\u25cf http:\/\/m.ofmp.site\/get.php?username=4314833&password=3759526&type=m3u_plus&output=mpegts\n\n\u256d \ud83d\udfe0 Link M3U - HLS\n\u251c\u25cf http:\/\/m.ofmp.site\/get.php?username=4314833&password=3759526&type=m3u_plus&output=hls\n\n\u256d \ud83d\udfe0 Link SSIPTV\n\u251c\u25cf http:\/\/e.m.ofmp.site\/p\/4314833\/3759526\/ssiptv\n\n\u256d \ud83d\udfe0 DNS - XCIPTV - 9XTREAM - APPS PR\u00d3PRIOS\n\u251c\u25cf http:\/\/m.ofmp.site\n\n\ud83d\udfe0 STB: 178.156.157.187\n\n\u2501\u2501\u2501\u2501\u2501\u2501\u2501\u2501\u2501\u2501\u2501\u2501\u2501\u2501\n\n\ud83d\udfe2 APLICATIVOS PARCEIRO\n\n\n\u251c\u25cf\ud83c\udf00 BRASIL IPTV\nSAMSUNG - LG - ROKU\n\u256d\n\u251c\u25cf \u2705 C\u00f3digo:  2025 ou 2026\n\u251c\u25cf \u2705 Usu\u00e1rio: 4314833\n\u251c\u25cf \u2705 Senha: 3759526\n\u2570\n\u2501\u2501\u2501\u2501\u2501\u2501\u2501\u2501\u2501\u2501\u2501\u2501\u2501\u2501\n\n\u251c\u25cf\ud83c\udf00 ASSIST PLUS \nSAMSUNG - LG - ROKU\n\u256d\n\u251c\u25cf \u2705 C\u00f3digo:  92653\n\u251c\u25cf \u2705 Usu\u00e1rio: 4314833\n\u251c\u25cf \u2705 Senha: 3759526\n\u2570\n\u2501\u2501\u2501\u2501\u2501\u2501\u2501\u2501\u2501\u2501\u2501\u2501\u2501\u2501\n\n\u251c\u25cf\ud83c\udf00 PLAY SIM\nSAMSUNG - LG - ROKU\n\u256d\n\u251c\u25cf \u2705 C\u00f3digo:  92653\n\u251c\u25cf \u2705 Usu\u00e1rio: 4314833\n\u251c\u25cf \u2705 Senha: 3759526\n\u2570\n\u2501\u2501\u2501\u2501\u2501\u2501\u2501\u2501\u2501\u2501\u2501\u2501\u2501\u2501\n\n\u251c\u25cf\ud83c\udf00 FLEX PLAYER\nSAMSUNG - LG - ROKU\n\u256d\n\u251c\u25cf \u2705 C\u00f3digo:  2026\n\u251c\u25cf \u2705 Usu\u00e1rio: 4314833\n\u251c\u25cf \u2705 Senha: 3759526\n\u2570\n\u2501\u2501\u2501\u2501\u2501\u2501\u2501\u2501\u2501\u2501\u2501\u2501\u2501\u2501\n\n\u251c\u25cf\ud83c\udf00 BRASIL IPTV\nSAMSUNG - LG - ROKU\n\u256d\n\u251c\u25cf \u2705 C\u00f3digo:  2026\n\u251c\u25cf \u2705 Usu\u00e1rio: 4314833\n\u251c\u25cf \u2705 Senha: 3759526\n\u2570\n\u2501\u2501\u2501\u2501\u2501\u2501\u2501\u2501\u2501\u2501\u2501\u2501\u2501\u2501\n\n\u251c\u25cf\ud83c\udf00 XCLOUD \nSAMSUNG - LG - ROKU - IOS - ANDROID - PLAY STORE\n\u256d\n\u251c\u25cf \u2705 C\u00f3digo: 0180 ou 303000\n\u251c\u25cf \u2705 Usu\u00e1rio: 4314833\n\u251c\u25cf \u2705 Senha: 3759526\n\u2570\n\u2501\u2501\u2501\u2501\u2501\u2501\u2501\u2501\u2501\u2501\u2501\u2501\u2501\u2501\n\n\u251c\u25cf\ud83c\udf00 IPTV PREMIUM\nSAMSUNG - LG - ROKU - IOS - ANDROID - PLAY STORE\n\u256d\n\u251c\u25cf \u2705 C\u00f3digo: 0180 ou 303000\n\u251c\u25cf \u2705 Usu\u00e1rio: 4314833\n\u251c\u25cf \u2705 Senha: 3759526\n\u2570\n\n\ud83d\udfe2 APLICATIVOS: XCIPTV - 9XTREAM - SMARTERS \n\u256d\n\u251c\u25cf \u2705 Usu\u00e1rio: 4314833\n\u251c\u25cf \u2705 Senha: 3759526\n\u251c\u25cf \u2705 DNS: http:\/\/m.ofmp.site\n\u2570\n\u2501\u2501\u2501\u2501\u2501\u2501\u2501\u2501\u2501\u2501\u2501\u2501\u2501\u2501\n\n\ud83d\udc47 App (Via DOWNLOADER BY AFTVNEWS E NTDOWN):\n\nEsses aplicativos s\u00e3o destinados a dispositivos com sistema Android.\nPrimeiro, acesse a Play Store e instale o NTdown ou o Downloader.\nAp\u00f3s instalar um deles, basta escolher um dos apps abaixo e usar o c\u00f3digo correspondente para iniciar a instala\u00e7\u00e3o.\n\n\nloja 1 :\ud83d\udd17 https:\/\/lojacinebr.in\nloja 2 : https:\/\/loja-cineflix.appshow.top\n\n\n\u251c\u25cf \ud83c\udf00  XC MAX - O MAIS LEVE\n\n- O MELHOR APP PARA TV BOX MXQ E APARELHOS COM POUCA MEM\u00d3RIA.\n\n\u251c\u25cf \u2705 Usu\u00e1rio: 4314833\n\u251c\u25cf \u2705 Senha: 3759526\n\u251c\u25cf \ud83d\udfe0 Apk:https:\/\/fui.ai\/xcmax\n\u251c\u25cf \ud83d\udfe4 C\u00f3digo Downloader: 9980196\n\u251c\u25cf \ud83d\udfe4 C\u00f3digo NTdown: 38535\n\n\u2501\u2501\u2501\u2501\u2501\u2501\u2501\u2501\u2501\u2501\u2501\u2501\u2501\u2501\n\n\u251c\u25cf \ud83c\udf00 HAVOK IBO 4K PLUS\n\n- N\u00c3O \u00c9 RECOMENDAOD PARA APARELHOS COM POUCA MEM\u00d3RIA\n- N\u00c3O \u00c9 RECOMENDADO PARA TV BOX MXQ\n\n- PODE USAR NO CELULAR\n- PODE USAR EM TVs ANDROIDS E GOOGLE TV\n- PODE USAR EM FIRE STICK E MI STICK\n\n\u251c\u25cf \u2705 Usu\u00e1rio: 4314833\n\u251c\u25cf \u2705 Senha: 3759526\n\u251c\u25cf \ud83d\udfe0 Apk: https:\/\/aftv.news\/9538197\n\u251c\u25cf \ud83d\udfe4 C\u00f3digo Downloader: 9538197\n\u251c\u25cf \ud83d\udfe4 C\u00f3digo NTdown: 13373\n\n\u2501\u2501\u2501\u2501\u2501\u2501\u2501\u2501\u2501\u2501\u2501\u2501\u2501\u2501\n\n\u251c\u25cf \ud83c\udf00  HAVOK TIVI\n\n- N\u00c3O \u00c9 RECOMENDAOD PARA APARELHOS COM POUCA MEM\u00d3RIA\n- N\u00c3O \u00c9 RECOMENDADO PARA TV BOX MXQ\n- N\u00c3O PODE USAR NO CELULAR\n\n- PODE USAR EM TVs ANDROIDS E GOOGLE TV\n- PODE USAR EM FIRE STICK E MI STICK\n\n\u256d\n\u251c\u25cf \u2705 Usu\u00e1rio: 4314833\n\u251c\u25cf \u2705 Senha: 3759526\n\u251c\u25cf \ud83d\udfe0 Apk: https:\/\/aftv.news\/2625911\n\u251c\u25cf \ud83d\udfe4 C\u00f3digo Downloader: 2625911\n\u251c\u25cf \ud83d\udfe4 C\u00f3digo NTdown: 55846\n\u2570\n\u2501\u2501\u2501\u2501\u2501\u2501\u2501\u2501\u2501\u2501\u2501\u2501\u2501\u2501\n\n\u251c\u25cf\ud83c\udf00  HAVOK V3\n\n- APP PARA TV BOX MXQ E APARELHOS COM POUCA MEM\u00d3RIA.\n- BOM PRA CELULAR\n- FAZ ESPELHAMENTO\n\u256d\n\u251c\u25cf  \u2705 Usu\u00e1rio: 4314833\n\u251c\u25cf  \u2705 Senha: 3759526\n\u251c\u25cf  \ud83d\udfe0 Apk: https:\/\/aftv.news\/6442116\n\u251c\u25cf  \ud83d\udfe4 C\u00f3digo Downloader: 6442116\n\u251c\u25cf  \ud83d\udfe4 C\u00f3digo NTdown: 47959\n\u2570\n\u2501\u2501\u2501\u2501\u2501\u2501\u2501\u2501\u2501\u2501\u2501\u2501\u2501\u2501\n\n\u251c\u25cf\ud83c\udf00  HAVOK LEGACY\n\n- N\u00c3O \u00c9 RECOMENDAOD PARA APARELHOS COM POUCA MEM\u00d3RIA\n- N\u00c3O \u00c9 RECOMENDADO PARA TV BOX MXQ\n- N\u00c3O \u00c9 RECOMENDADO USAR NO CELULAR\n\n- PODE USAR EM TVs ANDROIDS E GOOGLE TV\n- PODE USAR EM FIRE STICK E MI STICK\n\n\u256d\n\u251c\u25cf  \u2705 Usu\u00e1rio: 4314833\n\u251c\u25cf  \u2705 Senha: 3759526\n\u251c\u25cf  \ud83d\udfe0 Apk: https:\/\/fui.ai\/havoklegacy\n\u251c\u25cf  \ud83d\udfe4 C\u00f3digo Downloader: 8621576\n\u251c\u25cf  \ud83d\udfe4 C\u00f3digo NTdown: 23381\n\u2570\n\u2501\u2501\u2501\u2501\u2501\u2501\u2501\u2501\u2501\u2501\u2501\u2501\u2501\u2501\n\n\u251c\u25cf\ud83c\udf00  HAVOK IBO PRO\n\n- APP PARA TV BOX MXQ E APARELHOS COM POUCA MEM\u00d3RIA.\n- BOM PRA CELULAR\n\u256d\n\u251c\u25cf  \u2705 Usu\u00e1rio: 4314833\n\u251c\u25cf  \u2705 Senha: 3759526\n\u251c\u25cf  \ud83d\udfe0 Apk: https:\/\/aftv.news\/2660097\n\u251c\u25cf  \ud83d\udfe4 C\u00f3digo Downloader: 2660097\n\u251c\u25cf  \ud83d\udfe4 C\u00f3digo NTdown: 23412\n\u2570\n\n\u2501\u2501\u2501\u2501\u2501\u2501\u2501\u2501\u2501\u2501\u2501\u2501\u2501\u2501\n\n\ud83d\udc47 APLICATIVO IOS IPHONE\n\n\u251c\u25cf\ud83c\udf00IPTV SMARTERS LITE\n\n\u256d\u2500\n\u251c\u25cf  \u2705 Usu\u00e1rio: 4314833\n\u251c\u25cf  \u2705 Senha: 3759526\n\u251c\u25cf  \u2705 DNS: http:\/\/m.ofmp.site\n\u2570 https:\/\/apps.apple.com\/br\/app\/smarters-player-lite\/id1628995509\n\n\u2501\u2501\u2501\u2501\u2501\u2501\u2501\u2501\u2501\u2501\u2501\u2501\u2501\u2501\n\n\ud83d\udc47 APLICATIVO WEB COMPUTADOR\n\n\u251c\u25cf  \u2705 Usu\u00e1rio: 4314833\n\u251c\u25cf  \u2705 Senha: 3759526\n\nhttp:\/\/web.pds01.site\/\n\n\u2501\u2501\u2501\u2501\u2501\u2501\u2501\u2501\u2501\u2501\u2501\u2501\u2501\u2501\n\n\ud83d\udc47 APLICATIVO PARA VIDEO GAME\n\n\u251c\u25cf\ud83c\udf00  XBOX ONE\n\u256d\n\u251c\u25cf  \u2705 Usu\u00e1rio: 4314833\n\u251c\u25cf  \u2705 Senha: 3759526\n\u2570\n\u256d \ud83d\udfe0 DUPLEX PLAY SITE LSITA:\n\u251c\u25cf https:\/\/edit.duplexplay.com\/\n\u2570\n\u256d \ud83d\udfe0 APRENDA A COMO ADICIONAR LISTA NO XBOX\n\u251c\u25cfhttps:\/\/www.youtube.com\/watch?v=YQ-i8I5l910\n\n\u2501\u2501\u2501\u2501\u2501\u2501\u2501\u2501\u2501\u2501\u2501\u2501\u2501\u2501\n\n\u251c\u25cf\ud83c\udf00 PS4\u25cf\n\n\u256d\n\u251c\u25cf  \u2705 Usu\u00e1rio: 4314833\n\u251c\u25cf  \u2705 Senha: 3759526\n\u2570\n\u256d\n\u251c\u25cf \ud83d\udfe0 SS-IPTV via Navegador\n\u251c\u25cf \ud83d\udfe0 Link (SSIPTV): http:\/\/e.m.ofmp.site\/p\/4314833\/3759526\/ssiptv\n\n\u2501\u2501\u2501\u2501\u2501\u2501\u2501\u2501\u2501\u2501\u2501\u2501\u2501\u2501\n\n\ud83d\udc47 APLICATIVO PARA CHROMECAST\n\n\u251c\u25cf\ud83c\udf00  HAVOK V3 - ANDROID\n\u256d\n\u251c\u25cf  \u2705 Usu\u00e1rio: 4314833\n\u251c\u25cf  \u2705 Senha: 3759526\n\u251c\u25cf  \ud83d\udfe0 Apk: https:\/\/aftv.news\/6442116\n\u251c\u25cf  \ud83d\udfe4 C\u00f3digo Downloader: 6442116\n\u251c\u25cf  \ud83d\udfe4 C\u00f3digo NTdown: 47959\n\u2570\n\u2501\u2501\u2501\u2501\u2501\u2501\u2501\u2501\u2501\u2501\u2501\u2501\u2501\u2501\n\n\u251c\u25cf\ud83c\udf00  SMARTERS PLAYER (VERS\u00c3O PAGA) - IPHONE\n\u256d\u2500\n\u251c\u25cf  \u2705 Usu\u00e1rio: 4314833\n\u251c\u25cf  \u2705 Senha: 3759526\n\u251c\u25cf  \u2705 DNS: http:\/\/m.ofmp.site\n\u2570 https:\/\/apps.apple.com\/app\/id1628995509\n\n\u2501\u2501\u2501\u2501\u2501\u2501\u2501\u2501\u2501\u2501\u2501\u2501\u2501\u2501\n\n\ud83d\udc47  DEVELOPS IP\n\u256d\n\u251c\u25cf  \ud83c\udf00 DUPLECAST: 65.108.220.18\n\u251c\u25cf  \ud83c\udf00 CLOUDDY: 46.165.236.165\n\u251c\u25cf  \ud83c\udf00 SMARTONE: 5.78.42.49\n\u251c\u25cf  \ud83c\udf00 SMART IPTV: 116.202.226.250\n\u251c\u25cf  \ud83c\udf00 SS IPTV: 91.122.100.196 (gr\u00e1tis)\n\u251c\u25cf  \ud83c\udf00 SET IPTV: 94.23.97.11\n\u251c\u25cf  \ud83c\udf00 DUPLEX: 192.185.7.111\n\u2570\n\u256d \u26a0\ufe0f Ativar modo develop Samsung\n\u251c\u25cf \ud83d\udfe0 https:\/\/abrela.me\/clouddysamsung\n\n\u2501\u2501\u2501\u2501\u2501\u2501\u2501\u2501\u2501\u2501\u2501\u2501\u2501\u2501\n\n\ud83d\udc47 APLICATIVO PARA PANASONIC\n\n\u251c\u25cf\ud83c\udf00 SSIPTV\n\u256d\n\u251c\u25cf  \u2705 SS IPTV: 91.122.100.196 (gr\u00e1tis)\n\u2570 http:\/\/e.dns.invernoquente.online\/p\/3489741\/3057520\/ssiptv\n\n\u2501\u2501\u2501\u2501\u2501\u2501\u2501\u2501\u2501\u2501\u2501\u2501\u2501\u2501\n\n\ud83d\udc47 APLICATIVO PARA TV MUITO ANTIGA\n\u256d\n\u251c\u25cf \ud83c\udf00 Smart One\n\u251c\u25cf \ud83d\udfe0 https:\/\/smartone-iptv.com\/\n\u2570\n\u256d\n\u251c\u25cf \ud83c\udf00 Bay IPTV\n\u251c\u25cf \ud83d\udfe0 https:\/\/bayip.tv\/\n\u2570\n\u256d\n\u251c\u25cf \ud83c\udf00  SSIPTV\n\u251c\u25cf \ud83d\udfe0 https:\/\/ss-iptv.com\/en\/users\/playlist\n\n\u256d\n\u251c\u25cf \ud83c\udf00 CLOUDDY\n\u251c\u25cf \ud83d\udfe0 https:\/\/clouddy.online\/\n\u2570\n\n\u256d\u26a0\ufe0f APRENDA CRIAR EMAILS PARA O CLOUDDY:\n\u251c\u25cf \ud83d\udfe0 https:\/\/youtu.be\/ccCKcccPSEI?si=2Z7JRzrxDiL6tGpg\n\n\u256d \u26a0\ufe0fAPRENDA A COMO ADICIONAR LISTA NO CLOUDDY:\n\u251c\u25cf \ud83d\udfe0 https:\/\/www.youtube.com\/watch?v=HsAjq5O7G3c\n\u251c\u25cf \ud83d\udfe0 https:\/\/www.youtube.com\/watch?v=gXDCR4Nccx8\n\n\u256d\n\u251c\u25cf  \ud83d\udfe4 Download: 533745\n\u251c\u25cf \ud83d\udfe4 DEVLOP IP: 65.108.220.18\n\u2570"}]}