{
    "dns": "http://lifeuhd.cddn.shop",
    "username": "101305718",
    "connections": 1,
    "password": "984495187",
    "package": "ğŸŒ K9 PLAY TESTE - s/ADULTOS",
    "createdAt": "2026-01-18 21:20:22",
    "createdAtFormatted": "18/01/2026 21:20:22",
    "expiresAt": "2026-01-19 03:20:22",
    "expiresAtFormatted": "19/01/2026 03:20:22",
    "payUrl": "https://am2flix.info/#/checkout/pKDNw63WXl/yb1BAgkWPR",
    "reply": "ğŸ“º SEJA BEM-VINDO a K9 PLAY â–¶ï¸\n\nğŸ“Œ SEGUE INFORMAÃ‡Ã•ES DO ACESSO.\n\nâœ… UsuÃ¡rio: 101305718\nâœ… Senha: 984495187\n\nğŸ“¦ *Plano:* ğŸŒ K9 PLAY TESTE - s/ADULTOS\nğŸ’µ *PreÃ§o do Plano:* R$Â 0,00\nğŸ—“ï¸ *Criado em:* 18/01/2026 21:20:22\nğŸ—“ï¸ *Vencimento:* 19/01/2026 03:20:22\nğŸ“¶ *ConexÃµes:* 1\n\nğŸŒ *DNS UNIVERSAL:* 1: http://lifeuhd.cddn.shop\n\n\nğŸŒ *DNS:*1: http://attech.site\nğŸŒ *DNS:*2: http://fugtt.site\nhttp://parceria.parclll.site\nhttp://lunar.netpl4y.com\nhttp://megatop.site\n\n\nğŸ“º *DNS STB / SmartUp 1:* 5.161.103.130\nğŸ“º *DNS STB / SmartUp 2:* 178.156.154.204\n\nğŸŒŸ Parceria App Assist+ (Samsung, LG, Roku e Android)\nğŸ”µ *CÃ³digo:* 926692\nâœ… UsuÃ¡rio: 101305718\nâœ… Senha: 984495187\n\nğŸ”µ Parceria App Brasil IPTV (Samsung, LG, Roku)\nğŸ”µ *CÃ³digo:* 2027\nâœ… UsuÃ¡rio: 101305718\nâœ… Senha: 984495187\n\nğŸŒŸ Parceria App Playsim (LG, Roku e Android, em breve Samsung)\nğŸ”µ *CÃ³digo:* 926692\nâœ… UsuÃ¡rio: 101305718\nâœ… Senha: 984495187\n\nğŸŒ Parceria App Flex play (Samsung, LG, Roku e Android)\n\nâœ… Utilizar lista com DNS  abaixo para ativar parceria:\n\nğŸ”·*Lista Parceria Flex play* *(M3U COMPLETO):*\nhttp://pbkblack.site/get.php?username=323857&password=600236&type=m3u_plus&output=mpegts\n\nAndroid - NTDOWN \n*Cod:* 75556\n\nâœ… Site para inserir as listas:\nhttps://flexplayer.io/#/upload-playlist\n\nğŸŸ¦ PARCERIA VIZZION PLAY (Samsung, LG, Roku e Android)\nâœ… *CÃ³digo:* 760665\nâœ… UsuÃ¡rio: 101305718\nâœ… Senha: 984495187\n\nğŸ”·â PARCERIA XCLOUD (Samsung, LG e Roku)\nâœ… *Provider:*server222 ou 111a OU 11a1 \nâœ… UsuÃ¡rio: 101305718\nâœ… Senha: 984495187\n\nâ­ Parceria apps TOP PLAY e MAGIC PLAY (Tv Roku e IOS)\nâœ… *CÃ³digo:* 1273\nâœ… UsuÃ¡rio: 101305718\nâœ… Senha: 984495187\n\nâ–¶ï¸ APPS PARCEIROS  ANDROID \n\nğŸ”¹ APP HOME PLAYER XTREAM\n\nğŸ”— Download direto\nğŸ“Œ CÃ³digo NTDOWN: 63334\nğŸ“¥ Downloader: 6245886\nğŸŒ Link direto: http://aftv.news/6245886\n\nğŸ”¹ APP ROCKET\n\nğŸ”— Download direto\nğŸ“Œ CÃ³digo NTDOWN: 14447\nğŸ“¥ Downloader: 6220831\nğŸŒ Link direto: http://aftv.news/6220831\n\nğŸ”¹ APP ZINK\n\nğŸ”— Download direto\nğŸ“Œ CÃ³digo NTDOWN: 68618\nğŸ“¥ Downloader: 1650495\nğŸŒ Link direto: http://aftv.news/1650495\n\nğŸ”¹ APP HOME PLAYER\n\nğŸ”— Download direto\nğŸ“Œ CÃ³digo NTDOWN: 28558\nğŸ“¥ Downloader: 8845054\nğŸŒ Link direto: http://aftv.news/8845054\n\nAPP TOP TV â–¶ï¸\nğŸ“¥ Link para download:\nğŸ”‘ CÃ³digo: 4710019\nğŸ”— Downloader: aftv.news/4710019\n\nAcesso via usuÃ¡rio e senha:\n\nâœ… UsuÃ¡rio: 101305718\nâœ… Senha: 984495187\n\n\nÂ®ï¸ğŸŒ PARCERIA APPS Multiapps (Samsung, LG, Roku e Android)\n\nIPTV Player io, IPTV OTT player, IPTV 4K, IPTV Stream player, IPTV Player, IPTV Play, IPTV Plus, IPTV Pro, \nPRO Player, IPTV Star, TVIP PLAYER, EGO IPTV, SCANDIC IPTV, Flixtra Player.\n\nâœ… Utilizar lista com DNS abaixo para ativar parceria:\nğŸŒ*Lista Parceria* *(M3U COMPLETO):* http://server10.fun/get.php?username=101305718&password=984495187&type=m3u_plus&output=mpegts\n\n\nÂ®ï¸ APP PRÃ“PRIO PARA ANDROID\n\nğŸ“º Para TVs Android â€“ \nğŸ”— Link Diretoâ¤ \nğŸ“¥ CÃ³digo Downloaderâ¤ \n\nâ–¶ï¸ NOVO APP UniTV\nğŸ“² DisponÃ­vel para Baixar direto pelo Downloader.\nâœ¨ Interface moderna, estilo UniTV,\nğŸ“¥ Link para download:\nğŸ”‘ CÃ³digo: 4710019\nğŸ”— Downloader: aftv.news/4710019\n\n\nâ–¶ï¸*1* *OpÃ§Ã£o (M3U COMPLETO):* http://lifeuhd.cddn.shop/get.php?username=101305718&password=984495187&type=m3u_plus&output=mpegts\n\nâ–¶ï¸ *Link Curto (M3U):* http://e.lifeuhd.cddn.shop/p/101305718/984495187/m3u\n\nâ–¶ï¸ *Link (HLS):* http://lifeuhd.cddn.shop/get.php?username=101305718&password=984495187&type=m3u_plus&output=hls\n\nâ–¶ï¸ *Link Curto (HLS):* http://e.lifeuhd.cddn.shop/p/101305718/984495187/hls\n\nâ–¶ï¸ *Link (SSIPTV):* http://e.lifeuhd.cddn.shop/p/101305718/984495187/ssiptv\n\nâ–¶ï¸ K9 PLAY",
    "data": [
        {
            "message": "ğŸ“º SEJA BEM-VINDO a K9 PLAY â–¶ï¸\n\nğŸ“Œ SEGUE INFORMAÃ‡Ã•ES DO ACESSO.\n\nâœ… UsuÃ¡rio: 101305718\nâœ… Senha: 984495187\n\nğŸ“¦ *Plano:* ğŸŒ K9 PLAY TESTE - s/ADULTOS\nğŸ’µ *PreÃ§o do Plano:* R$Â 0,00\nğŸ—“ï¸ *Criado em:* 18/01/2026 21:20:22\nğŸ—“ï¸ *Vencimento:* 19/01/2026 03:20:22\nğŸ“¶ *ConexÃµes:* 1\n\nğŸŒ *DNS UNIVERSAL:* 1: http://lifeuhd.cddn.shop\n\n\nğŸŒ *DNS:*1: http://attech.site\nğŸŒ *DNS:*2: http://fugtt.site\nhttp://parceria.parclll.site\nhttp://lunar.netpl4y.com\nhttp://megatop.site\n\n\nğŸ“º *DNS STB / SmartUp 1:* 5.161.103.130\nğŸ“º *DNS STB / SmartUp 2:* 178.156.154.204\n\nğŸŒŸ Parceria App Assist+ (Samsung, LG, Roku e Android)\nğŸ”µ *CÃ³digo:* 926692\nâœ… UsuÃ¡rio: 101305718\nâœ… Senha: 984495187\n\nğŸ”µ Parceria App Brasil IPTV (Samsung, LG, Roku)\nğŸ”µ *CÃ³digo:* 2027\nâœ… UsuÃ¡rio: 101305718\nâœ… Senha: 984495187\n\nğŸŒŸ Parceria App Playsim (LG, Roku e Android, em breve Samsung)\nğŸ”µ *CÃ³digo:* 926692\nâœ… UsuÃ¡rio: 101305718\nâœ… Senha: 984495187\n\nğŸŒ Parceria App Flex play (Samsung, LG, Roku e Android)\n\nâœ… Utilizar lista com DNS  abaixo para ativar parceria:\n\nğŸ”·*Lista Parceria Flex play* *(M3U COMPLETO):*\nhttp://pbkblack.site/get.php?username=323857&password=600236&type=m3u_plus&output=mpegts\n\nAndroid - NTDOWN \n*Cod:* 75556\n\nâœ… Site para inserir as listas:\nhttps://flexplayer.io/#/upload-playlist\n\nğŸŸ¦ PARCERIA VIZZION PLAY (Samsung, LG, Roku e Android)\nâœ… *CÃ³digo:* 760665\nâœ… UsuÃ¡rio: 101305718\nâœ… Senha: 984495187\n\nğŸ”·â PARCERIA XCLOUD (Samsung, LG e Roku)\nâœ… *Provider:*server222 ou 111a OU 11a1 \nâœ… UsuÃ¡rio: 101305718\nâœ… Senha: 984495187\n\nâ­ Parceria apps TOP PLAY e MAGIC PLAY (Tv Roku e IOS)\nâœ… *CÃ³digo:* 1273\nâœ… UsuÃ¡rio: 101305718\nâœ… Senha: 984495187\n\nâ–¶ï¸ APPS PARCEIROS  ANDROID \n\nğŸ”¹ APP HOME PLAYER XTREAM\n\nğŸ”— Download direto\nğŸ“Œ CÃ³digo NTDOWN: 63334\nğŸ“¥ Downloader: 6245886\nğŸŒ Link direto: http://aftv.news/6245886\n\nğŸ”¹ APP ROCKET\n\nğŸ”— Download direto\nğŸ“Œ CÃ³digo NTDOWN: 14447\nğŸ“¥ Downloader: 6220831\nğŸŒ Link direto: http://aftv.news/6220831\n\nğŸ”¹ APP ZINK\n\nğŸ”— Download direto\nğŸ“Œ CÃ³digo NTDOWN: 68618\nğŸ“¥ Downloader: 1650495\nğŸŒ Link direto: http://aftv.news/1650495\n\nğŸ”¹ APP HOME PLAYER\n\nğŸ”— Download direto\nğŸ“Œ CÃ³digo NTDOWN: 28558\nğŸ“¥ Downloader: 8845054\nğŸŒ Link direto: http://aftv.news/8845054\n\nAPP TOP TV â–¶ï¸\nğŸ“¥ Link para download:\nğŸ”‘ CÃ³digo: 4710019\nğŸ”— Downloader: aftv.news/4710019\n\nAcesso via usuÃ¡rio e senha:\n\nâœ… UsuÃ¡rio: 101305718\nâœ… Senha: 984495187\n\n\nÂ®ï¸ğŸŒ PARCERIA APPS Multiapps (Samsung, LG, Roku e Android)\n\nIPTV Player io, IPTV OTT player, IPTV 4K, IPTV Stream player, IPTV Player, IPTV Play, IPTV Plus, IPTV Pro, \nPRO Player, IPTV Star, TVIP PLAYER, EGO IPTV, SCANDIC IPTV, Flixtra Player.\n\nâœ… Utilizar lista com DNS abaixo para ativar parceria:\nğŸŒ*Lista Parceria* *(M3U COMPLETO):* http://server10.fun/get.php?username=101305718&password=984495187&type=m3u_plus&output=mpegts\n\n\nÂ®ï¸ APP PRÃ“PRIO PARA ANDROID\n\nğŸ“º Para TVs Android â€“ \nğŸ”— Link Diretoâ¤ \nğŸ“¥ CÃ³digo Downloaderâ¤ \n\nâ–¶ï¸ NOVO APP UniTV\nğŸ“² DisponÃ­vel para Baixar direto pelo Downloader.\nâœ¨ Interface moderna, estilo UniTV,\nğŸ“¥ Link para download:\nğŸ”‘ CÃ³digo: 4710019\nğŸ”— Downloader: aftv.news/4710019\n\n\nâ–¶ï¸*1* *OpÃ§Ã£o (M3U COMPLETO):* http://lifeuhd.cddn.shop/get.php?username=101305718&password=984495187&type=m3u_plus&output=mpegts\n\nâ–¶ï¸ *Link Curto (M3U):* http://e.lifeuhd.cddn.shop/p/101305718/984495187/m3u\n\nâ–¶ï¸ *Link (HLS):* http://lifeuhd.cddn.shop/get.php?username=101305718&password=984495187&type=m3u_plus&output=hls\n\nâ–¶ï¸ *Link Curto (HLS):* http://e.lifeuhd.cddn.shop/p/101305718/984495187/hls\n\nâ–¶ï¸ *Link (SSIPTV):* http://e.lifeuhd.cddn.shop/p/101305718/984495187/ssiptv\n\nâ–¶ï¸ K9 PLAY"
        }
    ]
}