{"dns":"http:\/\/z01.shop","username":"974766165","connections":1,"password":"638344267","package":"\u303d\ufe0f TESTE COMPLETO C\/ ADULTOS \u303d\ufe0f","createdAt":"2026-01-22 21:22:40","createdAtFormatted":"22\/01\/2026 21:22:40","expiresAt":"2026-01-23 01:22:39","expiresAtFormatted":"23\/01\/2026 01:22:39","payUrl":"https:\/\/subzero.sigmab.pro\/#\/checkout\/QBWQYxxWGR\/K4Wr3qG1eN","reply":"\ud83d\udcfa SEJA BEM-VINDO\n\n\ud83d\udccc SEGUE INFORMA\u00c7\u00d5ES DO ACESSO.\n\n\u2705 Usu\u00e1rio: 974766165\n\u2705 Senha: 638344267\n\n\ud83d\udce6 *Plano:* \u303d\ufe0f TESTE COMPLETO C\/ ADULTOS \u303d\ufe0f\n\ud83d\udcb5 *Pre\u00e7o do Plano:* R$\u00a00,00\n\ud83d\uddd3\ufe0f *Criado em:* 22\/01\/2026 21:22:40\n\ud83d\uddd3\ufe0f *Vencimento:* 23\/01\/2026 01:22:39\n\ud83d\udcf6 *Conex\u00f5es:* 2\n\n\ud83c\udf0e *DNS UNIVERSAL:* http:\/\/z01.shop\n\n\ud83c\udf1f Parceria App Assist+ (Samsung, LG, Roku e Android)\n\nc\u00f3digo: 248752\n\u2705 Usu\u00e1rio: 974766165\n\u2705 Senha: 638344267\n\nDownloader: 8209473\nNtdown: 77646\n\n\u26a1 Parceria App Playsim (Samsung, LG, Roku e Android)\n\nc\u00f3digo: 248752\n\u2705 Usu\u00e1rio: 974766165\n\u2705 Senha: 638344267\n\nDownloader: 7275096\nNtdown: 72853\n\n\u26a1 Parceria App Powerplay (Samsung, LG, Roku e Android)\n\nc\u00f3digo: 129051\n\u2705 Usu\u00e1rio: 974766165\n\u2705 Senha: 638344267\n\nDownloader: 5487022\nNtdown: 29448\n\n\u26a1 Parceria App Epicplay (Samsung, LG, Roku e Android)\n\nc\u00f3digo: 443300\n\u2705 Usu\u00e1rio: 974766165\n\u2705 Senha: 638344267\n\nDownloader: 9770859\n\n\ud83d\udfe6 PARCERIA VIZZION PLAY (Samsung, LG, Roku e Android)\n\n\u2705 C\u00f3digo: 473279\n\u2705 Usu\u00e1rio: 974766165\n\u2705 Senha: 638344267\n\nC\u00f3digo Downloader: 2868880\n\n\u274e PARCERIA XCLOUD (Samsung, LG e Roku)\n\n\u2705 Provider: server222\n\u2705 Usu\u00e1rio: 974766165\n\u2705 Senha: 638344267\n\n\u2b50 Parceria apps TOP PLAY e MAGIC PLAY (Tv Roku e IOS)\n\nC\u00f3digo: 1274\n\u2705 Usu\u00e1rio: 974766165\n\u2705 Senha: 638344267\n\n\ud83c\udf10 Parceria Apps Multiapps (Samsung, LG, Roku e Android)\n\nIPTV Player io\nIPTV OTT player\nIPTV 4K\nIPTV Stream player,\nIPTV Player\nIPTV Play\nIPTV Plus\nIPTV Pro\nPRO Player\nIPTV Star\nTVIP PLAYER\nEGO IPTV\nSCANDIC IPTV\nFlixtra Player\n\n\u2705 Utilizar lista com DNS abaixo para ativar parceria:\n\n\ud83c\udf10*Lista Parceria* *(M3U COMPLETO):* http:\/\/topcdn.fun\/get.php?username=974766165&password=638344267&type=m3u_plus&output=mpegts\n\n\u25fe PARCERIA APPS ANDROID \n\n\ud83d\udd39 APP UNI TV\n\n\ud83d\udd17 Download direto\n\ud83d\udccc C\u00f3digo NTDOWN: 51744\n\ud83d\udce5 Downloader: 9387398\n\ud83c\udf10 Link direto: http:\/\/aftv.news\/9387398\n\n\ud83d\udd39 APP HOME PLAYER XTREAM\n\n\ud83d\udd17 Download direto\n\ud83d\udccc C\u00f3digo NTDOWN: 63334\n\ud83d\udce5 Downloader: 6245886\n\ud83c\udf10 Link direto: http:\/\/aftv.news\/6245886\n\n\ud83d\udd39 APP ROCKET\n\n\ud83d\udd17 Download direto\n\ud83d\udccc C\u00f3digo NTDOWN: 14447\n\ud83d\udce5 Downloader: 6220831\n\ud83c\udf10 Link direto: http:\/\/aftv.news\/6220831\n\n\ud83d\udd39 APP ZINK\n\n\ud83d\udd17 Download direto\n\ud83d\udccc C\u00f3digo NTDOWN: 68618\n\ud83d\udce5 Downloader: 1650495\n\ud83c\udf10 Link direto: http:\/\/aftv.news\/1650495\n\n\ud83d\udd39 APP HOME PLAYER\n\n\ud83d\udd17 Download direto\n\ud83d\udccc C\u00f3digo NTDOWN: 28558\n\ud83d\udce5 Downloader: 8845054\n\ud83c\udf10 Link direto: http:\/\/aftv.news\/8845054\n\nAcesso via usu\u00e1rio e senha:\n\n\u2705 Usu\u00e1rio: 974766165\n\u2705 Senha: 638344267\n\n\n\u25fe *Link (M3U):* http:\/\/z01.shop\/get.php?username=974766165&password=638344267&type=m3u_plus&output=mpegts\n\n\u25fe *Link (M3U):* http:\/\/z01.shop\/get.php?username=974766165&password=638344267&type=m3u_plus&output=mpegts\n\n\u25fe *Link Curto (M3U):* http:\/\/e.z01.shop\/p\/974766165\/638344267\/m3u\n\n\u25fe *Link (HLS):* http:\/\/z01.shop\/get.php?username=974766165&password=638344267&type=m3u_plus&output=hls\n\n\u25fe *Link Curto (HLS):* http:\/\/e.z01.shop\/p\/974766165\/638344267\/hls\n\n\u25fe *Link (SSIPTV):* http:\/\/e.z01.shop\/p\/974766165\/638344267\/ssiptv\n\nF\u00caNIX \u303d\ufe0f","data":[{"message":"\ud83d\udcfa SEJA BEM-VINDO\n\n\ud83d\udccc SEGUE INFORMA\u00c7\u00d5ES DO ACESSO.\n\n\u2705 Usu\u00e1rio: 974766165\n\u2705 Senha: 638344267\n\n\ud83d\udce6 *Plano:* \u303d\ufe0f TESTE COMPLETO C\/ ADULTOS \u303d\ufe0f\n\ud83d\udcb5 *Pre\u00e7o do Plano:* R$\u00a00,00\n\ud83d\uddd3\ufe0f *Criado em:* 22\/01\/2026 21:22:40\n\ud83d\uddd3\ufe0f *Vencimento:* 23\/01\/2026 01:22:39\n\ud83d\udcf6 *Conex\u00f5es:* 2\n\n\ud83c\udf0e *DNS UNIVERSAL:* http:\/\/z01.shop\n\n\ud83c\udf1f Parceria App Assist+ (Samsung, LG, Roku e Android)\n\nc\u00f3digo: 248752\n\u2705 Usu\u00e1rio: 974766165\n\u2705 Senha: 638344267\n\nDownloader: 8209473\nNtdown: 77646\n\n\u26a1 Parceria App Playsim (Samsung, LG, Roku e Android)\n\nc\u00f3digo: 248752\n\u2705 Usu\u00e1rio: 974766165\n\u2705 Senha: 638344267\n\nDownloader: 7275096\nNtdown: 72853\n\n\u26a1 Parceria App Powerplay (Samsung, LG, Roku e Android)\n\nc\u00f3digo: 129051\n\u2705 Usu\u00e1rio: 974766165\n\u2705 Senha: 638344267\n\nDownloader: 5487022\nNtdown: 29448\n\n\u26a1 Parceria App Epicplay (Samsung, LG, Roku e Android)\n\nc\u00f3digo: 443300\n\u2705 Usu\u00e1rio: 974766165\n\u2705 Senha: 638344267\n\nDownloader: 9770859\n\n\ud83d\udfe6 PARCERIA VIZZION PLAY (Samsung, LG, Roku e Android)\n\n\u2705 C\u00f3digo: 473279\n\u2705 Usu\u00e1rio: 974766165\n\u2705 Senha: 638344267\n\nC\u00f3digo Downloader: 2868880\n\n\u274e PARCERIA XCLOUD (Samsung, LG e Roku)\n\n\u2705 Provider: server222\n\u2705 Usu\u00e1rio: 974766165\n\u2705 Senha: 638344267\n\n\u2b50 Parceria apps TOP PLAY e MAGIC PLAY (Tv Roku e IOS)\n\nC\u00f3digo: 1274\n\u2705 Usu\u00e1rio: 974766165\n\u2705 Senha: 638344267\n\n\ud83c\udf10 Parceria Apps Multiapps (Samsung, LG, Roku e Android)\n\nIPTV Player io\nIPTV OTT player\nIPTV 4K\nIPTV Stream player,\nIPTV Player\nIPTV Play\nIPTV Plus\nIPTV Pro\nPRO Player\nIPTV Star\nTVIP PLAYER\nEGO IPTV\nSCANDIC IPTV\nFlixtra Player\n\n\u2705 Utilizar lista com DNS abaixo para ativar parceria:\n\n\ud83c\udf10*Lista Parceria* *(M3U COMPLETO):* http:\/\/topcdn.fun\/get.php?username=974766165&password=638344267&type=m3u_plus&output=mpegts\n\n\u25fe PARCERIA APPS ANDROID \n\n\ud83d\udd39 APP UNI TV\n\n\ud83d\udd17 Download direto\n\ud83d\udccc C\u00f3digo NTDOWN: 51744\n\ud83d\udce5 Downloader: 9387398\n\ud83c\udf10 Link direto: http:\/\/aftv.news\/9387398\n\n\ud83d\udd39 APP HOME PLAYER XTREAM\n\n\ud83d\udd17 Download direto\n\ud83d\udccc C\u00f3digo NTDOWN: 63334\n\ud83d\udce5 Downloader: 6245886\n\ud83c\udf10 Link direto: http:\/\/aftv.news\/6245886\n\n\ud83d\udd39 APP ROCKET\n\n\ud83d\udd17 Download direto\n\ud83d\udccc C\u00f3digo NTDOWN: 14447\n\ud83d\udce5 Downloader: 6220831\n\ud83c\udf10 Link direto: http:\/\/aftv.news\/6220831\n\n\ud83d\udd39 APP ZINK\n\n\ud83d\udd17 Download direto\n\ud83d\udccc C\u00f3digo NTDOWN: 68618\n\ud83d\udce5 Downloader: 1650495\n\ud83c\udf10 Link direto: http:\/\/aftv.news\/1650495\n\n\ud83d\udd39 APP HOME PLAYER\n\n\ud83d\udd17 Download direto\n\ud83d\udccc C\u00f3digo NTDOWN: 28558\n\ud83d\udce5 Downloader: 8845054\n\ud83c\udf10 Link direto: http:\/\/aftv.news\/8845054\n\nAcesso via usu\u00e1rio e senha:\n\n\u2705 Usu\u00e1rio: 974766165\n\u2705 Senha: 638344267\n\n\n\u25fe *Link (M3U):* http:\/\/z01.shop\/get.php?username=974766165&password=638344267&type=m3u_plus&output=mpegts\n\n\u25fe *Link (M3U):* http:\/\/z01.shop\/get.php?username=974766165&password=638344267&type=m3u_plus&output=mpegts\n\n\u25fe *Link Curto (M3U):* http:\/\/e.z01.shop\/p\/974766165\/638344267\/m3u\n\n\u25fe *Link (HLS):* http:\/\/z01.shop\/get.php?username=974766165&password=638344267&type=m3u_plus&output=hls\n\n\u25fe *Link Curto (HLS):* http:\/\/e.z01.shop\/p\/974766165\/638344267\/hls\n\n\u25fe *Link (SSIPTV):* http:\/\/e.z01.shop\/p\/974766165\/638344267\/ssiptv\n\nF\u00caNIX \u303d\ufe0f"}]}