{
    "dns": "http://z01.shop",
    "username": "532253053",
    "connections": 1,
    "password": "697159542",
    "package": "ã€½ï¸ TESTE COMPLETO S/ ADULTOS ã€½ï¸",
    "createdAt": "2026-01-16 09:33:15",
    "createdAtFormatted": "16/01/2026 09:33:15",
    "expiresAt": "2026-01-16 13:33:14",
    "expiresAtFormatted": "16/01/2026 13:33:14",
    "payUrl": "https://subzero.sigmab.pro/#/checkout/QBWQYxxWGR/241K66MWmx",
    "reply": "ğŸ“º SEJA BEM-VINDO\n\nğŸ“Œ SEGUE INFORMAÃ‡Ã•ES DO ACESSO.\n\nâœ… UsuÃ¡rio: 532253053\nâœ… Senha: 697159542\n\nğŸ“¦ *Plano:* ã€½ï¸ TESTE COMPLETO S/ ADULTOS ã€½ï¸\nğŸ’µ *PreÃ§o do Plano:* R$Â 0,00\nğŸ—“ï¸ *Criado em:* 16/01/2026 09:33:15\nğŸ—“ï¸ *Vencimento:* 16/01/2026 13:33:14\nğŸ“¶ *ConexÃµes:* 2\n\nğŸŒ *DNS UNIVERSAL:* http://z01.shop\n\nğŸŒŸ Parceria App Assist+ (Samsung, LG, Roku e Android)\n\ncÃ³digo: 248752\nâœ… UsuÃ¡rio: 532253053\nâœ… Senha: 697159542\n\nDownloader: 8209473\nNtdown: 77646\n\nâš¡ Parceria App Playsim (Samsung, LG, Roku e Android)\n\ncÃ³digo: 248752\nâœ… UsuÃ¡rio: 532253053\nâœ… Senha: 697159542\n\nDownloader: 7275096\nNtdown: 72853\n\nâš¡ Parceria App Powerplay (Samsung, LG, Roku e Android)\n\ncÃ³digo: 129051\nâœ… UsuÃ¡rio: 532253053\nâœ… Senha: 697159542\n\nDownloader: 5487022\nNtdown: 29448\n\nâš¡ Parceria App Epicplay (Samsung, LG, Roku e Android)\n\ncÃ³digo: 443300\nâœ… UsuÃ¡rio: 532253053\nâœ… Senha: 697159542\n\nDownloader: 9770859\n\nğŸŸ¦ PARCERIA VIZZION PLAY (Samsung, LG, Roku e Android)\n\nâœ… CÃ³digo: 473279\nâœ… UsuÃ¡rio: 532253053\nâœ… Senha: 697159542\n\nCÃ³digo Downloader: 2868880\n\nâ PARCERIA XCLOUD (Samsung, LG e Roku)\n\nâœ… Provider: server222\nâœ… UsuÃ¡rio: 532253053\nâœ… Senha: 697159542\n\nâ­ Parceria apps TOP PLAY e MAGIC PLAY (Tv Roku e IOS)\n\nCÃ³digo: 1274\nâœ… UsuÃ¡rio: 532253053\nâœ… Senha: 697159542\n\nğŸŒ Parceria Apps Multiapps (Samsung, LG, Roku e Android)\n\nIPTV Player io\nIPTV OTT player\nIPTV 4K\nIPTV Stream player,\nIPTV Player\nIPTV Play\nIPTV Plus\nIPTV Pro\nPRO Player\nIPTV Star\nTVIP PLAYER\nEGO IPTV\nSCANDIC IPTV\nFlixtra Player\n\nâœ… Utilizar lista com DNS abaixo para ativar parceria:\n\nğŸŒ*Lista Parceria* *(M3U COMPLETO):* http://topcdn.fun/get.php?username=532253053&password=697159542&type=m3u_plus&output=mpegts\n\nâ—¾ PARCERIA APPS ANDROID \n\nğŸ”¹ APP UNI TV\n\nğŸ”— Download direto\nğŸ“Œ CÃ³digo NTDOWN: 51744\nğŸ“¥ Downloader: 9387398\nğŸŒ Link direto: http://aftv.news/9387398\n\nğŸ”¹ APP HOME PLAYER XTREAM\n\nğŸ”— Download direto\nğŸ“Œ CÃ³digo NTDOWN: 63334\nğŸ“¥ Downloader: 6245886\nğŸŒ Link direto: http://aftv.news/6245886\n\nğŸ”¹ APP ROCKET\n\nğŸ”— Download direto\nğŸ“Œ CÃ³digo NTDOWN: 14447\nğŸ“¥ Downloader: 6220831\nğŸŒ Link direto: http://aftv.news/6220831\n\nğŸ”¹ APP ZINK\n\nğŸ”— Download direto\nğŸ“Œ CÃ³digo NTDOWN: 68618\nğŸ“¥ Downloader: 1650495\nğŸŒ Link direto: http://aftv.news/1650495\n\nğŸ”¹ APP HOME PLAYER\n\nğŸ”— Download direto\nğŸ“Œ CÃ³digo NTDOWN: 28558\nğŸ“¥ Downloader: 8845054\nğŸŒ Link direto: http://aftv.news/8845054\n\nAcesso via usuÃ¡rio e senha:\n\nâœ… UsuÃ¡rio: 532253053\nâœ… Senha: 697159542\n\n\nâ—¾ *Link (M3U):* http://z01.shop/get.php?username=532253053&password=697159542&type=m3u_plus&output=mpegts\n\nâ—¾ *Link (M3U):* http://z01.shop/get.php?username=532253053&password=697159542&type=m3u_plus&output=mpegts\n\nâ—¾ *Link Curto (M3U):* http://e.z01.shop/p/532253053/697159542/m3u\n\nâ—¾ *Link (HLS):* http://z01.shop/get.php?username=532253053&password=697159542&type=m3u_plus&output=hls\n\nâ—¾ *Link Curto (HLS):* http://e.z01.shop/p/532253053/697159542/hls\n\nâ—¾ *Link (SSIPTV):* http://e.z01.shop/p/532253053/697159542/ssiptv\n\nFÃŠNIX ã€½ï¸",
    "data": [
        {
            "message": "ğŸ“º SEJA BEM-VINDO\n\nğŸ“Œ SEGUE INFORMAÃ‡Ã•ES DO ACESSO.\n\nâœ… UsuÃ¡rio: 532253053\nâœ… Senha: 697159542\n\nğŸ“¦ *Plano:* ã€½ï¸ TESTE COMPLETO S/ ADULTOS ã€½ï¸\nğŸ’µ *PreÃ§o do Plano:* R$Â 0,00\nğŸ—“ï¸ *Criado em:* 16/01/2026 09:33:15\nğŸ—“ï¸ *Vencimento:* 16/01/2026 13:33:14\nğŸ“¶ *ConexÃµes:* 2\n\nğŸŒ *DNS UNIVERSAL:* http://z01.shop\n\nğŸŒŸ Parceria App Assist+ (Samsung, LG, Roku e Android)\n\ncÃ³digo: 248752\nâœ… UsuÃ¡rio: 532253053\nâœ… Senha: 697159542\n\nDownloader: 8209473\nNtdown: 77646\n\nâš¡ Parceria App Playsim (Samsung, LG, Roku e Android)\n\ncÃ³digo: 248752\nâœ… UsuÃ¡rio: 532253053\nâœ… Senha: 697159542\n\nDownloader: 7275096\nNtdown: 72853\n\nâš¡ Parceria App Powerplay (Samsung, LG, Roku e Android)\n\ncÃ³digo: 129051\nâœ… UsuÃ¡rio: 532253053\nâœ… Senha: 697159542\n\nDownloader: 5487022\nNtdown: 29448\n\nâš¡ Parceria App Epicplay (Samsung, LG, Roku e Android)\n\ncÃ³digo: 443300\nâœ… UsuÃ¡rio: 532253053\nâœ… Senha: 697159542\n\nDownloader: 9770859\n\nğŸŸ¦ PARCERIA VIZZION PLAY (Samsung, LG, Roku e Android)\n\nâœ… CÃ³digo: 473279\nâœ… UsuÃ¡rio: 532253053\nâœ… Senha: 697159542\n\nCÃ³digo Downloader: 2868880\n\nâ PARCERIA XCLOUD (Samsung, LG e Roku)\n\nâœ… Provider: server222\nâœ… UsuÃ¡rio: 532253053\nâœ… Senha: 697159542\n\nâ­ Parceria apps TOP PLAY e MAGIC PLAY (Tv Roku e IOS)\n\nCÃ³digo: 1274\nâœ… UsuÃ¡rio: 532253053\nâœ… Senha: 697159542\n\nğŸŒ Parceria Apps Multiapps (Samsung, LG, Roku e Android)\n\nIPTV Player io\nIPTV OTT player\nIPTV 4K\nIPTV Stream player,\nIPTV Player\nIPTV Play\nIPTV Plus\nIPTV Pro\nPRO Player\nIPTV Star\nTVIP PLAYER\nEGO IPTV\nSCANDIC IPTV\nFlixtra Player\n\nâœ… Utilizar lista com DNS abaixo para ativar parceria:\n\nğŸŒ*Lista Parceria* *(M3U COMPLETO):* http://topcdn.fun/get.php?username=532253053&password=697159542&type=m3u_plus&output=mpegts\n\nâ—¾ PARCERIA APPS ANDROID \n\nğŸ”¹ APP UNI TV\n\nğŸ”— Download direto\nğŸ“Œ CÃ³digo NTDOWN: 51744\nğŸ“¥ Downloader: 9387398\nğŸŒ Link direto: http://aftv.news/9387398\n\nğŸ”¹ APP HOME PLAYER XTREAM\n\nğŸ”— Download direto\nğŸ“Œ CÃ³digo NTDOWN: 63334\nğŸ“¥ Downloader: 6245886\nğŸŒ Link direto: http://aftv.news/6245886\n\nğŸ”¹ APP ROCKET\n\nğŸ”— Download direto\nğŸ“Œ CÃ³digo NTDOWN: 14447\nğŸ“¥ Downloader: 6220831\nğŸŒ Link direto: http://aftv.news/6220831\n\nğŸ”¹ APP ZINK\n\nğŸ”— Download direto\nğŸ“Œ CÃ³digo NTDOWN: 68618\nğŸ“¥ Downloader: 1650495\nğŸŒ Link direto: http://aftv.news/1650495\n\nğŸ”¹ APP HOME PLAYER\n\nğŸ”— Download direto\nğŸ“Œ CÃ³digo NTDOWN: 28558\nğŸ“¥ Downloader: 8845054\nğŸŒ Link direto: http://aftv.news/8845054\n\nAcesso via usuÃ¡rio e senha:\n\nâœ… UsuÃ¡rio: 532253053\nâœ… Senha: 697159542\n\n\nâ—¾ *Link (M3U):* http://z01.shop/get.php?username=532253053&password=697159542&type=m3u_plus&output=mpegts\n\nâ—¾ *Link (M3U):* http://z01.shop/get.php?username=532253053&password=697159542&type=m3u_plus&output=mpegts\n\nâ—¾ *Link Curto (M3U):* http://e.z01.shop/p/532253053/697159542/m3u\n\nâ—¾ *Link (HLS):* http://z01.shop/get.php?username=532253053&password=697159542&type=m3u_plus&output=hls\n\nâ—¾ *Link Curto (HLS):* http://e.z01.shop/p/532253053/697159542/hls\n\nâ—¾ *Link (SSIPTV):* http://e.z01.shop/p/532253053/697159542/ssiptv\n\nFÃŠNIX ã€½ï¸"
        }
    ]
}